answer,subject,choice_3,choice_2,choice_1,choice_0,question
3,college_mathematics,صرف III,صرف II اور III,صرف I اور III,صرف I اور II,"مساوات m • n = m + n + mn کے ذریعہ Z پر ایک بائنری آپریشن کی وضاحت کریں۔ جس میں سے
درج ذیل بیانات بائنری ڈھانچے (Z, • ) کے بارے میں درست ہیں؟
I. یہ ڈھانچہ گروپ نہیں ہے کیونکہ آپریشن ایسوسی ایٹیو نہیں ہے۔
II یہ ڈھانچہ ایک گروپ نہیں ہے کیونکہ کوئی شناختی عنصر نہیں ہے۔
III یہ ڈھانچہ ایک گروپ نہیں ہے کیونکہ تمام عناصر میں الٹا نہیں ہوتا ہے۔
چہارم یہ ڈھانچہ ایک گروپ ہے۔"
3,college_mathematics,36/7 دن,41/8 دن,5 دن,9/2 دن,GRE ریاضی کا پریکٹس ٹیسٹ لکھنے میں Kate k دن لگتے ہیں۔ جان جے کو GRE ریاضی کا پریکٹس ٹیسٹ لکھنے میں دن لگتے ہیں۔ اگر کیٹ اور جان متبادل 2 دن کی شفٹوں میں پریکٹس ٹیسٹ پر کام کرتے ہیں، تو کیٹ کے شروع ہونے پر انہیں 10 دن اور جان کے شروع ہونے پر 10.5 دن لگتے ہیں۔ اگر کیٹ اور جان ایک ساتھ کام کریں تو دونوں کو پریکٹس ٹیسٹ مکمل کرنے میں کتنا وقت لگے گا؟
0,college_mathematics,pi,sqrt(2),1,1/2,ایک مثلثی خطہ کا سب سے بڑا ممکنہ رقبہ کیا ہے جس کے دائرے میں رداس 1 کے مرکز میں ایک چوٹی اور دوسرے دو عمودی دائرے پر ہیں؟
0,college_mathematics,f کی مطلق کم از کم ہے (2/3، 2/3)۔,"f کا رشتہ دار کم از کم (0, 0) ہے۔",f کا پیرابولا x = y^2 پر اپنا تمام رشتہ دار ایکسٹریما ہے۔,f کی لائن x = y پر اس کے تمام رشتہ دار ایکسٹریما ہیں۔,"تمام حقیقی x اور y کے لیے f(x,y) = x^2 - 2xy + y^3 دیں۔ مندرجہ ذیل میں سے کون سا سچ ہے؟"
1,college_mathematics,15,12,6,5,5 اشیاء کی ترتیب کے گروپ میں عنصر کی سب سے بڑی ترتیب کیا ہے؟
2,college_mathematics,S(n) کسی بھی n >= n0 کے لیے درست نہیں ہے۔,S(n) کسی بھی n <= n0 کے لیے درست نہیں ہے۔,S(n0 - 1) درست نہیں ہے۔,S(n0 + 1) درست نہیں ہے۔,S(n) مثبت عدد n کے بارے میں ایک بیان ہے کہ جب بھی S(k) سچ ہے، S(k + 1) بھی درست ہونا چاہیے۔ مزید برآں، کچھ مثبت عدد n0 موجود ہے جیسے کہ S(n0) درست نہیں ہے۔ مندرجہ ذیل میں سے، کون سا مضبوط ترین نتیجہ اخذ کیا جا سکتا ہے؟
1,college_mathematics,(5/6، 1/3، 1/3),(7/15، 8/15، 1/15),(3/7، 3/14، 9/14),(0، 0، 1),xyz-space میں، ہوائی جہاز 2x + y + 3z = 3 پر نقطہ کے کون سے نقاط ہیں جو اصل کے قریب ہے؟
1,college_mathematics,صرف 4، 6، 8 اور 10 کے لیے,صرف 3، 5، 7، 9، اور 11 کے لیے,صرف 3، 5، 7 اور 11 کے لیے,اس طرح کے کسی عدد کے لیے n,کن عدد n کے لیے اس طرح کہ 3 <= n <= 11 آرڈر n کا صرف ایک گروپ ہے (آسومورفزم تک)؟
2,college_mathematics,4,3,2,1,درخت ایک منسلک گراف ہے جس میں کوئی سائیکل نہیں ہے۔ 5 عمودی خطوں والے کتنے نان سومورفک درخت موجود ہیں؟
3,college_mathematics,I، II، اور III,صرف III,صرف II,صرف میں,فرض کریں کہ A اور B n x n invertible میٹرکس ہیں، جہاں n > 1، اور I n x n شناختی میٹرکس ہے۔ اگر A اور B ایک جیسے میٹرکس ہیں، تو درج ذیل میں سے کون سا بیان درست ہونا چاہیے؟	I. A - 2I اور B - 2I ایک جیسے میٹرکس ہیں۔ II A اور B میں ایک ہی نشان ہے۔	 III A^-1 اور B^-1 ملتے جلتے میٹرک ہیں۔
3,college_mathematics,(x^2 + y^2 + z^2 + 8)^2 = 36(x^2 + y^2),(x^2 + y^2 + z^2 + 8)^2 = 36(x^2 + z^2),(x^2 + y^2 + z^2)^2 = 8 + 36(x^2 + z^2),x^2 + y^2 + z^2 + 8 = 6y,yz-plan میں C کو دائرہ ہونے دیں جس کی مساوات (y - 3)^2 + z^2 = 1 ہے۔ اگر C z-محور کے گرد گھومتا ہے، تو پیدا ہونے والی سطح ٹورس ہے۔ اس ٹورس کی مساوات کیا ہے؟
0,college_mathematics,y = x + 1,y = x + 2,y = 2x,y = 2x + 1,درج ذیل میں سے کون سی لائن ٹینجنٹ کی y = x + e^x کے گراف پر x = 0 کی مساوات ہے؟
0,college_mathematics,5,4,3,2,V کو تمام حقیقی 2 x 3 میٹرکس کی حقیقی ویکٹر اسپیس ہونے دیں، اور W کو تمام حقیقی 4 x 1 کالم ویکٹر کی حقیقی ویکٹر اسپیس ہونے دیں۔ اگر T V سے W میں ایک لکیری تبدیلی ہے، تو T کے ذیلی خلائی دانا کا طول و عرض کیا ہے؟
0,college_mathematics,جھوٹا، جھوٹا۔,جھوٹا، سچ,درست غلط,سچ ہے، سچ ہے۔,"بیان 1 |  فرض کریں ∑|a_i| diverges اور ∑ a_i = 2۔ اصطلاحات کی a_i_k کی دوبارہ ترتیب ہے جیسے کہ ∑ a_i_k = 4۔ بیان 2 | یہاں میٹرک اسپیسز X اور Y موجود ہیں جن میں X بند اور باؤنڈڈ ہے اور ایک مسلسل میپنگ f : X → Y اس طرح کہ f(X) ""بند اور پابند"" نہیں ہے۔"
2,college_mathematics,4,3,2,1,Euclidean جہاز میں محدب 10-gon میں شدید زاویوں کی زیادہ سے زیادہ تعداد ہے
1,college_mathematics,ایک کھلا محدود وقفہ,ایک کرن,ایک نقطہ,مکمل حقیقی محور,اگر f(z) ایک تجزیاتی فنکشن ہے جو پورے محدود پیچیدہ طیارے کو حقیقی محور میں نقشہ بناتا ہے، تو خیالی محور کو اس پر نقشہ بنانا ضروری ہے
3,college_mathematics,ابیلیان,آرڈر دو کے,چکری,محدود,ایک گروپ G جس میں (ab)^2 = a^2b^2 تمام کے لیے a، B میں G لازمی ہے
3,college_mathematics,8,5,4,3,"اگر f کھلے وقفے (-1, 4) پر متعین ایک مسلسل تفریق کرنے والا حقیقی قدر والا فعل ہے جیسے کہ f(3) = 5 اور f'(x) ≥ -1 تمام x کے لیے، f کی سب سے بڑی ممکنہ قدر کیا ہے؟ (0)؟"
0,college_mathematics,صرف II اور III,صرف I اور II,صرف III,صرف II,"فرض کریں کہ A اور B حقیقی اندراجات کے ساتھ n × n میٹرکس ہیں۔ مندرجہ ذیل میں سے کون صحیح ہیں؟
I. A^2 کا ٹریس غیر منفی ہے۔
II اگر A^2 = A، تو A کا ٹریس غیر منفی ہے۔
III AB کا ٹریس A اور B کے نشانات کی پیداوار ہے۔"
3,college_mathematics,7,5,3,1,نمبر 7^25 کی معیاری اعشاریہ توسیع میں اکائیوں کا ہندسہ کیا ہے؟
0,college_mathematics,جھوٹا، جھوٹا۔,جھوٹا، سچ,درست غلط,سچ ہے، سچ ہے۔,"بیان 1 | f : X → Y مسلسل ہے اور X کمپیکٹ ہے۔ f یکساں طور پر مسلسل ہونا چاہیے۔ بیان 2 | اگر f(x), g(x) : R → R ہر جگہ قابل تفریق ہیں f(g(x)) ہر جگہ قابل تفریق ہونا چاہیے۔"
1,college_mathematics,2π/3,π/3,π/6,π/12,xy-ہوائی جہاز کے پہلے کواڈرینٹ میں منحنی خطوط y = x اور y = x^2 سے جڑا ہوا خطہ y محور کے گرد گھمایا جاتا ہے۔ انقلاب کے نتیجے میں ٹھوس کا حجم ہے۔
1,college_mathematics,3/2,3pi,pi,3,xy-plan میں، پیرامیٹرک مساوات x = cos t اور y = sin t، 0 <= t <= pi کے ساتھ وکر، لمبائی ہے
2,college_mathematics,(II) اور (III),(I) اور (IV),صرف (IV),صرف (II),"مندرجہ ذیل میں سے کون سے پاور سیریز کے لیے کنورژنس کے درست وقفے ہیں؟
(I) [−1، 3)
(II) (−∞, 0]
(III) [2, 2] ∪ [3, 3]
(IV) (−∞,∞)"
3,college_mathematics,مندرجہ بالا میں سے کوئی بھی نہیں۔,R کا کوئی بے شمار ذیلی سیٹ E موجود نہیں ہے جیسا کہ f ہر x \ میں E پر ناقابل تفریق ہے۔,R کا کوئی بے شمار لامحدود E موجود نہیں ہے جیسا کہ f ہر x \ میں E پر ناقابل تفریق ہے۔,f ریمن انٹیگریبل ہے۔,اگر f: R -> R ایک پابند فنکشن ہے جو Lebesgue integrable ہے، تو مندرجہ ذیل میں سے کون سا سچ ہونا چاہیے؟
0,college_mathematics,ایک نقطہ,کھلے پہلے کواڈرینٹ میں ایک کرن,ایک بند وکر,کھلا پہلا کواڈرینٹ,xy-plan میں، x^(log y) = y^log x کا گراف ہے۔
1,college_mathematics,انفینٹی,p >= 1,2,1,کس p کے لیے معیاری ہے ||x||_p ایک اندرونی مصنوعات کے طور پر قابل اظہار ہے؟
2,college_mathematics,f ایک سے ایک ہے۔,f مسلسل ہے۔,f مسلسل اور ایک سے ایک ہے۔,f ایک ہومومورفزم ہے۔,آئیے S کو ایک کمپیکٹ ٹاپولوجیکل اسپیس ہونے دیں، T کو ٹاپولوجیکل اسپیس ہونے دیں، اور f کو S سے T تک ایک فنکشن ہونے دیں۔ f پر درج ذیل شرائط میں سے، کون سی کمزور ترین شرط ہے جو T کی کمپیکٹ پن کو یقینی بنانے کے لیے کافی ہے؟
2,college_mathematics,16*sqrt(3),12*sqrt(3),16,12,ایک مساوی مثلث کا رقبہ کیا ہے جس کے کندہ دائرے کا رداس 2 ہے؟
0,college_mathematics,12,8,7,4,n کی کس قدر کے لیے isomorphism تک n آرڈر کے بالکل دو ابیلیئن گروپ ہیں؟
3,college_mathematics,|x + y| = |x| + |y|,|x| = 0 اگر اور صرف اگر x = 0,|x · y| ≤ |x||y|,|x| ≥ 0,مندرجہ ذیل میں سے کون ہمیشہ x، y، z ∈ R^k کے لیے درست نہیں ہوتا؟
1,college_mathematics,7,6,5,4,V کو معمول کے آپریشنز کے تحت، حقیقی کثیر الاضلاع کی جگہ مانیں جو زیادہ سے زیادہ 3 کی ڈگری کے ہوں۔ (-1) = 0۔ پھر dim V + dim W ہے۔
3,college_mathematics,صرف 0، 1، اور 2,صرف 0 اور 1,صرف 2,صرف 1,اگر V اور W R^4 کے 2 جہتی ذیلی اسپیس ہیں، تو ذیلی جگہ V کی ممکنہ جہتیں W کو کاٹتی ہیں؟
2,college_mathematics,3π/2,4,π,2,منحنی خطوط y = (sin x + cos x)^4 اور y = (sin x - cos x)^4 x = 0 پر ایک دوسرے کو کاٹتے ہیں۔ اگر a x کی سب سے چھوٹی مثبت قدر ہے جس پر یہ منحنی خطوط ایک دوسرے کو آپس میں ملاتے ہیں تو رقبہ کا تعین کریں۔ ان منحنی خطوط کے درمیان x = 0 سے x = a۔
0,college_mathematics,-5,0,8,9,"اگر f ہوائی جہاز سے حقیقی اعداد میں ایک لکیری تبدیلی ہے اور اگر f(1, 1) = 1 اور f(-1, 0) = 2، تو f(3, 5) ="
1,college_mathematics,تین,دو,ایک,کوئی نہیں۔,کثیر الجہتی 2x^5 + 8x - 7 کی کتنی حقیقی جڑیں ہیں؟
0,college_mathematics,10^(20) - 100,10^(20) - 2^(10),10!/2^9,20!/2^(10),ایک یونیورسٹی کے شعبہ ریاضی کے 10 پروفیسرز ہیں اور اگلے سمسٹر میں 20 مختلف کورسز پیش کریں گے۔ ہر پروفیسر کو بالکل 2 کورسز پڑھانے کے لیے تفویض کیا جائے گا، اور ہر کورس میں بالکل ایک پروفیسر کو پڑھانے کے لیے تفویض کیا جائے گا۔ اگر کسی بھی پروفیسر کو کسی بھی کورس کو پڑھانے کے لیے تفویض کیا جا سکتا ہے، تو 20 کورسز میں 10 پروفیسرز کی کتنی مختلف مکمل اسائنمنٹس ممکن ہیں؟
0,college_mathematics,دونوں (a) اور (b)۔,نہ (a) اور نہ ہی (b),"پیچیدہ نمبر C پر ایک لکیری ترتیب کا رشتہ رکھنا ممکن ہے جو (C, +, ×, ≤) کو ایک ترتیب شدہ فیلڈ بناتا ہے۔","پیچیدہ نمبر C پر ایک لکیری ترتیب کا رشتہ ≤ رکھنا ممکن ہے اس طرح کہ (C, +, ×, ≤) ایک ترتیب شدہ فیلڈ نہیں ہے۔",مندرجہ ذیل میں سے کون سچے ہیں:
3,college_mathematics,2/3,1/2,1/3,1/4,ایک کھیل میں دو کھلاڑی ایک مناسب سکہ اچھالتے ہوئے باری باری لیتے ہیں۔ فاتح سر ٹاس کرنے والا پہلا ہے۔ اس بات کا امکان ہے کہ جو کھلاڑی پہلا ٹاس کرتا ہے وہ کھیل جیت جاتا ہے۔
1,college_mathematics,اضافی کے تحت پیچیدہ اعداد,ضرب کے تحت غیر صفر حقیقی اعداد,ضرب کے تحت غیر صفر عدد,جمع کے تحت عدد,مندرجہ ذیل میں سے کون سا گروپ نہیں ہے؟
3,college_mathematics,4x - 9 سال,9x + 4y,x + y + 5,4x + 6y,چلیں x اور y کو مثبت عدد اس طرح کہ 3x + 7y 11 سے قابل تقسیم ہے۔
2,college_mathematics,-sqrt(35),-sqrt(34),-2,0,ایکسپریشن x + 4z کی کم از کم قدر کیا ہے بطور فنکشن R^3 پر بیان کیا گیا ہے، جو کہ رکاوٹ x^2 + y^2 + z^2 <= 2 ہے؟
3,college_mathematics,صرف I اور III,صرف I اور II,صرف III,صرف II,"R کو ایک انگوٹھی بننے دیں اور U اور V کو R کے (دو رخا) آئیڈیل ہونے دیں۔
I. {u + v : u \in اور v \in V}
II {uv: u \in U اور v \in V}
III {x : x \ میں U اور x \ میں V}"
0,college_mathematics,2π,π,π/4,π/3,x-axis اور فنکشن f(x) = x/(1 + x^3) سے جکڑا ہوا خطہ x-محور کے گرد گھمایا جاتا ہے۔ پیدا ہونے والے ٹھوس کا حجم کیا ہے؟
0,college_mathematics,بدھ,منگل,پیر,اتوار,فرض کریں کہ آج بدھ ہے۔ اب سے 10^(10^(10)) دن ہفتے کا کون سا دن ہوگا؟
3,college_mathematics,−16/(3π) سینٹی میٹر/منٹ,−8/(3π) سینٹی میٹر/منٹ,−4/(3π) سینٹی میٹر/منٹ,−48/π سینٹی میٹر/منٹ,"پانی 3 سینٹی میٹر^3 فی منٹ کی شرح سے الٹے شنک کی چوٹی پر ایک سوراخ سے ٹپکتا ہے۔ دی
شنک کی اونچائی اور رداس بالترتیب 2 سینٹی میٹر اور 1 سینٹی میٹر ہیں۔ پانی کی اونچائی کس شرح سے تبدیل ہوتی ہے۔
جب پانی کی سطح شنک کے اوپری حصے سے آدھا سینٹی میٹر نیچے ہے؟ مخروط کا حجم V = (π/3)*r^2*h ہے،
جہاں r رداس ہے اور h شنک کی اونچائی ہے۔"
3,college_mathematics,ہر حل (-5، 1، 1، 0) کا اسکیلر ملٹیپل ہوتا ہے۔,کسی بھی دو حلوں کا مجموعہ ایک حل ہے۔,سسٹم میں بے شمار حل ہیں۔,نظام یکساں ہے۔,"لکیری مساوات کے نظام پر غور کریں۔
w + 3x + 2y + 2z = 0
w + 4x + y = 0
3w + 5x + 10 y + 14z = 0
2w + 5x + 5y + 6z = 0
فارم کے حل کے ساتھ (w, x, y, z)، جہاں w x، y، اور z اصلی ہیں۔ مندرجہ ذیل میں سے کون سا بیان غلط ہے؟"
3,college_mathematics,f(log c),f(1/c),f(e^c),f(c),اگر c > 0 اور f(x) = e^x - cx تمام حقیقی اعداد x کے لیے، تو f کی کم از کم قدر ہے
3,college_mathematics,صرف I اور II,صرف III,صرف II,صرف میں,"فرض کریں A ایک 3 × 3 میٹرکس ہے جیسا کہ det(A − λI) = −λ^3 + 3λ^2 + λ −3، جہاں I 3 × 3 شناختی میٹرکس ہے۔ مندرجہ ذیل میں سے کون سے A کے TRUE ہیں؟
I. A کا سراغ 3 ہے۔
II A کا تعین −3 ہے۔
III میٹرکس A میں eigenvalues ​​−3 اور 1 ہیں۔"
2,college_mathematics,2e,e^2/2,1/e,1/(2e),y = f(x) کو تفریق مساوات x dy + (y - xe^x) dx = 0 کا حل مانیں کہ y = 0 جب x = 1۔ f(2) کی قدر کیا ہے؟
3,college_mathematics,H >= 48 اور T >= 48,51 <= H <= 55,T >= 60,H = 50,ایک منصفانہ سکے کو 100 بار پھینکنا ہے، ہر ٹاس کے نتیجے میں سر یا دم ہوتا ہے۔ اگر H سروں کی کل تعداد ہے اور T دموں کی کل تعداد ہے، تو مندرجہ ذیل واقعات میں سے کس کا سب سے زیادہ امکان ہے؟
3,college_mathematics,جھوٹا، جھوٹا۔,جھوٹا، سچ,درست غلط,سچ ہے، سچ ہے۔,"بیان 1 | فرض کریں f : [a, b] ایک فنکشن ہے اور فرض کریں کہ f کی مقامی زیادہ سے زیادہ ہے۔ f'(x) موجود ہونا چاہیے اور برابر 0؟ بیان 2 | R سے Q تک غیر مستقل مسلسل نقشے موجود ہیں۔"
2,college_mathematics,-1,0,1,2,آئیے != A != -I، جہاں I شناختی میٹرکس ہے اور A ایک حقیقی 2 x 2 میٹرکس ہے۔ اگر A = A^(-1)، تو A کا ٹریس ہے۔
1,college_mathematics,x^2,x^2/4,x^2/8,x^2/9,باڑ کا کل x فٹ ایک سطحی مستطیل صحن کے تین اطراف بنانا ہے۔ x کے لحاظ سے یارڈ کا زیادہ سے زیادہ ممکنہ رقبہ کیا ہے؟
1,college_mathematics,جھوٹا، جھوٹا۔,جھوٹا، سچ,درست غلط,سچ ہے، سچ ہے۔,"بیان 1 | اگر A جڑا ہوا ہے تو A کا بند ہونا لازمی ہے۔ بیان 2 | ہر مسلسل فعل f : (0, 1) → (0, 1) کا ایک مقررہ نقطہ ہوتا ہے۔"
2,college_mathematics,R کے تمام محدود ذیلی سیٹوں کا سیٹ,R سے {0، 1} تک تمام افعال کا سیٹ,Z سے ​​Z تک تمام فنکشنز کا سیٹ,آر,مندرجہ ذیل سیٹوں میں سے کون سا سب سے بڑا کارڈنلٹی ہے؟
1,college_mathematics,36,32,30,24,چلیں f(x) ایک فنکشن ہے جس کا گراف اصل سے گزرتا ہے۔ اگر f(2n) = n^2 + f[2(n - 1)] ہر عدد n کے لیے، f(8) کی قدر کیا ہے؟
1,college_mathematics,9,8,6,4,کتنے ساختی طور پر الگ ایبیلین گروپس کا آرڈر 72 ہے؟
2,college_mathematics,37,35,28,27,اگر محدود گروپ G میں ترتیب سات کا ذیلی گروپ ہے لیکن کوئی عنصر (شناخت کے علاوہ) اس کا اپنا الٹا نہیں ہے، تو G کی ترتیب ہو سکتی ہے
2,college_mathematics,P پر مقامی کم از کم اور Q پر ایک سیڈل پوائنٹ,P پر مقامی زیادہ سے زیادہ اور Q پر ایک سیڈل پوائنٹ,سیڈل پوائنٹ P اور Q پر,مقامی زیادہ سے زیادہ P اور Q پر,"تمام حقیقی x اور y کے لیے f(x, y) = x^3 + y^3 + 3xy دیں۔ پھر الگ الگ پوائنٹس موجود ہیں P اور Q اس طرح کہ f میں a ہے۔"
1,college_mathematics,اگر A بے شمار ہے، تو A کھلا ہوا ہے۔,اگر A بے شمار ہے، تو A = R۔,اگر A بند ہے تو A = R۔,اگر A کھلا ہے، تو A = R۔,اگر A اصلی لائن R کا ذیلی سیٹ ہے اور A میں ہر ایک ناطق نمبر ہے، تو درج ذیل میں سے کون سا درست ہونا چاہیے؟
0,college_mathematics,M کا تعین کنندہ غیر صفر ہے۔,مساوات کا نظام Mx = b ہر حقیقی 5 x 1 کالم ویکٹر b کے لیے ایک منفرد حل رکھتا ہے۔,یکساں نظام Mx = 0 میں صرف معمولی حل ہے۔,"M کے کسی بھی دو الگ الگ کالم ویکٹر u اور v کے لیے، سیٹ {u, v} لکیری طور پر آزاد ہے۔",M کو 5 x 5 اصلی میٹرکس ہونے دیں۔ M پر درج ذیل پانچ میں سے بالکل چار شرائط ایک دوسرے کے مساوی ہیں۔ پانچ میں سے کون سی شرائط باقی چار میں سے کسی کے برابر نہیں ہیں؟
2,college_mathematics,49,31,15,1,کتنے مثبت اعداد x مساوات cos(97x) = x کو پورا کرتے ہیں؟
2,college_mathematics,انگوٹھی {a + b * sqrt(2): a اور b ناطق اعداد ہیں},"[0, 1] پر مسلسل حقیقی قدر والے افعال کی انگوٹھی",عدد کی انگوٹھی ماڈیولو 11,پیچیدہ اعداد کی انگوٹھی,مندرجہ ذیل میں سے کس حلقے کے لیے دو غیر صفر عناصر کی پیداوار کا صفر ہونا ممکن ہے؟
2,college_mathematics,a^2 = a,a^3 = e,G = {e},جی ابیلیان ہے۔,ایک گروپ G کا نقشہ x -> axa^2 بذات خود ایک ہومومورفزم ہے اگر اور صرف اس صورت میں
1,college_mathematics,2,0,-1,-2,اگر A وہ 2 بائی 2 میٹرکس ہے جس کا (i، j) اندراج i + j کے برابر ہے، اور B وہ 3 بائی 3 میٹرکس ہے جس کا (i، j) اندراج i + j کے برابر ہے، رقم کی قدر معلوم کریں۔ detA + detB۔
2,college_mathematics,صرف I اور III,صرف I اور II,صرف II,صرف میں,"اگر f : (0, 1) → (0, 1]، تو مندرجہ ذیل میں سے کون سا سچ ہو سکتا ہے؟
I. f ون ٹو ون اور آن ٹو ہے۔
II f کی تصویر کمپیکٹ ہے۔
III f مسلسل ہے، ایک سے ایک، اور پر۔"
2,college_mathematics,2/3,5/8,7/12,1/2,"اگر وقفہ [0, 3] میں بے ترتیب طور پر ایک حقیقی نمبر x کا انتخاب کیا جاتا ہے اور وقفہ [0, 4] میں بے ترتیب طور پر حقیقی نمبر y کا انتخاب کیا جاتا ہے، تو اس کا کیا امکان ہے کہ x < y؟"
1,college_mathematics,1/sqrt(2),sqrt(2)/4,1/4,0,"امکان کہ R^2 میں ایک نقطہ (x, y) کا انتخاب خطے کے اندر ایک یکساں بے ترتیب تقسیم کی پیروی کرتا ہے جسے عدم مساوات 0 < |x| + |y| < 1 کیا امکان ہے کہ 2(x + y) > 1؟"
3,college_mathematics,32i,32,میں,1,(1+i)^10 =
3,college_mathematics,1، 2، یا 3,0 یا 1,1,0,اگر U اور V R^5 کی 3 جہتی ذیلی جگہیں ہیں تو U ∩ V کی ممکنہ جہتیں کیا ہیں؟
2,college_mathematics,مکمل طور پر منقطع,منسلک,کھلا,بند,"آئیے S کو R^2 کا ذیلی سیٹ سمجھیں جو یونٹ مربع [0, 1] × [0, 1] میں تمام پوائنٹس (x, y) پر مشتمل ہے جس کے لیے x یا y، یا دونوں، غیر معقول ہیں۔ R^2 پر معیاری ٹوپولوجی کے حوالے سے، S ہے۔"
2,college_mathematics,x^2 + y^2 = 16,x^2 + y^2 = 9,x^2 + y^2 = 2,x^2 + y^2 = 1,مندرجہ ذیل میں سے کون سا دائرہ پیرابولا x^2 = y + 4 کے ساتھ مقطع کے پوائنٹس کی سب سے زیادہ تعداد رکھتا ہے؟
3,college_mathematics,35,28,25,24,X درج ذیل خاصیت کے ساتھ ایک محدود سیٹ ہے: X کے ذیلی سیٹوں کی تعداد جس میں بالکل 3 عناصر ہوتے ہیں X کے ذیلی سیٹوں کی تعداد سے 14 زیادہ ہے جس میں بالکل 2 عناصر ہوتے ہیں۔ X کے کتنے ذیلی سیٹ بالکل 4 عناصر پر مشتمل ہیں؟
0,college_mathematics,(-4، 3),(3، 2),(-1، 4),(1، 6),"آئیے T: R^2 -> R^2 کو لکیری تبدیلی ہے جو نقطہ (1, 2) سے (2, 3) اور نقطہ (-1, 2) سے (2, -3) کا نقشہ بناتی ہے۔ پھر T نقطہ (2، 1) کو نقشہ بناتا ہے۔"
1,college_medicine,انسان دوستی,علمی سلوک,نفسیاتی,سلوک کرنے والا,ایک پولیس افسر ہر سال سیکڑوں ٹریفک اسٹاپ کرتا ہے۔ جب اس کا سپروائزر پچھلے سال کے افسر کے ریکارڈ کا جائزہ لے رہا ہے، تو اس نے دیکھا کہ افسر مختلف جنسوں، عمروں اور نسلوں کے لوگوں کو روکنے کا یکساں امکان رکھتا ہے۔ تاہم، وہ سیاہ بالوں اور آنکھوں والے درمیانی عمر کے سفید فام مردوں کے لیے ٹکٹ لکھنے کا نمایاں طور پر زیادہ امکان رکھتا ہے۔ جب اس حقیقت کا سامنا ہوتا ہے، تو افسر سچائی سے کہتا ہے کہ اسے اس بات کا کوئی علم نہیں ہے کہ ایسا کیوں ہے، اور یہ محض اتفاق ہونا چاہیے۔ افسر کے بارے میں ناواقف، یہ رویہ اس حقیقت سے جڑا ہوا ہے کہ یہ لوگ اس کے والد کی طرح نظر آتے ہیں، جن کے ساتھ اس کے بچپن میں ناروا تعلقات تھے۔ کون سا نفسیاتی فریم ورک اس کے رویے میں لاشعوری تعصب کو براہ راست حل کرے گا؟
3,college_medicine,ڈبلیو جی جارج,جے ڈی میگیو,ایس کو,آر بینسٹر,1886 میں میل ریس کا عالمی ریکارڈ کس نے بنایا؟
3,college_medicine,صرف I اور III,صرف III,صرف II,صرف میں,"مندرجہ ذیل میں سے کون سا بیان کیمیائی طور پر مبنی حسی نظام کی نشاندہی کرتا ہے؟
I. معدے کا نظام
II سمعی نظام
III ولفیٹری سسٹم"
