answer,subject,choice_3,choice_2,choice_1,choice_0,question
3,clinical_knowledge,شاگرد کا جواب۔,بہترین موٹر جواب۔,زبانی جواب۔,آنکھ کھلنا۔,مندرجہ ذیل میں سے کون سا زمرہ نہیں ہے جو گلاسگو کوما اسکیل کے مطابق مریضوں کی درجہ بندی کے لیے استعمال کیا جاتا ہے؟
0,clinical_knowledge,ٹیپنگ اپیکس بیٹ؛ اونچی پہلی دل کی آواز؛ پین سیسٹولک گنگناہٹ؛ لمبی درمیانی ڈائیسٹولک گنگناہٹ,بے گھر اپیکس بیٹ؛ عام پہلی دل کی آواز؛ پین سیسٹولک گنگناہٹ؛ لمبی درمیانی ڈائیسٹولک گنگناہٹ,بے قاعدہ، بے قاعدہ نبض؛ بے گھر اپیکس بیٹ؛ انجیکشن سسٹولک گنگناہٹ؛ مختصر وسط diastolic گنگناہٹ,بے گھر اپیکس بیٹ؛ نرم پہلی دل کی آواز؛ پین سیسٹولک گنگناہٹ؛ مختصر وسط diastolic گنگناہٹ,طبی خصوصیات کے ان مجموعوں میں سے کون سا مرکب مائٹرل والو کی بیماری کا سب سے زیادہ تجویز کرتا ہے جس میں mitral regurgitation کی برتری ہے؟
0,clinical_knowledge,پیشاب کی پیداوار میں اضافہ.,درد سے متعلق مسائل کی تعدد میں کمی جیسے متلی اور الٹی۔,analgesia کے استعمال میں اضافہ.,اضطراب اور درد کی شدت میں کمی۔,دردناک طریقہ کار سے گزرنے سے پہلے، مریض کو اس بارے میں مطلع کیا جانا چاہیے کہ کس چیز کی توقع کی جائے اور اس کے درد کو کیسے کنٹرول کیا جائے گا، جیسا کہ یہ اس سے منسلک ہے:
1,clinical_knowledge,اے ٹی پی کے اڑتیس مالیکیولز۔,اے ٹی پی کے تین مالیکیول۔,اے ٹی پی کے دو مالیکیول۔,پانی کے چھ مالیکیول,گلوکوز کے ایک مالیکیول کو پائروویٹ کے دو مالیکیولز میں تبدیل کرنے کے نتیجے میں ان کی خالص تشکیل ہوتی ہے:
0,clinical_knowledge,3 گلوکوز سے اور 2 گلائکوجن سے۔,3 گلوکوز سے اور 4 گلائکوجن سے۔,2 گلوکوز سے اور 4 گلائکوجن سے۔,2 گلوکوز سے اور 3 گلائکوجن سے۔,گلائکولیسس میں سبسٹریٹ لیول فاسفوریلیشن کے ذریعے اے ٹی پی کی خالص پیداوار یہ ہے:
0,clinical_knowledge,ملاشی کا کینسر ملاشی سے خون بہنے کی سب سے عام وجہ ہے۔,ملاشی سے خون بہنے کی تشخیص میں پروٹوسکوپی کی کوئی اہمیت نہیں ہے۔,انگلی پر چمکدار سرخ خون عام طور پر کیکل زخم کی نشاندہی کرتا ہے۔,ایک تکلیف دہ ڈیجیٹل معائنہ مقعد میں دراڑ کی تجویز کرتا ہے۔,ملاشی سے خون بہنے کے بارے میں مندرجہ ذیل میں سے کون سا سچ ہے؟
3,clinical_knowledge,کم شرح پر بے ساختہ ہوتا ہے۔,ٹیومر کی ترقی میں اضافہ.,صرف کارسنوجینز کی موجودگی میں ہوتا ہے۔,ہمیشہ نقصان دہ ہیں.,تغیرات ڈی این اے میں ایسی خرابیاں ہیں جو:
1,clinical_knowledge,ایک دوسرے کے 30 لیٹر فی منٹ۔,ایک دوسرے کے 100 لیٹر فی منٹ۔,ایک دوسرے کے 20 لیٹر فی منٹ۔,ایک دوسرے کے 10 لیٹر فی منٹ۔,چوٹی کے بہاؤ کے نتائج کو ریکارڈ کرتے وقت، تین ریڈنگ کتنے لیٹر/منٹ کے اندر ہونی چاہیے؟
3,clinical_knowledge,کھلے منہ کے ذریعے پھیپھڑوں سے خارج ہونے والی ہوا کی بلند ترین شرح۔,جبری اہم صلاحیت.,جبری اخراج کا حجم۔,کھلے منہ کے ذریعے پھیپھڑوں سے خارج ہونے والی ہوا کی سب سے کم شرح۔,چوٹی کے بہاؤ میٹر ریکارڈ:
2,clinical_knowledge,یہ pyrexia کے مریضوں میں contraindicated ہے.,حادثاتی طور پر زیادہ مقدار کو روکنے کے لیے مریضوں کو اوور دی کاؤنٹر سردی کے علاج کے مواد کو احتیاط سے چیک کرنا چاہیے، کیونکہ ایسی تیاریوں میں اکثر اضافی پیراسیٹامول ہوتا ہے۔,یہ صرف 'ضرورت کے مطابق' کی بنیاد پر دیا جانا چاہیے۔,یہ دوسری دوائیوں جیسے وارفرین کی تاثیر میں مداخلت کر سکتا ہے۔,پیراسیٹامول لیتے وقت مریضوں کو درج ذیل میں سے کس کو یاد رکھنا چاہیے؟
3,clinical_knowledge,امینو ایسڈ,ڈی آکسیربوز,پیریمائڈائن,پورین,مندرجہ ذیل میں سے کون سا مالیکیول DNA کا حصہ نہیں بنتا؟
2,clinical_knowledge,یرقان کے ساتھ نس میں دوائی استعمال کرنے والے کے خون کے نمونوں پر انفیکشن کے خطرے کا اسٹیکر لگانا اختیاری ہے۔,خارش رکاوٹ یرقان کی علامت ہوسکتی ہے۔,بلیروبن جگر کے ذریعہ خون کے سرخ خلیوں کی ترکیب میں استعمال ہوتا ہے۔,پیلا پاخانہ اور گہرا پیشاب ہیمولیٹک انیمیا کے یرقان کی خصوصیت ہے۔,یرقان کے بارے میں مندرجہ ذیل میں سے کون سا سچ ہے؟
0,clinical_knowledge,گوانائن,یوراسل,ایڈنائن,تھامین,مندرجہ ذیل میں سے کون سا نیوکلیوٹائڈ بیس RNA میں نہیں پایا جاتا؟
1,clinical_knowledge,معیاد ختم ہونے اور الہام کے درمیان وقفے کے ساتھ ایکسپائری جزو زیادہ زور سے اور لمبا,الہام اور معیاد کے درمیان وقفہ کے ساتھ انسپریٹری جزو زور سے اور لمبا,الہام اور معیاد ختم ہونے کے درمیان وقفہ کے ساتھ ایکسپائری جزو زور سے اور لمبا,معیاد ختم ہونے اور الہام کے درمیان وقفے کے ساتھ انسپریٹری جزو زیادہ زور سے اور لمبا,Bronchial سانس لینے کی طرف سے خصوصیات ہے
2,clinical_knowledge,بھنگ۔,شراب۔,ایکسٹیسی,ہیروئن (افیون)۔,درج ذیل میں سے کون سی دوائیں ایسے مریضوں کے لیے سب سے زیادہ ذمہ دار ہیں جو شدید الجھن میں مبتلا ہیں؟
1,clinical_knowledge,بصری خیال۔,دوسروں کی بات کو سمجھنا۔,شکلیں کھینچنے کی صلاحیت۔,نیند/جاگنے کا چکر۔,دماغ کے پرانتستا کا فرنٹل لاب مندرجہ ذیل میں سے کس کے لیے ذمہ دار ہے؟
0,clinical_knowledge,اسکافائیڈ، رداس، النا، کینیفارم، ٹریپیزیئس۔,اسکافائیڈ، پراکسیمل فیلانکس، ہیومرس، ہمیٹ، کیپیٹیٹ۔,اسکافائیڈ، لونیٹ، ٹرائیکیٹرم، پیسیفارم، رداس، النا، کیپٹیٹ۔,اسکافائیڈ، لونیٹ، ٹرائیکوٹرل، پیسیفارم، ٹراپیزیم، ٹراپیزائڈ، کیپیٹیٹ، ہیمیٹ۔,کارپل ہڈیاں کلائی کی چھوٹی ہڈیاں ہیں - ان کے نام بتائیں۔
0,clinical_knowledge,کرومیٹن، ڈی این اے اور امینو ایسڈ۔,ڈی این اے، ایم آر این اے اور آر این اے پولیمریز۔,mRNA، ribosomes اور RNA پولیمریز۔,mRNA، tRNA اور رائبوزوم۔,ترجمے کے عمل کے لیے اس کی موجودگی کی ضرورت ہوتی ہے:
3,clinical_knowledge,جب مہر بند شیشی سے دوائیں نکالی جاتی ہیں تو ربڑ کے بنگ کے ٹکڑے سوئی کے ذریعے کاٹ سکتے ہیں۔,براہ راست خون میں ادویات کی ترسیل۔,مطلوبہ اثر کے ساتھ دوا کا ٹائٹریشن۔,فلیبائٹس کی علامت۔,'کورنگ' کیا ہے؟
2,clinical_knowledge,کف فلایا ہوا ہے۔,کف خراب ہو گیا ہے۔,ٹریچیوسٹومی ٹیوب کو پہلی بار ڈالے جانے کے سات دن بعد ہے۔,کہ مریض ٹھیک طرح سے نگل سکتا ہے۔,سپیکنگ والو استعمال کرنے سے پہلے آپ کو کیا یقینی بنانا چاہیے؟
2,clinical_knowledge,دوا اور سیال انتظامیہ دونوں کے لیے کبھی بھی نس کے ذریعے کینول کا استعمال نہیں کرنا چاہیے۔,IV انتظامیہ منشیات کے مطلوبہ اثر کے ساتھ ٹائٹریشن کی اجازت دیتی ہے۔,IV انتظامیہ میں بیکٹیریمیا کا خطرہ کم ہوتا ہے۔,ایک دوائی کی IV انتظامیہ اس کے عمل میں تاخیر کرے گی۔,مندرجہ ذیل میں سے کون سا بیان نس کے ذریعے منشیات کے استعمال کے حوالے سے درست ہے؟
3,clinical_knowledge,اوپر کا سارا۔,بعض دھاتی آئنوں کی موجودگی۔,پی ایچ,درجہ حرارت,مندرجہ ذیل میں سے کون سے عوامل انزائم کی سرگرمی کو متاثر کر سکتے ہیں؟
3,clinical_knowledge,اے ٹی پی اسٹورز۔,فاسفوکریٹائن اسٹورز۔,کریٹائن فاسفوریلیشن,گلائکولیسس۔,1-2 سیکنڈ تک چلنے والے بہت زیادہ طاقت کے سنکچن کے لئے، ابتدائی توانائی کا ذریعہ ہے:
0,clinical_knowledge,قلبی مرکز,واسوموٹر سینٹر,chemoreceptors.,baroreceptors.,بلڈ پریشر میں تبدیلی کا پتہ لگاتے ہیں:
1,clinical_knowledge,کیتھیٹر کو ہٹا دیں اور دوبارہ کیتھیٹرائز کریں۔,مریض کو مطلع کریں۔,طبی عملے کو مطلع کریں۔,مدد کے لیے کال کریں۔,خون کے لوتھڑے کیتھیٹر کو بار بار روکنے کے لیے ذمہ دار ہیں۔ تمہیں کیا کرنا چاہئے؟
1,clinical_knowledge,6.25,12,7,3.5,پانی کا پی ایچ کیا ہے؟
3,clinical_knowledge,96 گھنٹے,48 گھنٹے,36 گھنٹے,24 گھنٹے۔,کینول کتنی دیر تک حالت میں رہ سکتا ہے؟
2,clinical_knowledge,رائبونیوکلک ایسڈ کی امینو ایسڈ کی ساخت۔,جینیاتی مواد کے ذریعہ تشکیل شدہ پروٹین۔,امینو ایسڈ کی دستیابی,سیل میں پروٹین کا سائز,میٹابولزم کا تعین اس کے ذریعہ کیا جاتا ہے:
3,clinical_knowledge,46,23,20,3,تمام انسانی سومیٹک خلیوں میں کتنے کروموسوم ہوتے ہیں؟
2,clinical_knowledge,اگر مریض ان سے درخواست کرے۔,اگر مریض کے دل کا مصنوعی والو ہے۔,اگر مریض کو پیشاب کی نالی کا انفیکشن نہ ہو۔,اگر مریض کو ایک ہفتہ تک کیتھیٹر لگا ہوا ہو۔,کیتھیٹرائزیشن سے پہلے آپ کن حالات میں اینٹی بائیوٹکس استعمال کریں گے؟
2,clinical_knowledge,گردن کی جڑ میں دبائو تحریک کو کم کرتا ہے۔,کرنسی کے ساتھ کوئی فرق نہیں۔,hepatojugular reflux کے لیے مثبت,کانوں کی ہلتی ہوئی لوب,ان میں سے کون سی خصوصیات بتاتی ہیں کہ گردن میں دھڑکن شریان ہے؟
3,clinical_knowledge,فاسفوفروکٹوکنیز,pyruvate dehydrogenase.,hexokinase.,فاسفوریلیس,گلیکولیسس کے انزائم کو محدود کرنے کی شرح یہ ہے:
1,clinical_knowledge,دوسری ڈگری کی بواسیر مقعد کی نالی میں واپس نہیں آسکتی ہے۔,پہلی ڈگری کے بواسیر سے خون بہنا درد سے وابستہ ہے۔,حمل بواسیر پیدا کرنے کا ایک پیش خیمہ عنصر ہے۔,بلیڈنگ بواسیر میلینا فی ملاشی کا باعث بنتی ہے (PR),مندرجہ ذیل میں سے کون سی بواسیر کے بارے میں درست ہے؟
2,clinical_knowledge,غیر سٹیرایڈ دوائیں جو قدرتی سٹیرایڈ ہارمونز کے اثرات کو روکنے والی اینڈروجن ریسیپٹرز پر کام کرتی ہیں۔,غیر سٹیرایڈ دوائیں جو قدرتی سٹیرایڈ ہارمونز کے اثرات کی نقل کرتے ہوئے اینڈروجن ریسیپٹرز پر کام کرتی ہیں۔,سٹیرایڈ دوائیں جو قدرتی سٹیرایڈ ہارمونز کے اثرات کے مخالف اینڈروجن ریسیپٹرز پر کام کرتی ہیں۔,سٹیرایڈ دوائیں جو قدرتی سٹیرایڈ ہارمونز کے اثرات کی نقل کرتے ہوئے اینڈروجن ریسیپٹرز پر کام کرتی ہیں۔,سلیکٹیو اینڈروجن ریسیپٹر ماڈیولرز (SARMs) ہیں:
0,clinical_knowledge,آکسیجن شامل نہیں ہے.,صرف کاربن ڈائی آکسائیڈ اور پانی پیدا کرتا ہے۔,صرف acetyl-CoA کے 16 مالیکیول حاصل کرتا ہے۔,ایسٹیل-CoA کے 8 مالیکیول اور کچھ ATP اور پانی پیدا کرتا ہے۔,پامیٹک ایسڈ، CH3(CH2)14CO2H کے مالیکیول کا β-آکسیڈیشن:
0,clinical_knowledge,امونیا، یوریا اور کریٹائن۔,امونیا، یوریا اور کریٹینائن۔,امونیا، یوریا اور یورک ایسڈ۔,امونیا، ہائپوکسینتھائن اور یورک ایسڈ۔,ایک سے زیادہ سپرنٹ کھیلوں کے دوران خون میں ارتکاز میں ADP انحطاط کی کون سی مصنوعات بڑھتی ہیں؟
2,clinical_knowledge,ٹانگیں اٹھا کر فرش پر۔,ایک مضبوط سطح پر فلیٹ.,دل کو پرفیوز رکھنے کے لیے بائیں طرف جھکا۔,نیم لیٹی ہوئی کرنسی میں۔,سی پی آر انجام دینے کے لیے بہترین پوزیشن مریض کو پوزیشن دینا ہے:
3,clinical_knowledge,تقریبا 4 منٹ.,تقریباً 1 منٹ۔,تقریبا 30 سیکنڈ.,تقریبا 10 سیکنڈ.,بہت زیادہ شدت والی ورزش کے بعد فاسفوکریٹائن کی مکمل ترکیب عام طور پر لی جاتی ہے:
2,clinical_knowledge,سادہ جوڑ۔,Synovial قبضہ جوڑ.,ملا ہوا جوڑ۔,گیند اور ساکٹ جوائنٹ۔,کہنی کس قسم کا جوڑ ہے؟
0,clinical_knowledge,ایک اعلی فائبر مواد کے ساتھ حل.,ایک ایسا محلول جس میں عام انسانی خلیے کے مقابلے محلول کا کم ارتکاز ہوتا ہے۔,ایک ایسا حل جو داخلی ٹیوبوں کو آسانی سے روکتا ہے۔,ایک ایسا محلول جس میں عام انسانی خلیے سے زیادہ محلول کا ارتکاز ہوتا ہے۔,ایک ہائپرٹونک حل ہے:
1,clinical_knowledge,مریض 45 ڈگری کے زاویے پر لیٹا ہے۔,اچھی روشنی,ریڈیل پلس کے ساتھ نبض کا وقت,مریض کی گردن کے پٹھوں کو آرام دہ ہونا چاہیے۔,ان میں سے کون سی ضروری نہیں ہے جب جگولر وینس پلس کی جانچ کی جائے؟
1,clinical_knowledge,الٹا پٹھوں کے گلائکوجن مواد سے متعلق ہے۔,ایک اعلی چکنائی والی غذا سے بہتر ہوتا ہے۔,دوڑ کے فاصلے کے ساتھ گرتا ہے۔,عام طور پر ایک دوڑ کے دوران مسلسل رہتا ہے.,زیادہ سے زیادہ پائیدار طاقت:
2,clinical_knowledge,مائٹوکونڈریا اور اعلی ATPase سرگرمی کی نسبتا بڑی تعداد۔,مائٹوکونڈریا اور اعلی ATPase سرگرمی کی نسبتاً کم تعداد۔,مائٹوکونڈریا کی نسبتاً کم تعداد اور کم ATPase سرگرمی۔,مائٹوکونڈریا کی نسبتاً بڑی تعداد اور کم ATPase سرگرمی۔,فاسٹ ٹویچ ریشوں پر مشتمل ہے:
3,clinical_knowledge,لییکٹیٹ ظاہر ہونے کی شرح اور لییکٹیٹ کلیئرنس کی شرح کے درمیان فرق۔,پٹھوں میں گلوکوز لینے کی شرح۔,anaerobic glycolysis کی شرح.,پٹھوں کے لییکٹیٹ کی پیداوار کی شرح اور پٹھوں کے لییکٹیٹ کے بہاؤ کی شرح۔,خون میں لییکٹیٹ کے جمع ہونے کی شرح کا تعین اس طرح کیا جاتا ہے:
2,clinical_knowledge,lysosomes,سائٹوپلازم,نیوکلئس,مائٹوکونڈریون,گلائکولیسس کے انزائمز میں واقع ہیں:
1,clinical_knowledge,50-60 سیکنڈ۔,30-40 سیکنڈ۔,5-10 سیکنڈ۔,1-2 سیکنڈ۔,اعلی توانائی والے فاسفیٹس، اے ٹی پی اور فاسفوکریٹائن کے ٹوٹنے سے خارج ہونے والی توانائی، تقریباً زیادہ سے زیادہ مشقت کو برقرار رکھ سکتی ہے:
3,clinical_knowledge,انزائمز کے ساتھ مضبوطی سے جڑے ہوئے ہیں اور ان کی سرگرمی کے لیے ضروری ہیں۔,انزائم مالیکیول پر موجود سائٹس جو انزائم کی سرگرمی میں الوسٹرک ترمیم کی اجازت دیتی ہیں۔,ہائیڈروجن بانڈز کے ذریعے خامروں کے ساتھ ڈھیلے سے جکڑے ہوئے ہیں۔,سیل میں تمام خامروں کی طرف سے ضروری ہے.,مصنوعی گروہ ہیں:
0,clinical_knowledge,کمزوری دور کی نسبت قربت سے زیادہ نشان زد ہے۔,Reflexes کمک کے ساتھ بہت تیز ہیں۔,ٹون ٹانگوں میں دو طرفہ اضافہ ہوا ہے,ذخیرے کی تقسیم میں حسی نقصان کا مظاہرہ کیا جاتا ہے۔,پیریفرل نیوروپتی میں مندرجہ ذیل میں سے کون سا سچ ہے؟
3,clinical_knowledge,رائٹر کا درد فوکل ڈسٹونیا کی ایک مثال ہے۔,کبھی کبھی ڈسٹونیا میں 'دودھ کی خادمہ' گرفت پائی جاتی ہے۔,Hemiballismus ایک فالج کی وجہ سے ہوتا ہے جس کی وجہ سے بازو کے دور دراز کے نصف حصے کا فالج ہوتا ہے۔,الکحل سومی ضروری زلزلے کے جھٹکے کو بدتر بنا دیتا ہے۔,بازو میں غیر ارادی حرکت کے بارے میں مندرجہ ذیل میں سے کون سا سچ ہے؟
3,clinical_knowledge,سوڈیم ویلپرویٹ,طویل مدتی سگریٹ نوشی,انجیوٹینسن کنورٹنگ اینزائم (ACE) روکنے والے,گیسٹرو oesophageal reflux بیماری,ان میں سے کون سا آپشن دائمی کھانسی کی وجہ کے طور پر تسلیم نہیں کیا جاتا ہے؟
1,clinical_knowledge,نارمل نمکین۔,لیموں اور گلیسرین کے جھاڑو۔,پانی۔,ہائیڈروجن پر آکسائڈ۔,منہ کی صفائی کے لیے مندرجہ ذیل میں سے کس کی سفارش کی جاتی ہے؟
1,clinical_knowledge,صرف اس وقت دیں جب درد کے اسکور زیادہ ہوں۔,دن میں دو بار طویل عمل کرنے والی دوائیں استعمال کریں۔,بریک تھرو درد کے لیے اضافی 'ضرورت کے مطابق' درد سے نجات کی فراہمی کے ساتھ باقاعدگی سے دوائیں دیں۔,دوائیں صرف 'ضرورت کے مطابق' دیں۔,عام اصول کے طور پر سرجری کے بعد ینالجیسک ادویات کے استعمال کا بہترین طریقہ کیا ہے؟
0,clinical_knowledge,مرکزی اعصابی نظام کی خرابی کے نتیجے میں درد، یعنی دماغی عروقی حادثے کے بعد۔,ایک مخصوص اعصاب یا اعصاب کے گروپ کی خرابی جس کے نتیجے میں غیر معمولی درد کے سگنل جاری ہوتے ہیں۔,اعصاب یا اعصاب کے گروپ پر دباؤ کے نتیجے میں درد۔,حقیقی یا ممکنہ بافتوں کو پہنچنے والے نقصان کے نتیجے میں درد، جو کیمیکل ثالثوں کی رہائی کا سبب بنتا ہے جو اعصابی ریشوں کو دماغ میں درد کے اشارے شروع کرنے کے لیے متحرک کرتے ہیں۔,مندرجہ ذیل میں سے کون سا بہترین درد کی وضاحت کرتا ہے؟
0,clinical_knowledge,. . . تپ دق,. . . نمونیا۔,. . . COPD,. . . دمہ,مندرجہ ذیل کو مکمل کریں: دو ہفتے کے عرصے میں سیریل چوٹی کے بہاؤ کی ریڈنگ کی تبدیلی کو میں تشخیصی سمجھا جاتا ہے۔ . .
0,clinical_knowledge,اگر پیشاب کی پیمائش کرنے کی ضرورت نہیں ہے۔,اگر مریض کو مثانے کی حس ہو ۔,اگر مریض اس کا انتخاب کرتا ہے۔,اگر مریض پوسٹ آپریٹو ہے۔,کن حالات میں آپ کیتھیٹر والو کا استعمال نہیں کریں گے؟
0,clinical_knowledge,پیتھولوجیکل فریکچر کوئی خصوصیت نہیں ہے۔,دل کی ناکامی ایک تسلیم شدہ پیچیدگی نہیں ہے,ریڑھ کی ہڈی کا کمپریشن ایک عام پیچیدگی ہے۔,لمبی ہڈی کا جھکنا ایک خصوصیت ہے۔,پیجٹ کی بیماری کے بارے میں مندرجہ ذیل میں سے کون سا سچ ہے؟
0,clinical_knowledge,نوٹ چیک کریں کہ آیا مریض کے پاس DNAR آرڈر ہے۔,سینے کے 30 دباؤ دیں۔,دو ریسکیو سانسیں.,یقینی بنائیں کہ ہنگامی ٹیم/سروسز کو بلایا گیا ہے۔,دل کا دورہ پڑنے کی تصدیق کے بعد آپ کی پہلی کارروائی یہ ہے:
0,clinical_knowledge,کیونکہ انہوں نے پوچھا۔,بے ضابطگی۔,یشاب کی نالی کا انفیکشن۔,شدید پیشاب کی برقراری.,مریض کو کیتھیٹرائز کرنے کی فوری وجہ کیا ہے؟
1,clinical_knowledge,پٹھوں کو نقصان مختصر سنکچن کی طرف سے حوصلہ افزائی کی جاتی ہے.,امینو ایسڈ سپلیمنٹس پٹھوں کی طاقت اور طاقت کو بڑھا سکتے ہیں۔,کریٹائن سپلیمنٹس پٹھوں کی طاقت اور طاقت کو بڑھا سکتے ہیں۔,روزانہ 3 گرام فی کلو گرام باڈی ماس سے زیادہ پروٹین کی مقدار میں اضافہ پٹھوں کی نشوونما کو متحرک کرے گا اور طاقت میں اضافہ کرے گا۔,مندرجہ ذیل میں سے کون سا سچ ہے؟
1,clinical_knowledge,جی پی۔,وارڈ منیجر۔,نامزد کنسلٹنٹ۔,نامی نرس۔,ہسپتال میں داخلے، قیام اور ڈسچارج کے دوران مریض کی دیکھ بھال کی قانونی ذمہ داری کس کی ہے؟
2,clinical_knowledge,anaerobically توانائی پیدا.,چربی اور کاربوہائیڈریٹ جلا.,فاسفوکریٹائن کو توڑ دیں۔,تیزی سے معاہدہ.,برداشت کی تربیت پٹھوں کی صلاحیت کو بڑھاتی ہے:
0,clinical_knowledge,noradrenaline جو پٹھوں کی میٹابولک سرگرمی کو بڑھاتا ہے۔,کیلشیم آئن جو پٹھوں کے ریشے کے ساتھ ایک عمل کی صلاحیت کا آغاز کرتے ہیں۔,سوڈیم آئن جو پٹھوں کی جھلی پر سوڈیم ریسیپٹرز سے منسلک ہوتے ہیں۔,ایسیٹیلکولین جو نیورومسکلر جنکشن کو عبور کرتی ہے۔,موٹر اینڈ پلیٹ پر پہنچنے والی ایکشن پوٹینشل ان کی رہائی کا سبب بنتی ہے:
1,clinical_knowledge,ان مریضوں میں کیتھیٹر انکرسٹیشن کا امکان کم ہوتا ہے۔,ان مریضوں کا پیشاب صاف ہونے کا امکان زیادہ ہوتا ہے۔,ان مریضوں کو پیشاب کی نالی میں انفیکشن ہونے کا امکان زیادہ ہوتا ہے اگر ان کا بلڈ شوگر غیر مستحکم ہو۔,ان مریضوں میں خون بہنے کا امکان زیادہ ہوتا ہے۔,آپ کے مریض کو ذیابیطس ہے۔ یہ کیوں ضروری ہے؟
3,clinical_knowledge,مزاحمت کے بغیر حرکت، حد کے آخر میں رک جانا۔,مزاحمت کے ساتھ حرکت، حد کے آخر میں رک جانا۔,مزاحمت کے بغیر حرکت، حد کے آخر میں کھینچنا۔,مزاحمت کے ساتھ حرکت، حد کے آخر میں کھینچنا۔,'غیر فعال حرکتیں' کی اصطلاح سے کیا مراد ہے؟
1,clinical_knowledge,کریکوڈ کارٹلیج کے نیچے ٹریچیا کی پچھلی دیوار میں ایک سوراخ۔,پچھلے سینے کی دیوار میں ایک سوراخ۔,کریکوڈ کارٹلیج کے نیچے ٹریچیا کی اگلی دیوار میں ایک کھلنا۔,کریکوڈ کارٹلیج کے اوپر ٹریچیا کی اگلی دیوار میں ایک کھلنا۔,tracheostomy کیا ہے؟
