answer,subject,choice_3,choice_2,choice_1,choice_0,question
1,clinical_knowledge,"گلوکوز-1,6-ڈائی فاسفیٹ۔",گلوکوز-6-فاسفیٹ۔,گلوکوز-1-فاسفیٹ۔,گلوکوز,پٹھوں میں گلائکوجن کی خرابی کے نتیجے میں ابتدائی طور پر اس کی تشکیل ہوتی ہے:
1,clinical_knowledge,myosin اور tropomyosin.,ٹروپونن اور ٹروپومیوسین۔,ایکٹین اور myosin.,ایکٹین اور ٹروپونن۔,کنکال کے پٹھوں میں پائے جانے والے دو پرنسپل کنٹریکٹائل پروٹین ہیں:
2,clinical_knowledge,بیضوی شکل والے شاگرد۔,یکطرفہ فکسڈ ڈیلیٹڈ پیپل۔,دو طرفہ محدود شاگرد۔,یکطرفہ محدود شاگرد۔,مندرجہ ذیل میں سے کون سا IIIrd کرینیل اعصابی فالج کی نمائندگی کرتا ہے اور ایک نیورو سرجیکل ایمرجنسی ہے؟
3,clinical_knowledge,آاسوٹوپ اسکیننگ پر کام کرنے والا نوڈول کینسر کی وجہ سے ہونے کا امکان نہیں ہے۔,سوجن کا الٹراساؤنڈ اس بات کا تعین کرنے کے لیے بہترین ٹیسٹ ہے کہ آیا نوڈول فعال طور پر ہارمون خارج کر رہا ہے,لمف نوڈ کی توسیع ایک اچھی تشخیصی علامت ہے۔,یہ ہمیشہ نگلنے پر بلند ہوتا ہے۔,تائرواڈ کی سوجن کے بارے میں درج ذیل میں سے کون سا سچ ہے؟
2,clinical_knowledge,جگر عام طور پر ٹکرانے کے لیے گونجتا ہے۔,یرقان، مکڑی ناوی اور پورپورا کی موجودگی اس کی وجہ شراب تجویز کرتی ہے۔,جگر بائیں ہائپوکونڈریم سے نیچے کی طرف بڑھتا ہے۔,ایمفیسیما ایک وجہ ہے۔,مندرجہ ذیل میں سے کون سا ہیپاٹومیگالی کا سچ ہے؟
2,clinical_knowledge,گھٹنے کے اضطراری کی جڑ کی قیمت L1، L2 ہے۔,ٹخنوں کے اضطراب کی جڑ کی قیمت S1 ہے۔,ایک ایکسٹینسر پلانٹر ردعمل کم موٹر نیورون گھاو کی نشاندہی کرتا ہے۔,ایک مثبت بابنسکی اضطراری پلانٹر اضطراری کی تشخیص میں عام لچکدار ردعمل کی طرح ہے۔,مندرجہ ذیل میں سے کون سا اضطراب کے حوالے سے درست ہے؟
2,clinical_knowledge,بیلز پالسی میں ذائقہ کی حس کبھی متاثر نہیں ہوتی,مفلوج طرف سے پلکوں کو بند کرنے میں ناکامی موٹر نیورون کے نچلے زخم کی نشاندہی کرتی ہے۔,رمسے ہنٹ سنڈروم ایک اوپری موٹر نیورون زخم ہے جو ہرپس زوسٹر انفیکشن کا ثانوی ہے,بیلز فالج اوپری موٹر نیوران کے زخم کے لیے ایک اور اصطلاح ہے۔,مندرجہ ذیل میں سے کون سا چہرے کے اعصابی فالج کا سچ ہے؟
3,clinical_knowledge,کلائی میں رداس اور النا کا فریکچر۔,انگلی کا فریکچر۔,کہنی کا فریکچر۔,ہاتھ کا فریکچر۔,کولس فریکچر کیا ہے؟
0,clinical_knowledge,منتقلی کو جاری رکھیں اور مریض پر مشاہدات کا ایک سیٹ ریکارڈ کریں۔,خون کے تھیلے کو فوری طور پر منقطع کریں اور ٹھکانے لگائیں۔,منتقلی کو چلنا چھوڑ دیں اور فوری طور پر طبی عملے سے رابطہ کریں۔,منتقلی کو بند کریں، طبی عملے کو فوری طور پر مطلع کریں، اور شدید منتقلی کے رد عمل سے نمٹنے کے لیے ٹرانسفیوژن پالیسی کے مشورے پر عمل کریں۔,اگر منتقلی کے رد عمل کا شبہ ہے، تو آپ کو:
0,clinical_knowledge,12 گھنٹے۔,4 گھنٹے۔,90 منٹ,30 منٹ,ایک بار جب بلڈ بنک سے خون کی مصنوعات کی ایک تجویز کردہ یونٹ حاصل کر لی جائے اور ریفریجریشن سے باہر ہو جائے تو اس کے خراب ہونے سے پہلے کس مدت کے اندر منتقلی شروع ہو جائے (2020 کے طبی علم کے مطابق)؟
1,clinical_knowledge,غیر رسمی دیکھ بھال کرنے والوں کی اکثریت فٹ اور فعال ہوتی ہے۔,ڈسچارج پلاننگ میں غیر رسمی دیکھ بھال کرنے والوں کو شامل نہیں کیا جانا چاہیے۔,65 سال سے زیادہ عمر کے چھ میں سے ایک ایک غیر رسمی دیکھ بھال فراہم کر رہا ہے۔,65 سال سے زیادہ عمر کے 50% غیر رسمی دیکھ بھال فراہم کر رہے ہیں۔,غیر رسمی دیکھ بھال کرنے والوں کے بارے میں مندرجہ ذیل میں سے کون سا بیان درست ہے (2020 تک)؟
1,clinical_knowledge,فاسفوریلیشن۔,گلائکوسیلیشن۔,پیپٹائڈ بانڈز کے ذریعے زیادہ امینو ایسڈ کا منسلک ہونا۔,لپیڈیشن,ترجمہ ہونے کے بعد پروٹین کی ساخت کو تبدیل کرنے کے لیے درج ذیل میں سے کون سا عمل استعمال نہیں ہوتا؟
1,clinical_knowledge,جب کیتھیٹر گندا ہو۔,جب کیتھیٹر بائی پاس ہو رہا ہو۔,جب کیتھیٹر بلاک ہو جاتا ہے۔,جب ان کا پیشاب صاف ہو۔,آپ کو گھر میں مریض کے لیے مثانے کی صفائی کرنے کی ضرورت کیوں پڑے گی؟
3,clinical_knowledge,صدمے یا جلنے والے مریض۔,ہاتھ کے پچھلے حصے میں ڈالنا۔,بزرگ مریضوں.,بچے۔,14-16 گیج کی سوئی سب سے زیادہ اس کے لیے استعمال کی جاتی ہے:
0,clinical_knowledge,کلبھوشن,علاقے میں کوئی درد نہیں۔,کھانسی کے ساتھ بدل جاتا ہے۔,ختم ہونے میں زیادہ نمایاں,ان میں سے کون سی خصوصیات بتاتی ہیں کہ کریکلز کے مقابلے میں فوففس کی رگڑ کی وجہ سے کڑکتی آواز کا امکان زیادہ ہوتا ہے؟
1,clinical_knowledge,کھیل کے دوران بڑھتا ہے کیونکہ کھلاڑی زیادہ تھکاوٹ کا شکار ہو جاتے ہیں۔,عام طور پر کھیل کے اختتام پر پہلے ہاف کے اختتام سے زیادہ ہوتا ہے۔,عام طور پر کھیل کے اختتام پر پہلے ہاف کے اختتام سے کم ہوتا ہے۔,شاذ و نادر ہی 3 ایم ایم سے زیادہ بڑھتا ہے۔,فٹ بال جیسے کھیلوں میں خون میں لییکٹیٹ کا ارتکاز:
2,clinical_knowledge,سادہ بازی سے۔,پروٹین ٹرانسپورٹر مالیکیول کے ذریعے۔,ایک فعال نقل و حمل کے طریقہ کار کے ذریعے۔,کارنوسین کے ساتھ کوٹرانسپورٹ میکانزم کے ذریعے۔,لییکٹیٹ اور ہائیڈروجن آئن پٹھوں کو چھوڑ دیتے ہیں:
1,clinical_knowledge,حمل ریڑھ کی ہڈی کے لارڈوسس کے نقصان کا سبب ہے۔,Ankylosing spondylitis ریڑھ کی ہڈی کی hypermobility کی ایک وجہ ہے,شوبر کا ٹیسٹ ریڑھ کی ہڈی کے موڑ کو درست کرنے کے لیے ڈیزائن کیا گیا ہے۔,کمر درد ایک غیر معمولی شکایت ہے۔,ریڑھ کی ہڈی کے بارے میں درج ذیل میں سے کون سا سچ ہے؟
3,clinical_knowledge,ناخن لگانا تشخیص کا اشارہ دے سکتا ہے۔,ٹوفی بعض اوقات متاثرہ جوڑوں پر دیکھی جا سکتی ہے۔,خون کے مارکر سے تشخیص کی تصدیق کی جا سکتی ہے۔,psoriasis کی تختیوں کی غیر موجودگی تشخیص کو خارج کر دیتی ہے۔,مندرجہ ذیل میں سے کون سا سوریاٹک آرتھرو پیتھی کا سچ ہے؟
0,clinical_knowledge,ماضی میں، قبر کی بیماری کبھی کبھی 'ڈربی شائر گردن' کا سبب بنتی تھی,یہ عورتوں کے مقابلے مردوں میں زیادہ عام ہے۔,یہ ایک بڑی کثیر نوڈولر گٹھائی کا سبب بنتا ہے۔,یہ ophthalmoplegia کی ایک وجہ ہے۔,تائرواڈ کی قبروں کی بیماری کے بارے میں درج ذیل میں سے کون سا سچ ہے؟
1,clinical_knowledge,اولیگوریا ہائپر کیلسیمیا کی علامت ہے۔,وٹامن ڈی پیراٹائیرائڈ غدود سے خارج ہوتا ہے۔,بنیادی hyperparathyroidism عام طور پر غیر علامتی ہوتا ہے۔,Calcitonin پلازما کیلشیم میں اضافے کا سبب بنتا ہے۔,کیلشیم میٹابولزم کے لیے درج ذیل میں سے کون سا سچ ہے؟
1,clinical_knowledge,پولی پیپٹائڈ چین میں امینو ایسڈ کا اضافہ یا ہٹانا شامل ہے۔,کیٹون گروپ کو شامل کرنا یا ہٹانا شامل ہے۔,فاسفیٹ گروپ کا اضافہ یا ہٹانا شامل ہے۔,اے ٹی پی کی خرابی کو روکنا۔,کناز کے رد عمل:
3,clinical_knowledge,14-16 سانسیں فی منٹ۔,20-22 سانسیں فی منٹ۔,8-10 سانسیں فی منٹ۔,10-12 سانسیں فی منٹ۔,بالغ مرد کے لیے عام سانس کی شرح ہے:
2,clinical_knowledge,اگر زخم بنیادی نیت سے ٹھیک ہو رہا ہو تو اس کی ضرورت نہیں ہے۔,دوبارہ قائم کرنے کے لئے کچھ وقت لگائیں.,زخم کی سطح پر ایک پل فراہم کریں۔,زخم بھرنے کے پہلے پانچ دنوں میں دوبارہ قائم ہو جاتے ہیں۔,کولیجن ریشے:
1,clinical_knowledge,ایک گرام شراب,لیوسین ایک گرام,پالمیٹک ایسڈ ایک گرام,ایک گرام گلوکوز,جسم میں مکمل طور پر آکسائڈائز ہونے پر مندرجہ ذیل میں سے کون سب سے زیادہ توانائی خارج کرتا ہے؟
1,clinical_knowledge,triacylglycerol مالیکیول,گلائکوجن مالیکیولز,الیکٹران ٹرانسپورٹ چین کے اجزاء۔,ٹرائی کاربو آکسیلک ایسڈ سائیکل (کریبس سائیکل) کے انزائمز۔,مائٹوکونڈریون کی اندرونی جھلی میں سرایت شدہ ہیں:
3,clinical_knowledge,40 kJ/منٹ,80 kJ/منٹ,200 کلوجول/منٹ,400 kJ/منٹ,اگر تربیتی سیشن کے دوران ایک مرد کھلاڑی کے آکسیجن کے استعمال کی اوسط شرح 2 لیٹر/منٹ ہے، تو اس کے توانائی کے اخراجات کی شرح تقریباً ہے:
1,clinical_knowledge,60-110 bpm,60-90 bpm,60-100 bpm,60-80 bpm,آرام کے وقت بالغ کے لیے دل کی دھڑکن عام ہے:
3,clinical_knowledge,آکسیجن TCA سائیکل میں استعمال ہوتی ہے۔,برداشت کی تربیت پٹھوں میں TCA سائیکل انزائمز کی مقدار کو بڑھاتی ہے۔,قسم II کے ریشوں میں قسم I کے ریشوں کی نسبت فاسفوریلیس کی سرگرمی زیادہ ہوتی ہے۔,فاسفوفریکٹوکینیز گلائکولیسس میں شرح کو محدود کرنے والا انزائم ہے۔,مندرجہ ذیل میں سے کون سا بیان غلط ہے؟
2,clinical_knowledge,یہ بائسپس کے پٹھوں کو فراہم کرتا ہے۔,اس سے ہاتھ کے درمیانی آدھے حصے اور ہاتھ کے ہتھیلی اور پشتی دونوں پہلوؤں پر درمیانی ڈیڑھ ہندسوں پر احساس کم ہوجاتا ہے۔,یہ ایک مثبت فلن کی علامت کو جنم دیتا ہے۔,النا اعصاب ہیومرس کی سرپل نالی کے فریکچر سے متاثر ہوسکتا ہے۔,النا اعصابی فالج میں مندرجہ ذیل میں سے کون سا سچ ہے؟
1,clinical_knowledge,آدھا انچ۔,دانتوں کے برش کی لمبائی۔,مٹر کے سائز کی مقدار۔,ایک سمیر۔,دانتوں کی صفائی کے لیے کتنے ٹوتھ پیسٹ کی سفارش کی جاتی ہے؟
3,clinical_knowledge,چاند کا چہرہ اور بھینس کا کوہان اس بیماری کی خصوصیت ہے۔,آسٹیوپوروسس کوئی خصوصیت نہیں ہے۔,بڑھے ہوئے اعضاء عام طور پر دیکھے جاتے ہیں۔,یہ کورٹیسول ہارمون کی کمی کی وجہ سے ہے۔,Cushing's Syndrome کے بارے میں مندرجہ ذیل میں سے کون سا سچ ہے؟
3,clinical_knowledge,فطری صلاحیت اور تربیتی محرک کا جواب دینے کی صلاحیت۔,ایک اچھا کوچ اور کامیابی کی ترغیب۔,اعلی انٹیلی جنس اور کامیابی کے لئے حوصلہ افزائی.,ایک اعلی توانائی کی خوراک اور بڑی بھوک۔,کھیل میں کامیابی کا تعین کرنے والے اہم عوامل ہیں:
3,clinical_knowledge,ہمیشہ 1:1۔,جینیاتی طور پر طے شدہ.,آر این اے میں بنیادی ترتیب سے طے ہوتا ہے۔,متغیر,ڈی این اے کے دوہرے پھنسے ہوئے مالیکیول میں، پیورینز کا تناسب: pyrimidines ہے:
0,clinical_knowledge,الڈوسٹیرون,پروجیسٹرون,کورٹیسول,ٹیسٹوسٹیرون,کارکردگی کو بڑھانے والے مصنوعی سٹیرائڈز ہارمون کی ساخت پر مبنی ہیں:
3,clinical_knowledge,مندرجہ بالا میں سے کوئی نہیں.,پی ایچ میں اضافہ.,کورٹیسول,انسولین,ورزش کرنے والے پٹھوں میں گلائکوجن کی خرابی اس کے ذریعہ چالو ہوتی ہے:
3,clinical_knowledge,البومین کا پابند۔,گلوکوز کے ساتھ مل کر.,لیپوپروٹین کے طور پر.,سرخ خون کے خلیات کے اندر.,زیادہ تر مفت فیٹی ایسڈ خون میں منتقل ہوتے ہیں:
2,clinical_knowledge,ہر 16 گھنٹے۔,ہر 12 گھنٹے۔,ہر 8 گھنٹے۔,ہر 4 گھنٹے بعد۔,کینول کو کتنی بار فلش کرنا چاہیے؟
0,clinical_knowledge,برداشت کی تربیت کی مدت کے بعد اضافہ ہوا.,قسم II کے ریشوں میں ہمیشہ Type I کے ریشوں سے کم ہوتے ہیں۔,جب پٹھوں کا پی ایچ 6.9 سے نیچے آتا ہے تو اس میں اضافہ ہوتا ہے۔,جب انٹرا سیلولر ADP بڑھتا ہے۔,کریٹائن کناز کی سرگرمی یہ ہے:
2,clinical_knowledge,1 mmHg,2 mmHg,4 mmHg,10 mmHg,مرکری اور اینیرائڈ اسفیگمومانومیٹر کی پیمائش پر سب سے چھوٹی انکریمنٹ ہیں:
1,clinical_knowledge,Ataxic سانس لینے.,ہائپر وینٹیلیشن۔,اینیروبک سانس۔,Cheyne-Stokes کی سانس۔,مندرجہ ذیل میں سے کون سا سانس لینے کا ایک غیر معمولی نمونہ نہیں ہے جو سر کی چوٹ اور تبدیل شدہ شعوری سطح میں دیکھا جاتا ہے؟
3,clinical_knowledge,30:02:00,1:05,15:02,2:25,سی پی آر کے دوران سینے کے کمپریشن اور وینٹیلیشن کو اس تناسب میں پہنچایا جانا چاہئے:
3,clinical_knowledge,0.93,9.3,93,930,ایک شخص کا وزن 62 کلوگرام ہے۔ ان کی دوائی کی خوراک 15 ملی گرام فی کلوگرام ہے۔ ان کی خوراک کتنے گرام ہے؟ درج ذیل میں سے ایک جواب منتخب کریں:
1,clinical_knowledge,الیکٹرولائٹس کا نقصان.,پٹھوں کے درد۔,جسم کے بڑے پیمانے پر اضافہ.,پٹھوں کی کمزوری۔,کریٹائن سپلیمنٹ کا متوقع ضمنی اثر یہ ہے:
2,clinical_knowledge,diastole، systole، اور سنکچن.,diastole اور systole.,سنکچن، آرام، اور آرام.,systole، diastole، اور آرام.,کارڈیک سائیکل مراحل پر مشتمل ہے:
3,clinical_knowledge,ورزش کے دوران کارنیٹائن کا استعمال۔,خوراک۔,حربے۔,بیماری یا چوٹ کا شکار ہوئے بغیر بھاری تربیت کو برداشت کرنے کی صلاحیت۔,مندرجہ ذیل میں سے کون سے عوامل کھیل میں کامیابی کو متاثر نہیں کرتے؟
1,clinical_knowledge,2، 1، 3، 4۔,1، 2، 3، 4۔,3، 2، 1، 4۔,3، 1، 2، 4۔,بقا کا سلسلہ چار کڑیوں پر مشتمل ہے۔ درج ذیل فہرست کو صحیح ترتیب میں رکھیں: 1. ابتدائی ڈیفبریلیشن؛ 2. ابتدائی CPR؛ 3. جلد پہچاننا اور مدد کے لیے کال کرنا؛ 4. بحالی کے بعد کی دیکھ بھال۔
2,clinical_knowledge,مہارت کی کمی.,طلب سے ملنے میں اے ٹی پی کی فراہمی میں ناکامی۔,اے ٹی پی کی پیداوار کی روک تھام.,ADP کے سیل حراستی میں کمی۔,تیز رفتار ورزش میں تھکاوٹ کی ایک بنیادی وجہ یہ ہے:
1,clinical_knowledge,پیری اینل مسے صرف پروٹوسکوپی پر ظاہر کیے جا سکتے ہیں۔,تھرومبوزڈ ہیمورائیڈ بے درد ہے۔,متاثرہ پاخانے کو بعض اوقات ملاشی ٹیومر کے لیے غلطی سے سمجھا جا سکتا ہے۔,پروسٹیٹ میں ایک واضح درمیانی نالی کی تلاش ایک منفی تلاش ہے۔,ملاشی کے ممکنہ نتائج کے بارے میں مندرجہ ذیل میں سے کون سا سچ ہے؟
2,clinical_knowledge,جلد کو صاف کرنے کے لیے بغیر خوشبو والے صابن کا استعمال۔,پیریسٹومل جلد پر فضلہ کا رساو۔,ہر روز تیلی بدلنا۔,اچھی طرح سے فٹ ہونے والا تیلی۔,کیا عام طور پر جلد کی خرابی کا سبب بنتا ہے؟
3,clinical_knowledge,مریضوں کی چونچ نما ناک اور مومی جلد ہوتی ہے۔,Arachnodactyly بیماری کی ایک خصوصیت ہے,اگر telangiectasia دیکھا جائے تو یہ تشخیص کو مکمل کرتا ہے۔,یہ عورتوں سے زیادہ مردوں کو متاثر کرتا ہے۔,مندرجہ ذیل میں سے کون سیسٹیمیٹک سکلیروسیس کا سچ ہے؟
0,clinical_knowledge,بائیں ویںٹرکولر ہائپر ٹرافی,Aortic regurgitation,Aortic stenosis,دائیں ویںٹرکولر ہائپر ٹرافی,ایک واضح بائیں پیراسٹرنل امپلس کونسی غیر معمولی بات بتاتی ہے؟
3,clinical_knowledge,30%,20%,10%,5%,ہائپووولیمک جھٹکے میں، دل کی دھڑکن اور بلڈ پریشر میں ہونے والی تبدیلیوں سے ظاہر ہونے سے پہلے کتنے فیصد خون ضائع ہو سکتا ہے؟
1,clinical_knowledge,درد کی شدت کو کم کرتا ہے بلکہ بے خوابی کا باعث بھی بنتا ہے۔,درد کی شدت کو کم کرتا ہے لیکن اسہال کا سبب بھی بنتا ہے۔,درد کی شدت کو کم کرتا ہے بلکہ مسکن کا سبب بھی بنتا ہے۔,درد کی شدت کو کم کرتا ہے اور ہوشیاری بڑھاتا ہے۔,مندرجہ ذیل میں سے کون سا مورفین کے اثرات کو بہتر طور پر بیان کرتا ہے؟
3,clinical_knowledge,تناؤ سر درد سر درد کی ایک عام وجہ ہے۔,وقتی آرٹیرائٹس ریمیٹائڈ گٹھائی کے ساتھ مضبوطی سے منسلک ہے,شدید درد عام طور پر جان لیوا وجہ کی نشاندہی کرتا ہے۔,جب گردن کی سختی سے منسلک ہوتا ہے تو ہمیشہ میننجائٹس کی وجہ سے ہوتا ہے۔,سر درد کے لیے مندرجہ ذیل میں سے کون سا سچ ہے؟
3,clinical_knowledge,شریانوں میں لچکدار پیچھے ہٹنا ہوتا ہے۔,دائیں ویںٹرکل آرام دہ ہے.,برتن معاہدہ کر رہے ہیں.,ایٹریا معاہدہ کر رہے ہیں.,بائیں ویںٹرکل کے سنکچن کے درمیان خون کی نالیوں میں بہنا جاری رہتا ہے کیونکہ:
3,clinical_knowledge,ناقص تکنیک، جسمانی خرابی، یا سمجھ کی کمی۔,آنے والی سرجری۔,دمہ کی شدید شدت سے پچھلی بحالی۔,ٹانگوں کے شدید السر۔,کیا چیز نرس کو سوچنے پر مجبور کر سکتی ہے کہ ایک مریض انہیلر استعمال نہیں کر سکتا؟
0,clinical_knowledge,درخواست کے بعد کم از کم سات دن تک نہیں لیا جانا چاہئے.,ایک ماہر مہارت ہے.,سیپٹک حالات کے تحت کیا جانا چاہئے.,مریض کی طرف سے کیا جا سکتا ہے.,چپکنے والی پٹیوں کو ہٹانا:
2,clinical_knowledge,ہر مریض کے ساتھ مختلف ہوتا ہے.,100/منٹ۔,جتنی تیزی سے ممکن ہو سکے۔,80/منٹ۔,سی پی آر کے دوران، سینے کے کمپریشن کو اس شرح پر پہنچایا جانا چاہئے:
3,clinical_knowledge,پٹھوں کا اے ٹی پی اور فاسفوکریٹائن مواد۔,کاربوہائیڈریٹ کے باڈی اسٹورز کی دستیابی۔,ورزش کرنے والے پٹھوں کو آکسیجن فراہم کرنے کی صلاحیت۔,جسم کے درجہ حرارت کو منظم کرنے کی صلاحیت۔,میراتھن ریس جیسے برداشت کے مقابلوں میں کامیابی کے لیے درج ذیل میں سے کون سی جسمانی خصوصیات اہم نہیں ہیں؟
3,clinical_knowledge,ان کا سٹیرایڈ انہیلر استعمال کرنے کے بعد۔,ان کا سٹیرایڈ انہیلر استعمال کرنے سے پہلے۔,ان کا برونکوڈیلیٹر انہیلر استعمال کرنے کے بعد۔,ان کا برونکوڈیلیٹر انہیلر استعمال کرنے سے پہلے۔,انہیلر استعمال کرتے وقت، مریض کو کب منہ دھونے کے لیے کہا جانا چاہیے؟
3,clinical_knowledge,ورزش کے آغاز پر glycolysis کو چالو کیا جاتا ہے۔,پٹھوں کا پی ایچ گر جاتا ہے۔,گلوکوز کی خرابی سے پائروویٹ نہیں بن سکتا۔,آکسیجن آسانی سے دستیاب ہے۔,پٹھوں میں لییکٹیٹ کی پیداوار میں اضافہ ہوتا ہے جب:
1,clinical_knowledge,60 سیکنڈ,30-50 سیکنڈ۔,10-30 سیکنڈ۔,0-10 سیکنڈ۔,اسٹریچ کو کم سے کم کتنے وقت کے لیے رکھنا چاہیے؟
1,clinical_knowledge,کارڈیک آؤٹ پٹ، سکڑاؤ، اور خون کا حجم۔,سکڑاؤ، خون کا حجم، اور بلڈ پریشر۔,پری لوڈ، سکڑاؤ، اور بعد کا بوجھ۔,خون کا حجم، پری لوڈ، اور آفٹر لوڈ۔,کون سے تین عوامل فالج کے حجم کو منظم کرتے ہیں؟
0,clinical_knowledge,ڈسٹل phalanx، proximal phalanx، درمیانی phalanx.,مڈل فیلانکس، ڈسٹل فیلانکس، پراکسیمل فیلانکس۔,ڈسٹل phalanx، درمیانی phalanx، proximal phalanx.,قربت فالانکس، درمیانی فالانکس، ڈسٹل فیلانکس۔,درمیانی انگلی کی ہڈیوں کو ہاتھ سے صحیح ترتیب میں نام دیں۔
1,clinical_knowledge,کورٹیسول,گلائکوجن,انسولین,ایڈرینالائن,مندرجہ ذیل میں سے کون سا پٹھوں کے ذریعہ گلوکوز اور امینو ایسڈ کے اخراج کو فروغ دیتا ہے؟
1,clinical_knowledge,لمبائی میں 5 سینٹی میٹر سے زیادہ۔,جلد کی سطح سے نیچے.,لمبائی میں 3-5 سینٹی میٹر۔,جلد کے ساتھ فلش.,ایک ileostomy افتتاحی ہونا چاہئے:
3,clinical_knowledge,مریض کے قریبی رشتہ دار کو انگوٹھی۔,میعاد ختم ہونے کی تاریخوں کو چیک کیا جائے۔,مریض کو نہلایا جائے۔,مریض کی رضامندی حاصل کریں۔,کیتھیٹرائز کرنے سے پہلے درج ذیل میں سے کون سا کام نہیں کیا جائے گا؟
3,clinical_knowledge,گلائکولیسس کو اے ٹی پی کی دوبارہ ترکیب کے ایک بڑے ذریعہ کے طور پر استعمال کیا جا رہا ہے۔,پائروویٹ لییکٹیٹ میں بدل جاتا ہے۔,فاسفوکریٹائن کی خرابی ہوتی ہے۔,گلائکوجن ختم ہو جاتا ہے۔,ہائیڈروجن آئن اس وقت بنتے ہیں جب:
1,clinical_knowledge,سٹرنل رگڑنا۔,Trapezius نچوڑ.,چھوٹی انگلی کے گودے پر دباؤ۔,سپرا آربیٹل رج پریشر۔,مندرجہ ذیل میں سے کون سا مشق مرکزی دردناک محرک نہیں ہے؟
1,clinical_knowledge,15600,1.56,15.6,156,ڈوپامائن 4 مائیکروگرام/کلوگرام/منٹ کی شرح سے تجویز کی جاتی ہے۔ ایک 65 کلوگرام شخص کے لیے، وہ ایک گھنٹے میں کتنے ملی گرام حاصل کرے گا؟
