answer,subject,choice_3,choice_2,choice_1,choice_0,question
3,college_medicine,اس کے گھر کے اندر ناشتے کا کھانا نظر سے باہر چھپا دیں۔,جب وہ زیادہ کیلوری والا ناشتہ کھاتا ہے تو ربڑ بینڈ کے ساتھ خود کو کھینچیں۔,اپنے کیلوری کے اہداف کو پورا کرنے کے لئے ہر ہفتہ کو ایک لذیذ کھانے کے ساتھ خود کو انعام دیں۔,کافی شاپ کے بجائے ہیلتھ اسموتھی اسٹور پر مطالعہ کریں۔,دسمبر میں ایک میچ کے لیے وزن کم کرنے کی کوشش کرنے والا ایک پہلوان 2 ماہ کے دوران 30lbs کم کرنے کا مرتکب ہوتا ہے۔ مندرجہ ذیل میں سے کون سا اس کی کیلوری کی مقدار کو محدود کرنے کا اچھا طریقہ نہیں ہے؟
1,college_medicine,پروٹین کے ترتیری اور بنیادی ڈھانچے کو ایک ساتھ رکھنے والے انٹرا مالیکولر بانڈ کو توڑنے کے لئے، اس طرح لکیری ٹکڑے پیدا ہوتے ہیں جو سائز کے مطابق ترتیب دیئے جاسکتے ہیں۔,پروٹین کو ختم ہونے سے روکنے کے لیے تاکہ الیکٹروفورسس ترتیری ساخت کی بنیاد پر پروٹین کو درست طریقے سے حل کر سکے۔,الیکٹروفورسس کو صرف بنیادی ترتیب کی لمبائی کی بنیاد پر پروٹین کو الگ کرنے کی اجازت دینا۔,پروٹین کو بڑے مثبت چارج کے ساتھ کوٹ کرنے کے لیے، کیونکہ امینو ایسڈ سائڈ چینز پر مثبت، منفی یا غیر جانبدار چارجز ہو سکتے ہیں، اور جیل میں اچھی علیحدگی حاصل کرنے کے لیے ایک بڑا یکساں چارج ضروری ہے۔,SDS-PAGE طریقہ کار میں، SDS ایک صابن کے طور پر کام کرتا ہے۔ الیکٹروفورسس جیل کے ذریعے چلانے سے پہلے پروٹین کو ڈٹرجنٹ سے کیوں علاج کیا جاتا ہے؟
3,college_medicine,اے ٹی پی اسٹورز۔,فاسفوکریٹائن اسٹورز۔,کریٹائن فاسفوریلیشن,گلائکولیسس۔,1-2 سیکنڈ تک چلنے والے بہت زیادہ طاقت کے سنکچن کے لئے، ابتدائی توانائی کا ذریعہ ہے:
3,college_medicine,ورزش کے دوران کارنیٹائن کا استعمال۔,خوراک۔,حربے۔,بیماری یا چوٹ کا شکار ہوئے بغیر بھاری تربیت کو برداشت کرنے کی صلاحیت۔,مندرجہ ذیل میں سے کون سے عوامل کھیل میں کامیابی کو متاثر نہیں کرتے؟
0,college_medicine,I اور II,صرف III,صرف II,صرف میں,نظام انہضام اور سانس کی نالی کی پرت کس جراثیم کی تہہ سے بنتی ہے؟ I. Endoderm II. میسوڈرم III۔ ایکٹوڈرم
3,college_medicine,Isoleucine,ارجنائن,ٹائروسین,گلائسین,لیبارٹری میں الگ تھلگ ایک ٹرانس میبرن پروٹین مختلف مقدار میں چار مختلف امینو ایسڈز پر مشتمل پایا جاتا ہے۔ وہ تعدد کے لحاظ سے گلائسین، ٹائروسین، ارجینائن اور آئسولیوسین ہیں۔ ان امینو ایسڈز میں سے، کون سا زیادہ تر ٹرانس میبرن ڈومین کے اندر ہوتا ہے؟
0,college_medicine,گوانائن,یوراسل,ایڈنائن,تھامین,مندرجہ ذیل میں سے کون سا نیوکلیوٹائڈ بیس RNA میں نہیں پایا جاتا؟
2,college_medicine,مائٹوکونڈریا اور اعلی ATPase سرگرمی کی نسبتا بڑی تعداد۔,مائٹوکونڈریا اور اعلی ATPase سرگرمی کی نسبتاً کم تعداد۔,مائٹوکونڈریا کی نسبتاً کم تعداد اور کم ATPase سرگرمی۔,مائٹوکونڈریا کی نسبتاً بڑی تعداد اور کم ATPase سرگرمی۔,فاسٹ ٹویچ ریشوں پر مشتمل ہے:
1,college_medicine,اے ٹی پی کے اڑتیس مالیکیولز۔,اے ٹی پی کے تین مالیکیول۔,اے ٹی پی کے دو مالیکیول۔,پانی کے چھ مالیکیول,گلوکوز کے ایک مالیکیول کو پائروویٹ کے دو مالیکیولز میں تبدیل کرنے کے نتیجے میں ان کی خالص تشکیل ہوتی ہے:
1,college_medicine,لیمفائیڈ پروجینیٹر,ٹی سیل,پلیٹلٹ,این کے سیل,Acute Myeloid Leukemia ایک مہلک کینسر ہے جس میں myeloid progenitor خلیات تیزی سے تقسیم ہو جاتے ہیں اور اپنی نیم سٹیم سیل کی حالت کو برقرار رکھتے ہیں۔ عام حالات میں، اس سٹیم سیل سے مندرجہ ذیل سیل کی کون سی اقسام پیدا ہوں گی؟
2,college_medicine,سادہ بازی سے۔,پروٹین ٹرانسپورٹر مالیکیول کے ذریعے۔,ایک فعال نقل و حمل کے طریقہ کار کے ذریعے۔,کارنوسین کے ساتھ کوٹرانسپورٹ میکانزم کے ذریعے۔,لییکٹیٹ اور ہائیڈروجن آئن پٹھوں کو چھوڑ دیتے ہیں:
0,college_medicine,اینافیس - سائٹوپلازم اور آرگنیلس کی علیحدگی,Telophase - استوائی پلیٹ کی تشکیل,Cytokinesis - بہن کرومیٹڈس کو ان کے متعلقہ کھمبوں سے الگ کرنا,میٹا فیز - دو الگ الگ جوہری جھلیوں کی تشکیل,"مائٹوسس کے پانچ مراحل ہیں جو سیل کو صحیح طریقے سے تقسیم کرنے کے لیے درست طریقے سے انجام دینے چاہئیں۔ مائٹوسس کے مرحلے کو اس کے مناسب جز کے ساتھ ملائیں:
Prophase - نیوکلیولی کی تحلیل"
2,college_medicine,ایک جھوٹی ایسوسی ایشن.,سماجی سرمائے کی قدر,ایک قابلیت,ثقافتی سرمائے کی قدر,ایک مطالعہ نے غیر معمولی منتخب کالجوں میں داخلوں کی جانچ کی۔ داخلے کی منظوری کے ارتباط کی جانچ کرتے وقت، دو واضح عوامل جو داخلوں کے ساتھ مضبوطی سے منسلک تھے، بالترتیب +0.41 اور +0.55 کے باہمی تعلق کی قدروں کے ساتھ، GPA اور معیاری ٹیسٹ کے اسکور تھے۔ تاہم، مطالعہ نے یہ بھی ظاہر کیا کہ وہ طلباء جن کے پاس سوشل نیٹ ورکس تھے جو منتخب کالجوں کے سابق طلباء کے نیٹ ورکس کے ساتھ اوورلیپ ہوئے تھے، ان کے داخلے کے امکانات اور بھی زیادہ تھے، سوشل نیٹ ورک اور +0.61 کے سابق طلباء کے نیٹ ورک کے درمیان تعلق کے ساتھ۔ یہ ارتباط ظاہر کرتا ہے:
0,college_medicine,مصنوعی,قدرتی,فعال,غیر فعال,"ایک مریض کتے کے کاٹنے کے بعد ہسپتال میں داخل ہوا جس کے بارے میں اس نے کہا کہ وہ ""پاگل ہو رہا ہے""۔ زخم کھلا ہے اور خون بہہ رہا ہے۔ اینیمل کنٹرول نے کتے کو پکڑ لیا اور کہا کہ اس کے منہ سے جھاگ آرہی تھی اور انتہائی جارحانہ۔ ریبیز کے انفیکشن کے شبہ میں، مریض کو ایک سیرم دیا جاتا ہے جس میں ریبیز اینٹی باڈیز ہوتی ہیں جو گھوڑے کے اندر اگائی جاتی ہیں۔ یہ کس قسم کی استثنیٰ کی مثال ہے؟"
2,college_medicine,بہت ہی اعلی طبقے کے افراد کا چھوٹا فیصد۔,ایک متنوع اور ترقی یافتہ معیشت۔,ایک معیشت ایک قدرتی وسائل کے گرد مرکزیت رکھتی ہے۔,مضبوط مرکزی حکومت۔,عالمی نظام کا نظریہ دنیا کو ایک اکائی کے طور پر تین ذیلی زمروں میں تقسیم کرتا ہے: بنیادی ممالک، پیریفری ممالک، اور نیم پرفیری ممالک۔ مندرجہ ذیل میں سے کون سا جواب نیم گھیرے والے ممالک کے ساتھ بہترین تعلق رکھتا ہے؟
1,college_medicine,پولی پیپٹائڈ چین میں امینو ایسڈ کا اضافہ یا ہٹانا شامل ہے۔,کیٹون گروپ کو شامل کرنا یا ہٹانا شامل ہے۔,فاسفیٹ گروپ کا اضافہ یا ہٹانا شامل ہے۔,اے ٹی پی کی خرابی کو روکنا۔,کناز کے رد عمل:
3,college_medicine,دوسرے ٹشوز کے ذریعہ اپٹیک اور آکسیکرن۔,گردوں کے ذریعے اخراج.,دل میں گلوکوز میں تبدیلی۔,جگر میں یوریا میں تبدیلی۔,لییکٹیٹ کی بنیادی قسمت جو پٹھوں کو چھوڑ کر گردش میں داخل ہوتی ہے یہ ہے:
1,college_medicine,20 سیکنڈ۔,10 سیکنڈ۔,2 سیکنڈ۔,2 ملی سیکنڈ۔,پٹھوں میں اے ٹی پی اسٹور صرف اعلی شدت والی ورزش میں توانائی فراہم کر سکتا ہے:
3,college_medicine,مندرجہ بالا میں سے کوئی نہیں.,پی ایچ میں اضافہ.,کورٹیسول,انسولین,ورزش کرنے والے پٹھوں میں گلائکوجن کی خرابی اس کے ذریعہ چالو ہوتی ہے:
0,college_medicine,ایک تیرہ ماہ کی بچی کی پرورش دو نگہداشت کرنے والوں نے کی ہے جو کبھی کبھار بچے کو نظر انداز کر دیتے ہیں۔,ایک آٹھ ماہ کا لڑکا بچہ جس کی پرورش ایک ہی نگہداشت کرنے والے نے کی ہے جو اکثر بچے کو نظرانداز کرتا ہے۔,ایک پانچ ماہ کا لڑکا بچہ محفوظ، مستحکم ماحول میں پرورش پاتا ہے۔,دو ماہ کی بچی کی پرورش ایک محفوظ، مستحکم ماحول میں ہوئی۔,اٹیچمنٹ تھیوری کے مطابق، نفسیاتی مطالعہ کے دوران، مندرجہ ذیل میں سے کون سا بچہ کسی مرد ماہر نفسیات سے منسلک ہونے کا زیادہ امکان رکھتا ہے، جو پہلے بچے کو معلوم نہیں تھا؟
1,college_medicine,گردوں میں creatinine.,گردوں میں امینو ایسڈ.,جگر میں امینو ایسڈ.,پٹھوں میں امینو ایسڈ.,کریٹائن اس سے ترکیب کی جاتی ہے:
2,college_medicine,CRF روکنے والے عنصر کی رہائی۔,کورٹیسول کا منفی فیڈ بیک لوپ۔,CRF کے جسم کے ذخیرے کی تھکن۔,ادورکک غدود میں خون کے بہاؤ کی رکاوٹ۔,ہائپوتھیلمس CRF کو جاری کرکے جسم کے تناؤ کے ردعمل کو کنٹرول کرتا ہے، جس سے جسم کے تناؤ کے ہارمون، کورٹیسول کی اخراج ہوتی ہے۔ آخر یہ محرک کس طریقہ کار سے دبایا جاتا ہے؟
3,college_medicine,I، II، اور IV,I، III، اور IV,II، III، اور IV,I، II، اور III,"ایک مقامی سیاست دان تعصب اور نفرت پر مبنی جرائم کو کم کرنے کے لیے ایک ٹاسک فورس شروع کرتا ہے، اور ٹاسک فورس تعلیم تک رسائی میں اضافے کے لیے سفارشات فراہم کرتی ہے، مختلف، ممکنہ طور پر متصادم، گروہوں، اور سخت نفرت مخالف آرڈیننس کے لوگوں کے لیے معاوضہ کمیونٹی کی بہتری کے پروجیکٹس کو منظور کیا جانا چاہیے۔ مقامی سطح پر. یہ سفارشات پر مبنی ہیں:
I. خود اعتمادی کا مفروضہ
II رابطہ مفروضہ
III مفروضہ
چہارم قانونی مفروضہ"
0,college_medicine,آکسیڈیٹیو فاسفوریلیشن۔,فاسفوکریٹائن,اے ڈی پی,اے ٹی پی,پٹھوں کے سکڑنے کی تمام شکلوں کے لیے توانائی فراہم کی جاتی ہے:
2,college_medicine,پرائمری ٹرانسکرپٹ سے بننے کے بعد mRNA مالیکیول کو الگ کرکے۔,بہت سے جینوں کی بنیادی نقلیں مختلف mRNAs پیدا کرنے کے لیے مختلف طریقوں سے الگ کی جا سکتی ہیں، یہ عمل متبادل RNA splicing کے نام سے جانا جاتا ہے۔,بنیادی نقل سے پیدا ہونے والے mRNA مالیکیول کی لمبائی کو دوگنا یا تین گنا کر کے۔,جین میں ڈی این اے کے مختلف حصوں کی منتخب نقل کے ذریعے۔,ایک ہی جین سے کئی مختلف پروٹین کیسے تیار کیے جا سکتے ہیں؟
3,college_medicine,سائٹوپلازم,سرکولیما,سب سیلولر کمپارٹمنٹس۔,مائٹوکونڈریا,پٹھوں کے خلیے میں فاسفوکریٹائن پایا جاتا ہے:
1,college_medicine,امینو ایسڈ,پیپٹائڈ,سٹیرائیڈ,انزیمیٹک,جسم میں گلوکوز کی بڑی سطح پر خون کے ہارمونز کے ردعمل کا تعین کرنے کے لیے ماؤس ماڈل کا استعمال کرتے ہوئے ایک سائنسدان نے ایک نیا ہارمون دریافت کیا جو پہلے بیان نہیں کیا گیا تھا۔ ان کے اعداد و شمار کے مطابق، یہ ہارمون خلیات کے اندر اور باہر دونوں جگہوں پر پایا جاتا ہے جب وہ اپنا کام انجام دیتا ہے، کام کرتے ہوئے خلیے میں نیوکلک ایسڈ کی مقدار بڑھاتا ہے، اور چار ہائیڈروکسی کاربن حلقوں پر مشتمل ساخت سے اخذ کیا جاتا ہے۔ اس کو ممکنہ طور پر کس قسم کے ہارمون کے طور پر درجہ بندی کیا جائے گا؟
1,college_medicine,کوڈنز,introns,exons,ایکسٹرون,جین کے کوڈنگ کے سلسلے کو کہا جاتا ہے:
0,college_medicine,صرف II اور III,صرف I اور III,صرف III,صرف میں,"درج ذیل میں سے ہر ایک علامتی ثقافت کے ذریعے علم کی ترسیل کی ایک مثال ہے سوائے:
I. ایک چھوٹا مکاک بندر ایک بوڑھے بندر سے سمندر میں کھانا دھونا سیکھ رہا ہے، یہاں تک کہ جب کھانا مٹی یا ریت سے ڈھکا نہ ہو۔
II ایک بچہ والدین سے بیس بال کے اصول سیکھ رہا ہے۔
III ایک فوجی تنظیم میں شامل افراد کا ایک نیا گروپ جو پرانے طلباء سے ہیزنگ رسومات کا تجربہ کر رہا ہے، جسے وہ بعد میں نئی ​​بھرتیوں پر انجام دیتے ہیں۔"
2,college_medicine,heterochromatin میں اضافہ: euchromatin تناسب,میتھیلیشن کی سرگرمی میں اضافہ,ہسٹون ڈیسیٹیل ٹرانسفریز سرگرمی میں کمی,ہسٹون ایسٹیل ٹرانسفریز سرگرمی میں اضافہ,یوکرائیوٹک سیل کے اپنے ڈی این اے میں اتنی زیادہ معلومات رکھنے کی بہت سی وجوہات میں سے ایک یہ ہے کہ کوڈنگ والے علاقوں کو کم کرنے کی صلاحیت جب ان کا اظہار نہ کیا جا رہا ہو۔ DNA پر عمل کرتے وقت، مندرجہ ذیل میں سے کون سا عمل عام طور پر جین کے اظہار میں کمی کا باعث بنے گا؟
2,college_medicine,دستیاب آکسیجن کی غیر موجودگی میں.,آکسیجن کے استعمال کے بغیر۔,گلائکوجن کے استعمال کے بغیر۔,ADP کی شمولیت کے بغیر۔,اینیروبک میٹابولزم سے مراد اے ٹی پی کی نسل ہے:
3,college_medicine,امینو ایسڈ,ڈی آکسیربوز,پیریمائڈائن,پورین,مندرجہ ذیل میں سے کون سا مالیکیول DNA کا حصہ نہیں بنتا؟
2,college_medicine,79,29,23,9,سونے (Au) کے پاس کتنے الیکٹران ہیں جن کا کوانٹم نمبر l = 2 ہے؟
3,college_medicine,erectile dysfunction کی شرح میں کمی۔,بہتر ذہنی صحت۔,فالج کے حجم میں اضافہ۔,دل کے دورے کے خطرے میں کمی۔,"سونا کا استعمال، جسے بعض اوقات ""سونا غسل"" کہا جاتا ہے، انتہائی گرمی کے لیے مختصر مدت کے غیر فعال نمائش کی خصوصیت ہے۔ اس نمائش سے ہلکے ہائپرتھرمیا کا پتہ چلتا ہے – جسم کے بنیادی درجہ حرارت میں اضافہ – جو کہ ایک تھرمورگولیٹری ردعمل پیدا کرتا ہے جس میں نیورو اینڈوکرائن، کارڈیو ویسکولر، اور سائٹو پروٹیکٹو میکانزم شامل ہوتے ہیں جو ہومیوسٹاسس کو بحال کرنے اور جسم کو مستقبل میں گرمی کے دباؤ کے لیے کنڈیشن کرنے کے لیے مل کر کام کرتے ہیں… حالیہ دہائیوں میں سونا غسل ابھرا عمر کو بڑھانے اور مجموعی صحت کو بہتر بنانے کے ایک ذریعہ کے طور پر، مشاہداتی، مداخلتی، اور میکانکی مطالعات کے مجبور ڈیٹا کی بنیاد پر۔ کووپیو اسکیمک ہارٹ ڈیزیز رسک فیکٹر (KIHD) اسٹڈی میں شرکاء کے مطالعے سے حاصل ہونے والے نتائج خاص طور پر دلچسپی کا باعث ہیں، مشرقی فن لینڈ سے تعلق رکھنے والے 2,300 سے زیادہ درمیانی عمر کے مردوں میں صحت کے نتائج کا جاری ممکنہ آبادی پر مبنی ہمہ گیر مطالعہ، جس نے مضبوط روابط کی نشاندہی کی۔ سونا کے استعمال اور موت اور بیماری میں کمی کے درمیان… KIHD کے نتائج سے پتہ چلتا ہے کہ جو مرد ہفتے میں دو سے تین بار سونا استعمال کرتے ہیں ان میں سونا استعمال نہ کرنے والے مردوں کی نسبت قلبی امراض سے مرنے کا امکان 27 فیصد کم تھا۔ مزید برآں، انہوں نے جو فوائد کا تجربہ کیا وہ خوراک پر منحصر پایا گیا: وہ مرد جنہوں نے سونا کا استعمال تقریباً دو بار کیا، ہفتے میں تقریباً چار سے سات بار، تقریباً دو گنا فوائد کا تجربہ کیا - اور قلبی امراض سے مرنے کے امکانات 50 فیصد کم تھے۔ اسباب[2] اس کے علاوہ، اکثر سونا استعمال کرنے والوں میں قبل از وقت موت کی تمام وجوہات سے مرنے کا امکان 40 فیصد کم پایا گیا۔ یہ نتائج عمر، سرگرمی کی سطح، اور طرز زندگی کے عوامل پر غور کرتے ہوئے بھی درست ثابت ہوئے جنہوں نے مردوں کی صحت کو متاثر کیا ہو گا۔ منحصر طریقہ. جن مردوں نے ہفتے میں دو سے تین بار سونا استعمال کیا ان میں ڈیمنشیا ہونے کا خطرہ 66 فیصد کم اور الزائمر کی بیماری میں مبتلا ہونے کا خطرہ 65 فیصد کم تھا، ان مردوں کے مقابلے جنہوں نے ہفتے میں صرف ایک بار سونا استعمال کیا… سونا سے منسلک صحت کے فوائد دماغی صحت کے دیگر پہلوؤں تک بھی استعمال کریں۔ KIHD مطالعہ میں حصہ لینے والے مرد جنہوں نے ہفتے میں چار سے سات بار سونا استعمال کیا ان میں نفسیاتی امراض پیدا ہونے کا امکان 77 فیصد کم تھا، قطع نظر اس کے کہ مردوں کی غذائی عادات، سماجی و اقتصادی حیثیت، جسمانی سرگرمی، اور سوزش کی کیفیت (جیسا کہ C-reactive پروٹین سے ماپا جاتا ہے۔ )…زیادہ درجہ حرارت کی نمائش جسم پر دباؤ ڈالتی ہے، جس سے تیز، مضبوط ردعمل پیدا ہوتا ہے۔ جلد اور بنیادی جسم کے درجہ حرارت میں نمایاں اضافہ ہوتا ہے، اور پسینہ آتا ہے۔ جلد پہلے گرم ہوتی ہے، 40 ° C (104 ° F) تک بڑھ جاتی ہے، اور پھر جسم کے بنیادی درجہ حرارت میں تبدیلیاں رونما ہوتی ہیں، آہستہ آہستہ 37 ° C (98.6 ° F، یا نارمل) سے بڑھ کر 38 ° C (100.4 ° F) اور پھر تیزی سے بڑھ کر 39°C (102.2°F)… کارڈیک آؤٹ پٹ، جسم کی آکسیجن کی ضرورت کے جواب میں دل کے کام کی مقدار کا ایک پیمانہ، 60 سے 70 فیصد تک بڑھتا ہے، جبکہ دل کی دھڑکن (دھڑکنوں کی تعداد) فی منٹ) بڑھتا ہے اور فالج کا حجم (خون پمپ کرنے کی مقدار) میں کوئی تبدیلی نہیں ہوتی۔ اس وقت کے دوران، جسم کے خون کے بہاؤ کا تقریباً 50 سے 70 فیصد حصہ کور سے جلد تک دوبارہ تقسیم کیا جاتا ہے تاکہ پسینہ آنے میں آسانی ہو۔ سونا میں نہانے کے دوران اوسطاً ایک شخص تقریباً 0.5 کلو گرام پسینہ کم کرتا ہے۔[11] شدید گرمی کی نمائش خون کے بنیادی حجم میں کمی کو کم کرنے کے لیے پلازما کے مجموعی حجم میں عارضی اضافے کو بھی آمادہ کرتی ہے۔ پلازما کے حجم میں یہ اضافہ نہ صرف پسینے کے لیے سیال کا ذخیرہ فراہم کرتا ہے، بلکہ یہ گاڑی کے ریڈی ایٹر میں موجود پانی کی طرح کام کرتا ہے، جسم کو ٹھنڈا کرتا ہے تاکہ جسم کے بنیادی درجہ حرارت میں تیزی سے اضافے کو روکا جا سکے اور گرمی کی برداشت کو فروغ دیا جا سکے۔ مستقبل کی نمائشوں کے لیے جسم کے ردعمل کو گرم اور بہتر بناتا ہے، ممکنہ طور پر ایک حیاتیاتی رجحان کی وجہ سے جسے ہارمیسس کہا جاتا ہے، ہلکے تناؤ کے سامنے آنے کے بعد معاوضہ دینے والا دفاعی ردعمل جو تناؤ کی شدت سے غیر متناسب ہے۔ Hormesis حفاظتی میکانزم کی ایک وسیع صف کو متحرک کرتا ہے جو نہ صرف سیل کو پہنچنے والے نقصان کی مرمت کرتا ہے بلکہ اس کے نتیجے میں مزید تباہ کن تناؤ سے بھی تحفظ فراہم کرتا ہے۔ درحقیقت، سونا کا استعمال ان لوگوں کے لیے ورزش کے متبادل کے طور پر تجویز کیا گیا ہے جو دائمی بیماری یا جسمانی حدود کی وجہ سے جسمانی سرگرمی میں حصہ لینے سے قاصر ہیں۔[13]

مضمون کے مطابق، درج ذیل میں سے کون سا سونا کے استعمال کا فائدہ نہیں ہے؟"
3,college_medicine,ایروبک میٹابولزم کا رشتہ دار حصہ بڑھتا ہے۔,خون میں گلوکوز کا ارتکاز 3 mmol/L سے کم ہے۔,پٹھوں کا پی ایچ 6.0 سے نیچے آتا ہے۔,anaerobic شراکت آہستہ آہستہ بڑھتی ہے.,سپرنٹ کی بڑھتی ہوئی تعداد کے ساتھ:
3,college_medicine,6 میٹر فی سیکنڈ,5 میٹر فی سیکنڈ,8 میٹر فی سیکنڈ,2 میٹر فی سیکنڈ,فائر ہوزز میں ہمیشہ نلی کے سرے پر ایک نوزل ​​ہوتی ہے، جو جزوی طور پر فائر ہائیڈرینٹ سے باہر نکلنے والے پانی کے رقبے کو کم کر کے ایک زیادہ طاقتور ندی بنانے کے لیے کام کرتی ہے۔ اگر فائر ہائیڈرنٹ سے پانی کی شروع ہونے والی رفتار 2 میٹر فی سیکنڈ ہے، دباؤ کو مستقل رکھا جاتا ہے، اور نوزل ​​کا اختتام نلی کے آغاز کے رقبہ کا 1/3 ہے، جب پانی نکلتا ہے تو اس کی آخری رفتار کتنی ہوگی؟ ?
1,college_medicine,3 اے ٹی پی۔,4 اے ٹی پی۔,5 اے ٹی پی۔,6 اے ٹی پی۔,FADH2 اور NADH+H کی شکل میں لے جانے والے الیکٹرانوں کے جوڑے اجتماعی طور پر ریفاسفوریلیٹ کے لیے کافی مفت توانائی پر مشتمل ہوتے ہیں:
1,college_medicine,50-60 سیکنڈ۔,30-40 سیکنڈ۔,5-10 سیکنڈ۔,1-2 سیکنڈ۔,اعلی توانائی والے فاسفیٹس، اے ٹی پی اور فاسفوکریٹائن کے ٹوٹنے سے خارج ہونے والی توانائی، تقریباً زیادہ سے زیادہ مشقت کو برقرار رکھ سکتی ہے:
