answer,subject,choice_3,choice_2,choice_1,choice_0,question
3,high_school_psychology,سزائیں رویے کی تعدد کو کم کرتی ہیں اور منفی کمک رویے کی تعدد میں اضافہ کرتی ہے۔,سزائیں بنیادی طور پر اس وقت استعمال ہوتی ہیں جب کسی حیاتیات کو رویے کو انجام دینے کی تربیت دی جاتی ہے اور منفی کمک کا استعمال کسی حیاتیات کو رویے کو انجام دینے سے روکنے کے لیے تربیت دینے کے لیے کیا جاتا ہے۔,منفی کمک کلاسیکی کنڈیشنگ میں استعمال ہوتی ہے، اور سزائیں آپریٹ کنڈیشنگ میں استعمال ہوتی ہیں۔,سزائیں غیر انسانی جانوروں کے ساتھ استعمال کی جاتی ہیں، اور منفی کمک انسانوں کے ساتھ استعمال ہوتی ہے۔,منفی کمک اور سزا کے درمیان بڑا فرق کیا ہے؟
1,high_school_psychology,ایک سے زیادہ نقطہ نظر سے بچنے والا تنازعہ۔,اجتناب سے بچنے کا تنازعہ۔,نقطہ نظر سے بچنے کا تنازعہ۔,نقطہ نظر کا تنازعہ۔,لوپ کچھ مہینوں سے کریگ سے ڈیٹنگ کر رہے ہیں۔ وہ اس کی طرف متوجہ ہے اور اس کے ساتھ مذاق کرتی ہے، لیکن وہ اس کے دوستوں یا اس کے خاندان کو برداشت نہیں کر سکتی۔ لوپ کے تنازعہ کو بہترین درجہ بندی کیا جائے گا۔
3,high_school_psychology,وقت کے ساتھ رویے میں تبدیلیاں,ثقافتی ماحول,صنفی اختلافات,عمر کا فرق,ایک طولانی مطالعہ مندرجہ ذیل میں سے کس کا اندازہ لگانے میں مفید ہو گا؟
1,high_school_psychology,صرف I اور II,صرف III,صرف II,صرف میں,ہارلو کے مطالعہ کے مضمرات (مصنوعی ماؤں کے ذریعے پالے جانے والے بندروں کے بچے) میں درج ذیل میں سے کون سا شامل ہے؟
3,high_school_psychology,طبقاتی رویے کے انتظام کے منصوبے کو نافذ کرنا، جیسے کہ رسپانس کوسٹ ریفل۔,مطالعہ کی مہارت، حاضری، فیصلہ سازی، مسائل کو حل کرنے، اور اہداف کی ترتیب جیسے مسائل کو حل کرنے کے لیے اسکول پر مبنی گروپ مشاورت فراہم کرنا۔,جن طلباء کو نظم و ضبط کے حوالہ جات موصول ہوئے ہیں ان کے لیے جامع جذباتی اور طرز عمل کے جائزوں کا استعمال,ان 26 طلباء کے لیے انفرادی رویے کے معاہدے تیار کرنا جنہیں نظم و ضبط کے حوالہ جات موصول ہوئے ہیں۔,اسکول کے ایک ماہر نفسیات سے کہا جاتا ہے کہ وہ مس اسمتھ کو ان مسائل کے حل میں مدد کرے جو اس کے طلباء کے سیکھنے میں خلل ڈال رہے ہیں۔ اسکول کے ماہر نفسیات کو ڈیٹا دیا جاتا ہے جو اس بات کی نشاندہی کرتا ہے کہ محترمہ سمتھ کی کلاس میں 30 میں سے 26 طلباء پر نظم و ضبط کے حوالے لکھے گئے ہیں۔ اسکول کے ماہر نفسیات کے لیے مندرجہ ذیل میں سے کس کی سفارش کرنا بہتر ہے؟
2,high_school_psychology,ترقیاتی,صنعتی/تنظیمی,تعلیمی,مشاورت,ڈاکٹر بونیو نے ایک کمپنی کو اپنے دفاتر کو نئے سرے سے ڈیزائن کرنے میں مدد کی تاکہ ملازمین کے حوصلے اور پیداواری صلاحیت کو بلند کیا جا سکے۔ نفسیات کے درج ذیل ذیلی شعبوں میں سے ڈاکٹر بونیو کا ممکنہ طور پر کون سا تعلق ہے؟
2,high_school_psychology,شماریات دانوں کے لیے کوئی اہمیت نہیں رکھتے تھے۔,موقع کی وجہ سے ہو سکتا ہے,مضبوط نہیں تھے,اہم نہیں تھے,"بیری نے رپورٹ کیا کہ ان کے مطالعے میں، مذہبیت اور تعلیمی درجات کے درمیان تعلق شماریاتی لحاظ سے اہم نہیں تھا۔ ""اعداد و شمار کے لحاظ سے اہم نہیں"" سے اس کا مطلب تھا کہ نتائج"
3,high_school_psychology,تصدیق کا تعصب معالجین کے خیالات اور ذہنی مریضوں کے علاج پر اثر انداز ہو سکتا ہے۔,طبی پیشہ وروں کو قائل کرنا مشکل ہے کہ کسی کو خرابی ہوتی ہے جب اسے نہیں ہوتا ہے۔,مردوں میں ایک جیسی علامات کی اطلاع دینے والی خواتین سے زیادہ شرح پر تشخیص کی جاتی ہے۔,نجی اداروں میں علاج سرکاری اداروں میں علاج سے بہتر ہوتا ہے۔,ذہنی اداروں کے Rosenhan مطالعہ نے ظاہر کیا کہ
2,high_school_psychology,ہر سیل کے پاس موجود محوروں کی تعداد,توانائی کی اقسام جو وہ منتقل کرتے ہیں۔,ان کی ایکشن پوٹینشل میں شامل آئن,ان کی جھلیوں کی آرام کی صلاحیتوں کی وسعت,عملی طور پر، آنکھ کے ریٹنا میں ریسیپٹرز کان کے کوکلیہ میں رسیپٹرز سے سب سے زیادہ مختلف ہوتے ہیں۔
2,high_school_psychology,یادوں کو انکوڈ کرنے میں ناکامی۔,بازیافت کی ناکامی۔,بتدریج زوال,نقل مکانی,وائلڈر پین فیلڈ کے مطالعے سے پتہ چلتا ہے کہ دماغ کی برقی محرک کے ذریعے کچھ دیرینہ کھوئی ہوئی یادیں حاصل کی جا سکتی ہیں۔ اس سے پتہ چلتا ہے کہ بھول جانا ایک معاملہ ہوسکتا ہے۔
1,high_school_psychology,متضاد,اجازت دینے والا,مستند,آمرانہ,بچے زیادہ قابل اور ذمہ دار بنتے ہیں جب ان کی پرورش والدین کے ذریعہ کی جاتی ہے جو اس انداز میں برتاؤ کرتے ہیں
2,high_school_psychology,تاخیر کی مدت.,phallic مرحلے.,مقعد کا مرحلہ,زبانی مرحلے.,ایرکسن کی پہل بمقابلہ جرم کے مرحلے کا فرائیڈ سے گہرا تعلق ہے۔
0,high_school_psychology,مرحلہ 3 نیند,مرحلہ 2 نیند,مرحلہ 1 نیند,شعور,EEGs جو بنیادی طور پر الفا اور بیٹا لہروں پر مشتمل ہوتے ہیں ان کی خصوصیت ہے۔
2,high_school_psychology,صرف ٹیسٹ لے رہے ہیں,"لیکچر کلاسز میں نہیں جانا، جائزہ کتاب پڑھنا، اور ""Discovering Psychology"" دیکھنا","لیکچر کلاسز میں جانا، جائزہ کتاب پڑھنا، اور ""Discovering Psychology"" دیکھنا",لیکچر کی کلاسوں میں جانا,"جیرڈ کا خیال ہے کہ سائیکالوجی لیکچر کلاسز میں جانا وقت کا ضیاع ہے اور آپ کورس میں بھی ایسا ہی کر سکتے ہیں اگر آپ صرف نظرثانی کی کتاب پڑھیں، ""Discovering Psychology"" دیکھیں اور ٹیسٹ دیں۔ وہ اپنے مفروضے کو ایک تجربے کے ساتھ جانچنے کا فیصلہ کرتا ہے۔ اس کے تجربے میں آزاد متغیر ہے۔"
3,high_school_psychology,الگ الگ,بے بسی سیکھی,علمی اختلاف,معاشرتی کاہلی,گینگ ممبران کے کچھ گروپ جب لوگوں پر حملہ کرتے ہیں تو سر ڈھانپتے ہیں اور دھوپ کا چشمہ پہنتے ہیں۔ اس طرح کے بھیس کے استعمال میں مدد ملتی ہے۔
2,high_school_psychology,ونڈٹ نے یونیورسٹی کے نظام سے باہر کام کیا اور اسے ایک آزاد مفکر کے طور پر دیکھا گیا۔,ونڈٹ نے ایک تجربہ گاہ قائم کی اور تجرباتی ثبوتوں پر توجہ مرکوز کی جن کو نقل کیا جا سکتا ہے۔,Wundt نے اچھی طرح لکھا اور نتائج کو بڑی تعداد میں لوگوں تک مؤثر طریقے سے پہنچایا۔,Wundt اعلی طبقے کا ایک رکن تھا، جس نے اس کی ساکھ میں مدد کی.,مندرجہ ذیل میں سے کون سی ونڈٹ کی ابتدائی تحقیق کی سب سے اہم تفصیل ہے جس نے نفسیات کو سائنس کے طور پر قائم کیا؟
3,high_school_psychology,خارش,سردی,چھو,درد,مندرجہ ذیل میں سے کون سا بنیادی somatosensation نہیں ہے؟
3,high_school_psychology,سماجی ثقافتی,حیاتیاتی,طرز عمل,نفسیاتی,علمی ترقی کے مطالعہ کے لیے لیو ویگوٹسکی کا نقطہ نظر تھا۔
2,high_school_psychology,علاج کے دوران کلائنٹ کے کہنے کو دہرانا یا دوبارہ بیان کرنا,ان کے اعمال کے نتائج کو کنٹرول کرکے مریضوں کو متاثر کرنا,کلائنٹس کے سوچنے کے غیر منطقی طریقوں کو سختی سے چیلنج کرنا,اضطراب پیدا کرنے والے تجربات کے درجہ بندی کی نشاندہی کرنے میں مریضوں کی مدد کرنا,رویے کی تھراپی عام طور پر گاہکوں کے جواب دینے کے پیٹرن کو تبدیل کرتی ہے
3,high_school_psychology,روشنی کے لیے کم مطلق حد ہے۔,روشن رنگوں کو زیادہ تیزی سے جواب دیں۔,دوئبرووی خلیات کے ساتھ synapse.,ریٹنا کے مرکز میں واقع ہیں.,لوگوں میں، چھڑی، شنک کے برعکس،
3,high_school_psychology,وجودی تھراپی,انسانی علاج,رویے کی تھراپی,نفسیاتی تجزیہ,اس سے پہلے کہ جسٹن ہوائی جہاز کی پرواز لے سکے، اسے پرواز کے اپنے خوف پر قابو پانے کی ضرورت تھی۔ اس کے معالج نے اسے آرام کی مشقیں سکھائیں، جس کی مشق اس نے پہلے ہوائی جہازوں کی تصویریں دیکھتے ہوئے کی، پھر انہیں ایئرپورٹ پر اتارتے ہوئے دیکھا، پھر خالی جہاز میں جانا جو ٹیک آف نہیں کرے گا، پھر آخر میں مختصر پرواز کی۔ اس نے مندرجہ ذیل میں سے کون سا علاج کروایا؟
3,high_school_psychology,نفسیاتی,علمی,برتاؤ,حیاتیاتی,سگمنڈ فرائیڈ نفسیات میں درج ذیل میں سے کس نقطہ نظر کا بانی تھا؟
3,high_school_psychology,شیر خوار بچوں اور چھوٹے بچوں کے لیے ایک پروٹو ٹائپیکل اصولی تشخیص وضع کیا۔,بچوں کے ساتھ استعمال کے لیے موزوں تھیمیٹک پرسیپشن ٹیسٹ کا ایک ورژن تیار کیا۔,نیشنل ایسوسی ایشن آف سکول سائیکالوجسٹس کے اخلاقی معیارات قائم کیے ہیں۔,علمی ترقی کے چار بڑے ادوار کی نشاندہی کی۔,آرنلڈ گیسل اسکول کی نفسیات کی تاریخ کے لیے اہم ہے کیونکہ وہ
2,high_school_psychology,ہارورڈ، ییل اور سٹینفورڈ,مقامی کمیونٹی کالج اور دور دراز کے کمیونٹی کالج,سٹینفورڈ، آکسفورڈ، اور اس کی ریاست میں سب سے زیادہ مسابقتی ریاستی کالج,ہارورڈ، سٹینفورڈ، اور مقامی کمیونٹی کالج,ماریہ، ایک روشن ہائی اسکول کی طالبہ، کامیابی سے ڈرتی ہے۔ وہ مندرجہ ذیل میں سے کس کالج میں سب سے زیادہ درخواست دے گی؟
1,high_school_psychology,پروجیکشن,میٹھے لیموں کی عقلیت,نقل مکانی,کھٹے انگور کی عقلیت,دوسری جنگ عظیم کے دوران لاکھوں یہودیوں اور دیگر اقلیتوں کو اس لیے ذبح کر دیا گیا کہ جرمنی کے مالی اور سماجی مسائل کے لیے انہیں مورد الزام ٹھہرایا گیا۔ اس طرح کی قربانی کا بکرا بیان کرتا ہے۔
1,high_school_psychology,نیوران کا Synaptic درار ایک آبی مزاح سے بھرا ہوا ہے۔,محور لپڈس کے سخت کوٹ میں ڈھکے ہوئے ہیں، جو اعصابی فائرنگ میں رکاوٹ ہیں۔,بنیادی بصری پرانتستا سے اعصابی کنکشن مکمل طور پر جڑے ہوئے نہیں ہیں۔,رنویر کے نوڈس ابھی تک نہیں بنے ہیں۔,مندرجہ ذیل میں سے کون بہتر وضاحت کرتا ہے کہ زندگی کے پہلے چند ہفتوں تک بچوں کی بصارت کیوں کم ہوتی ہے؟
3,high_school_psychology,میڈولا,دماغی پرانتستا,سیریبیلم,somatosensory cortex,مندرجہ ذیل میں سے کون سا ڈھانچہ دماغ کے سب سے مرکزی اور محفوظ حصے پر واقع ہے؟
0,high_school_psychology,معاشرتی کاہلی,اولیت کا اثر,اثر کا قانون,خود کو پورا کرنے والی پیشن گوئی,طلباء کو معذور کے طور پر لیبل کرنے کی ایک عام تنقید یہ ہے کہ افراد لیبل سے وابستہ خصوصیات کے مطابق کارکردگی کا مظاہرہ کرتے ہیں۔ یہ کارکردگی کا مظاہرہ مندرجہ ذیل میں سے کن ناموں سے جانا جاتا ہے؟
3,high_school_psychology,بصیرت,اثر کا قانون,آپریٹ کنڈیشنگ,کلاسیکی کنڈیشنگ,سکاٹ نے 20 منٹ تک NEBOTYA حروف کو ایک لفظ کے ہجے کرنے کی کوشش کی، لیکن کامیاب نہیں ہوا۔ کلاس کی طرف چلتے ہوئے اچانک جواب آیا کہ یہ لفظ BAYONET ہے۔ یہ مثال دیتا ہے۔
3,high_school_psychology,نتائج سے پتہ چلتا ہے کہ ٹیسٹ میں ٹیسٹ کی دوبارہ جانچ کی قابل اعتمادی کم ہے۔,ان ٹیسٹ کے اصولوں اور معیاری کاری کو شاید بہتری کی ضرورت ہے۔,یہ ٹیسٹ ممکنہ طور پر تعمیر کی درستگی میں زیادہ ہے لیکن زیادہ پیش گوئی نہیں کرتا ہے۔,اس پرسنیلٹی ٹیسٹ میں کم قابل اعتماد لیکن زیادہ درستگی ہے۔,ایک ماہر نفسیات شخصیت کے ٹیسٹ کے بارے میں کیا نتیجہ اخذ کرے گا جو کسی شخص کو بتاتا ہے کہ وہ پہلی بار ٹیسٹ دینے پر ایک انتہائی ایکسٹروورٹ ہے اور اگلی بار جب وہ ٹیسٹ دیتی ہے تو وہ ایک انتہائی انٹروورٹ ہے؟
0,high_school_psychology,"""تار"" ماں کے لیے بچوں کی ترجیح",دودھ کے ذرائع کے لیے بچوں کی ترجیح,"""تار"" ماں بمقابلہ ""کپڑا"" ماں","جس کے ساتھ ""ماں"" دودھ کی بوتل رکھی ہے۔","جذباتی لگاؤ ​​کے ہارلو مطالعہ میں، شیر خوار بندروں کو ایک پنجرے میں رکھا گیا تھا اور انہیں ایک ""تار"" ماں اور ""کپڑا"" ماں دونوں دیے گئے تھے۔ اس کے بعد محققین نے دودھ کی بوتل کو ایک ماں سے دوسری ماں میں منتقل کیا اور مختلف محرکات کو متعارف کرایا تاکہ یہ معلوم کیا جا سکے کہ آیا بندر ""ماؤں"" میں سے کسی ایک سے منسلک ہو جائیں گے۔ اس تجربے میں، آزاد متغیر ہے۔"
3,high_school_psychology,انتخابی,نفسیاتی,حیاتیاتی,علمی رویے.,زو کے اینوریکسیا نرووسا کے علاج کے لیے، اس کے ڈاکٹروں نے اسے نس کے ذریعے کھانا کھلانے والی ٹیوبوں پر ڈالا، اس کے غیر معقول عقیدے کو تبدیل کرنے کی کوشش کی کہ وہ بہت موٹی ہے، اور اس بات پر تبادلہ خیال کیا کہ اس کے ابتدائی خاندانی تعلقات اس کے موجودہ مسائل میں کس طرح معاون ثابت ہو سکتے ہیں۔ اس نقطہ نظر کو بہترین طور پر درجہ بندی کیا جائے گا۔
1,high_school_statistics,2P(t > 1.54) df = 7 کے ساتھ,P(t > 1.54) df = 7 کے ساتھ,2P(t > 1.54) df = 6 کے ساتھ,P(t > 1.54) df = 6 کے ساتھ,بوتل کے لیبل کے مطابق اسپرین کی گولی کا وزن 300 ملی گرام ہے۔ ایک ایف ڈی اے تفتیش کار سات گولیوں کے ایک سادہ بے ترتیب نمونے کا وزن کرتا ہے، 299، 300، 305، 302، 299، 301، اور 303 کا وزن حاصل کرتا ہے، اور مینوفیکچرر کے دعوے کا مفروضہ ٹیسٹ چلاتا ہے۔ مندرجہ ذیل میں سے کون اس ٹیسٹ کی P- ویلیو دیتا ہے؟
2,high_school_statistics,25.3 سے 35 منٹ,25.3 سے 44.7 منٹ,31.7 سے 39.3 منٹ,0 سے 31.7 منٹ,"نئی رولر کوسٹر سواری کے انتظار کے اوقات عام طور پر 35 منٹ کے اوسط اور 10 منٹ کے معیاری انحراف کے ساتھ تقسیم کیے جاتے ہیں۔ اگر پہلی موسم گرما میں 150,000 سوار ہیں، تو درج ذیل میں سے کون سا کم ترین وقت کا وقفہ ہے جو 100,000 سواروں کے ساتھ وابستہ ہے؟"
3,high_school_statistics,تقریباً 95% نتائج اوسط کے دو معیاری انحراف کے اندر ہوں گے۔,اوسط (متوقع قدر) ہمیشہ ہر قدر کو اس کے متعلقہ امکان سے ضرب دے کر حاصل کردہ مصنوعات کے مجموعے کے برابر ہوتا ہے۔,ممکنہ نتائج باہمی طور پر خصوصی ہونے چاہئیں۔,ممکنہ نتائج سبھی عددی ہونے چاہئیں۔,مندرجہ ذیل تمام بیانات تمام مجرد بے ترتیب متغیرات کے لیے درست ہیں سوائے کس کے؟
3,high_school_statistics,ٹیسٹ کی طاقت اس کی متبادل مفروضے کا پتہ لگانے کی صلاحیت سے متعلق ہے۔,اگر مفروضے کا ٹیسٹ 1% کی سطح پر کیا جاتا ہے، تو 1% امکان ہے کہ مفروضے کو مسترد کر دیا جائے۔,آیا ایک یا دو طرفہ ٹیسٹ استعمال کرنا ہے اس کا فیصلہ عام طور پر ڈیٹا اکٹھا کرنے کے بعد کیا جاتا ہے۔,اگر 10% کی سطح پر کالعدم مفروضے کو مسترد کرنے کے لیے کافی ثبوت موجود ہیں، تو 5% کی سطح پر اسے مسترد کرنے کے لیے کافی ثبوت موجود ہیں۔,مفروضے کی جانچ کے بارے میں درج ذیل میں سے کون سا سچا بیان ہے؟
3,high_school_statistics,ڈیٹا سیٹ میں دیگر مشاہدات سے نمایاں طور پر مختلف ہے۔,ڈیٹا سیٹ میں موجود دیگر مشاہدات سے ہمیشہ چھوٹا ہوتا ہے۔,ڈیٹا سیٹ میں دیگر مشاہدات کے مقابلے میں کم کثرت سے دیکھا جاتا ہے۔,ڈیٹا سیٹ میں دوسرے مشاہدات سے زیادہ کثرت سے دیکھا جاتا ہے۔,ایک outlier ایک مشاہدہ ہے کہ
3,high_school_statistics,"اس بات کا 95% امکان ہے کہ اسکول میں فی خاندان کی اوسط آمدنی $35,095 اور $45,005 کے درمیان ہے۔","اگر ہم اسی سائز کا دوسرا نمونہ لیں اور 95 فیصد اعتماد کے وقفے کی گنتی کریں، تو ہمارے پاس وقفہ ($35,095, $45,005) حاصل کرنے کا 95% امکان ہوگا۔","اس بات کا 95% امکان ہے کہ اس اسکول کے تمام طلباء کے خاندانوں کی آمدنی $35,095 اور $45,005 کے درمیان ہے۔","اس کے اسکول میں 95 فیصد طلباء ایسے خاندانوں سے ہیں جن کی آمدنی $35,095 اور $45,005 کے درمیان ہے۔","اسکول کی پرنسپل اپنے طلباء کی فی خاندان اوسط آمدنی کا تخمینہ لگانے میں دلچسپی رکھتی ہے۔ وہ طلباء کا بے ترتیب نمونہ منتخب کرتی ہے اور ان کی خاندانی آمدنی کے بارے میں معلومات جمع کرتی ہے۔ فی خاندان اوسط آمدنی کے لیے اس ڈیٹا سے 95 فیصد اعتماد کا وقفہ شمار کیا جاتا ہے ($35,095, $45,005)۔ مندرجہ ذیل میں سے کون اس اعتماد کے وقفے کی بہترین تشریح فراہم کرتا ہے؟"
3,high_school_statistics,قسم I کی غلطی کا امکان وہی رہے گا اور طاقت بڑھے گی۔,قسم II کی غلطی کا امکان اور طاقت دونوں بڑھ جائیں گے۔,قسم I کی غلطی کا امکان اور طاقت دونوں بڑھ جائیں گے۔,قسم I کی غلطی کا امکان اور قسم II کی غلطی کا امکان دونوں کم ہو جائیں گے۔,محققین 0.05 کی اہمیت کی سطح کا استعمال کرتے ہوئے ایک تجربہ کر رہے ہیں۔ باطل مفروضہ درحقیقت غلط ہے۔ اگر وہ ہر علاج کے لیے دو گنا زیادہ تجرباتی یونٹس استعمال کرنے کے لیے اپنے تجربے میں ترمیم کرتے ہیں، تو درج ذیل میں سے کون سا درست ہوگا؟
3,high_school_statistics,عورت، کیونکہ اس کا قد تمام عورتوں کے اوسط قد سے 1.33 معیاری انحراف ہے، جب کہ مرد کا قد تمام مردوں کے اوسط قد سے صرف ایک معیاری انحراف ہے۔,مرد، کیونکہ اس کا قد 74 انچ ہے اور عورت صرف 70 انچ لمبا ہے۔,اس کا تعین نہیں کیا جا سکتا، کیونکہ دونوں گروہوں کے لیے بلندیوں کے معیاری انحراف مختلف ہیں۔,اس کا تعین نہیں کیا جا سکتا، کیونکہ دونوں گروہوں کی اوسط بلندیاں مختلف ہیں۔,بالغ مردوں کا اوسط قد 70 انچ ہے، جس میں معیاری انحراف چار انچ ہے۔ بالغ خواتین کی اوسط اونچائی 66 انچ ہے، جس میں معیاری انحراف تین انچ ہے۔ 74 انچ اونچائی والے مرد اور 70 انچ کی اونچائی والی عورت کے درمیان، اس کی متعلقہ جنس میں غیر معمولی طور پر لمبا کون ہے؟
2,high_school_statistics,t-تقسیم عام تقسیم سے زیادہ پھیلی ہوئی ہے۔,t-تقسیم کا ہمیشہ مطلب 0 اور معیاری انحراف 1 ہوتا ہے۔,t-تقسیم گھنٹی کے سائز کی اور ہم آہنگی والی ہیں۔,ڈی ایف (آزادی کی ڈگری) کی مختلف قدروں کے لیے مختلف ٹی ڈسٹری بیوشنز ہیں۔,مندرجہ ذیل میں سے کون سا t-تقسیم کے بارے میں درست نہیں ہے؟
3,high_school_statistics,یہ مطالعہ ایک تجربہ تھا جس میں مضامین کو ان کے اپنے کنٹرول کے طور پر استعمال کیا گیا تھا۔,اس قسم کے مطالعے میں پلیسبو اثر غیر متعلقہ ہے۔,مسدود کرنے کی کمی اسے ایک ناقص ڈیزائن شدہ مطالعہ بناتی ہے۔,یہ مطالعہ ایک مشاہداتی مطالعہ تھا۔,رد عمل کے وقت پر الکحل کے اثر کا مطالعہ کرنے کے لیے، مضامین کو تصادفی طور پر منتخب کیا گیا اور انہیں استعمال کرنے کے لیے تین بیئر دی گئیں۔ ایک سادہ محرک پر ان کے ردعمل کا وقت شراب پینے سے پہلے اور بعد میں ماپا گیا۔ مندرجہ ذیل میں سے کون سا بیان درست ہے؟
0,high_school_statistics,یہ ایک ایسے نمونے کی وضاحت کرتا ہے جو آبادی کا نمائندہ نہیں ہے۔,یہ نمونے لینے کے عمل میں بے ترتیب ہونے کی کمی کو بیان کرتا ہے۔,یہ ایک ایسے عمل کی وضاحت کرتا ہے جس کے نتیجے میں ایک نمونہ ہوتا ہے جو آبادی کی نمائندگی نہیں کرتا ہے۔,یہ ایک ایسے عمل کی وضاحت کرتا ہے جو تخمینہ بناتا ہے جو اوسط پر بہت زیادہ یا اوسط سے بہت کم ہیں۔,ان میں سے کون سا بیان تعصب کی صحیح وضاحت کرتا ہے؟
