answer,subject,choice_3,choice_2,choice_1,choice_0,question
2,college_computer_science,{نند},{اور، یا},{نہیں، یا},{اور، نہیں},بولین آپریٹرز کا کوئی بھی سیٹ جو تمام بولین ایکسپریشنز کی نمائندگی کرنے کے لیے کافی ہے اسے مکمل کہا جاتا ہے۔ مندرجہ ذیل میں سے کون مکمل نہیں ہے؟
2,college_computer_science,M = 6، m = 4,M = 7، m = 4,M = 10، m = 1,M = 10، m = 10,10 نوڈس اور 6 کناروں کے ساتھ تمام غیر ہدایت شدہ گرافس کے مجموعہ پر غور کریں۔ مجموعے میں کسی بھی گراف میں بالترتیب M اور m کو مربوط اجزاء کی زیادہ سے زیادہ اور کم از کم تعداد ہونے دیں۔ اگر کسی گراف میں کوئی سیلف لوپ نہیں ہے اور نوڈس کے کسی بھی جوڑے کے درمیان زیادہ سے زیادہ ایک کنارہ ہے، تو درج ذیل میں سے کون سا سچ ہے؟
2,college_computer_science,صرف I اور III,صرف I اور II,صرف III,صرف میں,"ریزولوشن تھیوریم یہ ثابت کرنے کے لیے کہ تجویزی منطق کا فارمولہ قابل اطمینان نہیں ہے درج ذیل میں سے کون سی خصوصیات ہیں؟
I. یہ اس لحاظ سے ایک ساؤنڈ پروف سسٹم ہے کہ تجویزی منطق کے قابل اطمینان فارمولے کی عدم اطمینان کا کوئی ثبوت موجود نہیں ہے۔
II یہ اس لحاظ سے ایک مکمل ثبوت کا نظام ہے کہ تجویزی منطق کے ہر ناقابل تسلی بخش فارمولے کے لیے عدم اطمینان کا ثبوت ہے۔
III یہ اس لحاظ سے ایک مختصر ثبوت کا نظام ہے کہ جب بھی تجویزی منطق کا ایک ناقابل تسلی بخش فارمولہ F کے پاس ریزولوشن پروف ہوتا ہے، F کے پاس بھی ایک ثبوت ہوتا ہے جس کی لمبائی F کی لمبائی میں کثیر الثانی ہوتی ہے۔"
1,college_computer_science,I اور III,صرف III,صرف II,صرف میں,"مندرجہ ذیل میں سے کون سے بیانات ایک خالص سیگمنٹڈ میموری سسٹم کی خصوصیات کو بیان کرتے ہیں؟
I. یہ میموری کو برابر سائز کی اکائیوں میں تقسیم کرتا ہے۔
II یہ مجازی میموری کے نفاذ کی اجازت دیتا ہے۔
III یہ اندرونی ٹوٹ پھوٹ کا شکار ہے۔"
2,college_computer_science,کچھ عقلی اعداد کی کوئی صحیح نمائندگی نہیں ہوتی۔,مناسب راؤنڈ آف کنونشنز کے ساتھ ایسوسی ایٹیوٹی حاصل کی جا سکتی ہے۔,یہ فطری طور پر غیر مربوط ہے کیونکہ اعداد کے سائز پر اوپری اور نچلی حدیں ہونی چاہئیں۔,یہ فطری طور پر غیر مربوط ہے کیونکہ کچھ نمبروں کی کوئی صحیح نمائندگی نہیں ہوتی ہے۔,فلوٹنگ پوائنٹ ریاضی کے بارے میں درج ذیل میں سے کون سا بیان درست نہیں ہے؟
2,college_computer_science,اگر کوئی صارف جو فائل کو شیئر کرتا ہے وہ اس کے ساتھ مل جاتا ہے، دوسرے جو اسے شیئر کرتے ہیں وہ نئے ڈسک بلاکس تک رسائی حاصل نہیں کر سکیں گے۔,اگر مالک کو فائل کو حذف کرنے کی اجازت ہے، تو لٹکنے والے لنکس کا نتیجہ ہو سکتا ہے۔,اگر مالک فائل کا نام تبدیل کرتا ہے، تو دوسرے صارفین اس تک رسائی حاصل نہیں کر سکیں گے۔,اگر مالک فائل میں ترمیم کرتا ہے، تو دوسرا صارف جو اشتراک نہیں کرتا ہے وہ تبدیلیاں دیکھے گا۔,فرض کریں کہ ملٹی لیول ڈائرکٹری ڈھانچے میں ٹائلوں کا اشتراک ڈائریکٹری اندراجات کے ساتھ حاصل کیا جاتا ہے جو مشترکہ فائل کے بارے میں معلومات پر مشتمل نوڈ کی طرف اشارہ کرتے ہیں۔ اس نوڈ میں موجود معلومات میں (1) فائل کا مالک، (2) ٹائل کے لنکس کی تعداد، اور (3) فائل کے ڈسک بلاک نمبرز شامل ہیں۔ اشتراک کے اس نقطہ نظر میں بنیادی خرابی کیا ہے؟
3,college_computer_science,I، II، اور III,صرف I اور II,صرف III,کوئی نہیں۔,"ضم کرنے کا کام n نمبروں کی فہرست کو نصف میں تقسیم کر کے، ہر نصف کو بار بار چھانٹ کر، اور دو حصوں کو ملا کر کام کرتا ہے۔ مندرجہ ذیل میں سے کون سا ڈیٹا ڈھانچہ انضمام کو O(n log n) وقت میں کام کرنے کی اجازت دے گا؟
I. اکیلے منسلک فہرست
II دوگنا منسلک فہرست
III ایک صف"
0,college_computer_science,2n,n + 2,n + 1,n,اگر p(x) n + 1 الگ حقیقی اعداد x0 پر حقیقی قدر والے فنکشن f(x) کے لیے کم سے کم ڈگری انٹرپولیٹنگ کثیر الثانی ہے، .... xn p(x) کی زیادہ سے زیادہ ممکنہ ڈگری کیا ہے؟
0,college_computer_science,13,10,8,3,"اندرونی ہیش ٹیبل میں 5 بالٹیاں ہوتی ہیں، جن کی تعداد 0، 1، 2، 3، 4 ہوتی ہے۔ کلیدیں عددی ہوتی ہیں، اور ہیش فنکشن h(i) = i mod 5 استعمال ہوتا ہے، تصادم کی لکیری ریزولوشن کے ساتھ (یعنی، اگر بالٹی h( i) بھرا ہوا ہے، بالٹیاں h(i) + 1, h(i) + 2, ... کو تمام بالٹی نمبروں کے حسابی موڈیولو 5 کے ساتھ لگاتار آزمایا جاتا ہے)۔ اگر کلید 13، 8، 24، 10، اور 3 والے عناصر کو داخل کیا جاتا ہے، اس ترتیب سے، ابتدائی طور پر خالی ہیش ٹیبل میں، پھر بالٹی کا مواد نمبر 2 ہے"
2,college_computer_science,آپریٹنگ سسٹم کے فن تعمیر کے درمیان اختلافات سے نمٹنا,مشینوں کے درمیان بڑے (ملٹی پیکٹ) پیغامات کی قابل اعتماد ترسیل جو ضروری نہیں کہ براہ راست منسلک ہوں۔,براہ راست منسلک مشینوں کے درمیان پیکٹوں کی قابل اعتماد ترسیل,نیٹ ورک کے ذریعے پیکٹوں کو روٹنگ کرنا,TCP پروٹوکول (دوسری چیزوں کے علاوہ) کے لیے ذمہ دار ہے۔
0,college_computer_science,صرف I اور II,صرف III,صرف II,صرف میں,"علامات کے کچھ حروف تہجی کے لیے Σ* سے A اور B کو الفاظ کے دو سیٹ ہونے دیں۔ فرض کریں کہ B A کا ذیلی سیٹ ہے۔ مندرجہ ذیل میں سے کون سا بیان ہمیشہ A اور B کا درست ہونا چاہیے؟
I. اگر A محدود ہے، تو B محدود ہے۔
II اگر A باقاعدہ ہے، تو B باقاعدہ ہے۔
III اگر A سیاق و سباق سے پاک ہے، تو B سیاق و سباق سے پاک ہے۔"
3,college_computer_science,مندرجہ بالا میں سے کوئی بھی نہیں۔,(xy)^M = y^Mx^M,(ax)^M = (xa)^M,a^M = a,"تمام سٹرنگز x کے لیے، فنکشن x^M کو بار بار اس طرح بیان کیا گیا ہے۔
e^M = e، اور
اگر w ایک سٹرنگ ہے اور a ایک سٹرنگ ہے جس کی لمبائی 1 ہے، تو
(aw)^M = aw^Ma۔
1 لمبائی کے ساتھ ایک سٹرنگ ہونے دیں، اور x اور y کو صوابدیدی سٹرنگ ہونے دیں۔ مندرجہ ذیل میں سے کون سا سچ ہے؟"
3,college_computer_science,پروگرام ٹائم شیئرنگ سسٹم پر چلتا ہے۔,پروسیسر کے لیے کوئی اور کام نہیں ہے۔,ایک مصروف انتظار لوپ کو کوڈ کرنا ایک انٹرپٹ ہینڈلر کے مقابلے میں آسان ہے۔,انتظار مختصر ہونے کی توقع ہے۔,مندرجہ ذیل میں سے کون سا غیر مطابقت پذیر ایونٹ پر مصروف انتظار کا انتخاب کرنے کا معقول جواز نہیں ہے؟
1,college_computer_science,سیاق و سباق سے پاک، لیکن باقاعدہ نہیں۔,کچھ پش ڈاؤن آٹومیٹن کے ذریعہ قبول کیا گیا، لیکن سیاق و سباق سے پاک نہیں۔,کچھ ٹورنگ مشین کے ذریعہ قبول کیا گیا ، لیکن بغیر پش ڈاؤن آٹومیٹن کے,کسی بھی ٹورنگ مشین کے ذریعہ قبول نہیں کیا گیا۔,زبان {ww | w میں (0 + 1)*} ہے۔
0,college_computer_science,ایتھرنیٹ کے ذریعے جڑے ہوئے نیٹ ورکس کی لمبائی چند سو میٹر تک محدود ہے۔,ایتھرنیٹ پروٹوکول تصادم کا پتہ لگانے کا طریقہ استعمال کرتے ہیں تاکہ یہ یقینی بنایا جا سکے کہ پیغامات صحیح طریقے سے منتقل ہو رہے ہیں۔,ایتھرنیٹ متعدد ماسٹرز کے ساتھ بسیں استعمال کرتے ہیں۔,ایتھرنیٹ پیغامات بھیجنے کے لیے سرکٹ سوئچنگ کا استعمال کرتے ہیں۔,ایتھرنیٹ کے بارے میں درج ذیل میں سے کون سا بیان عام طور پر غلط ہے؟
3,college_computer_science,صرف II اور III,صرف I اور II,صرف II,صرف میں,"پی کو ایک ایسا طریقہ کار بننے دیں جو کچھ ان پٹ کے لیے خود ہی کال کرتا ہے (یعنی، تکراری ہے)۔ اگر P کو ختم کرنے کی ضمانت دی جاتی ہے، تو درج ذیل میں سے کون سا بیان درست ہونا چاہیے؟
I. P میں ایک مقامی متغیر ہے۔
II P کے پاس پھانسی کا ایک راستہ ہے جہاں وہ خود کو کال نہیں کرتا ہے۔
III P یا تو عالمی متغیر سے مراد ہے یا کم از کم ایک پیرامیٹر ہے۔"
3,college_computer_science,ایک بار کا پیڈ,اینگما، ایک ٹرانسپوزیشن سائفر,ڈی ای ایس (ڈیٹا انکرپشن اسٹینڈرڈ)، ایک ہم آہنگ کلیدی الگورتھم,سیزر سائفر، ایک متبادل سائفر,مندرجہ ذیل میں سے کون ایک مکمل طور پر محفوظ انکرپشن اسکیم ہونے کے قریب آتا ہے؟
1,college_computer_science,جی میں سب سے بڑا گروہ تلاش کرنا,جی کے تمام پھیلے ہوئے درختوں کو تلاش کرنا,جی میں مختصر ترین سائیکل تلاش کرنا,جی میں سب سے طویل سادہ سائیکل تلاش کرنا,دیئے گئے غیر ہدایت شدہ گراف G سے متعلق درج ذیل مسائل میں سے، جو فی الحال کثیر الثانی وقت میں قابل حل سمجھا جاتا ہے؟
0,college_computer_science,آپریٹنگ سسٹم کے فن تعمیر کے درمیان اختلافات سے نمٹنا,مشینوں کے درمیان بڑے (ملٹی پیکٹ) پیغامات کی قابل اعتماد ترسیل جو ضروری نہیں کہ براہ راست منسلک ہوں۔,براہ راست منسلک مشینوں کے درمیان پیکٹوں کی قابل اعتماد ترسیل,نیٹ ورک کے ذریعے پیکٹوں کو روٹنگ کرنا,آئی پی پروٹوکول کا تعلق بنیادی طور پر ہے۔
0,college_computer_science,N-1/m,log_10 (1/N),K-1/K,1/K,مندرجہ ذیل میں سے، گہرائی N کے ایک مکمل K-ary درخت میں نوڈس کی کل تعداد کے ساتھ نانٹرمینل نوڈس کی تعداد کے تناسب کا کون سا بہترین تخمینہ لگاتا ہے؟
0,college_computer_science,عمل کا وقت ختم ہونا اور انتظار کے بے ترتیب وقفے کے بعد دوبارہ شروع کرنا,وسائل کی تعداد میں اضافہ اور تعداد میں اضافے کی ترتیب سے وسائل کی درخواست کرنے کے عمل کی ضرورت ہے۔,کسی عمل کے شروع ہونے پر اپنے تمام مطلوبہ وسائل کی درخواست کرنا، اور اگر یہ سب حاصل نہیں کر سکتا تو دوبارہ شروع کرنا,عمل کو ترجیح دینا اور انتظار کی قطاروں کو ترجیحی بنیادوں پر ترتیب دینا,ایک کمپیوٹر سسٹم پر غور کریں جس میں عمل ایک یا زیادہ وسائل کی درخواست اور جاری کر سکتے ہیں۔ ایک بار جب کسی عمل کو وسیلہ دے دیا جاتا ہے، تو اس عمل میں اس وسائل کا خصوصی استعمال ہوتا ہے جب تک کہ اسے جاری نہیں کیا جاتا۔ اگر کوئی عمل کسی ایسے وسیلہ کی درخواست کرتا ہے جو پہلے سے استعمال میں ہے، تو عمل اس وسیلہ کے لیے ایک قطار میں داخل ہو جاتا ہے، جب تک کہ وسائل دستیاب نہ ہو انتظار کریں۔ مندرجہ ذیل میں سے کون سا تعطل کے مسئلے سے مؤثر طریقے سے نمٹ نہیں پائے گا؟
3,college_computer_science,I اور II,صرف III,صرف II,صرف میں,"""جادو میموری"" کے دو آپریشن ہیں: پڑھیں اور صاف کریں۔ دونوں ناقابل تقسیم اور ایک دوسرے سے الگ ہیں۔ Clear جادو میموری کو صفر پر سیٹ کرتا ہے۔ Read ایک قدر لوٹاتا ہے جو آخری کلیئر آپریشن کے بعد سے پڑھنے والے آپریشنز کی تعداد کی نمائندگی کرتا ہے۔ مندرجہ ذیل میں سے کون ""جادو میموری"" کے بارے میں درست ہے؟
I. یہ ایٹم ٹیسٹ اور سیٹ کی فعالیت فراہم کر سکتا ہے۔
II اس کا استعمال مشترکہ میموری ملٹی پروسیسر پر چلنے والے عمل کو مربوط کرنے کے لیے کیا جا سکتا ہے۔
III یہ صرف ملٹی پروسیسر پر مفید ہے۔"
2,college_computer_science,سیمنٹک اسٹیک,سمبل ٹیبل,وصف گرامر,خلاصہ نحوی درخت (AST),درج ذیل میں سے کون سا کمپائلر میں ڈیٹا سٹرکچر کا نام ہے جو متغیرات اور ان کی صفات کے بارے میں معلومات کو منظم کرنے کا ذمہ دار ہے؟
3,college_computer_science,Quicksort,ہیپسورٹ,ضم کرنا,ببلسورٹ,مندرجہ ذیل میں سے کس الگورتھم کا چل رہا ہے وقت Θ(n^2) بدترین صورت میں لیکن اوسطاً Θ(n log n)؟
3,college_computer_science,صرف II اور III,صرف I اور II,صرف III,صرف میں,"ایک ڈھانچہ والی زبانیں جو خلاصہ ڈیٹا کی اقسام کو نافذ کرتی ہیں (مثال کے طور پر، ایک C++ کلاس) اس ڈھانچے کے اجزاء تک رسائی کو تمام کارروائیوں کے ذریعے روک سکتی ہیں سوائے ان کے جو اس ڈھانچے کا حصہ ہیں۔ تاہم، اس طرح کے ڈھانچے کی تعریفوں میں اکثر ساخت کے اجزاء کے اعلانات ہوتے ہیں (مثال کے طور پر، C++ کلاس کے لیے ہیڈر فائل اس کے نجی اجزاء کے اعلانات پر مشتمل ہو سکتی ہے)۔ ایسی زبان کے لیے، کسی شے کا نام رن ٹائم پر اس کے اجزاء کی قدروں (براہ راست نمائندگی) کے لیے ذخیرہ کرنے کے لیے یا اس کے اجزاء کی قدروں (بالواسطہ نمائندگی) کے لیے ہیپ سٹوریج کا حوالہ دینے والے اسٹیک پوائنٹر کے لیے پابند کیا جا سکتا ہے۔ براہ راست اور بالواسطہ نمائندگی کے درمیان موازنہ کے بارے میں درج ذیل بیانات میں سے کون سا سچ ہے؟
I. بالواسطہ نمائندگی تالیف کے وقت کو نمایاں طور پر بڑھاتی ہے۔
II براہ راست نمائندگی متغیر کے اجزاء تک رسائی کے لیے درکار وقت کو کم کرتی ہے۔
III جب کسی متغیر کے کچھ پرائیویٹ اجزاء کا سٹوریج سائز تبدیل ہو جاتا ہے، تو بالواسطہ نمائندگی سورس ماڈیولز کی دوبارہ کمپائلیشنز کی تعداد کو کم کر دیتی ہے جن کو انجام دینا ضروری ہے۔"
2,college_computer_science,کثیر الاضلاع ٹھوس رنگوں اور ساخت سے بھرے جا سکتے ہیں۔,تمام لائن سیگمنٹس کو سیدھے کے طور پر دکھایا جا سکتا ہے۔,حقیقت پسندانہ روشنی اور شیڈنگ کی جا سکتی ہے۔,تیز رفتار ہارڈ ویئر پکسلز کے بلاکس کو مؤثر طریقے سے منتقل کرنے کے لیے موجود ہے۔,مندرجہ ذیل میں سے کون سا بٹ میپ گرافکس کی خاصیت نہیں ہے؟
2,college_computer_science,وہ ریاضی کے عمل سے پیدا نہیں ہوسکتے ہیں۔,وہ I/O آپریشن کی تکمیل کی نشاندہی کر سکتے ہیں۔,وہ ڈیٹا چینلز کی جگہ استعمال ہوتے ہیں۔,"وہ اس وقت پیدا ہوتے ہیں جب میموری سائیکل ""چوری"" ہوتے ہیں۔",مندرجہ ذیل میں سے کون سا رکاوٹوں کے بارے میں درست ہے؟
3,college_computer_science,I، II، اور IV,صرف II اور IV,صرف II اور III,صرف I اور III,"اونچائی کے متوازن بائنری تلاش کے درخت میں، کسی بھی نوڈ کے بائیں اور دائیں نسل کی اونچائیوں میں زیادہ سے زیادہ 1 کا فرق ہوتا ہے۔ مندرجہ ذیل میں سے کون سے ایسے درخت کے بارے میں سچ ہے؟
I. بدترین کیس کی تلاش کا وقت نوڈس کی تعداد میں لوگاریتھمک ہے۔
II اوسط کیس کی تلاش کا وقت نوڈس کی تعداد میں لوگارتھمک ہے۔
III بہترین کیس کی تلاش کا وقت درخت کی اونچائی کے متناسب ہے۔
چہارم درخت کی اونچائی نوڈس کی تعداد میں لوگارتھمک ہے۔"
3,college_computer_science,10,500,999,"1,000","باب 1 اور 1000 کے درمیان نمبر لکھتا ہے۔ مریم کو باب کے ""ہاں/نہیں"" سوالات پوچھ کر اس نمبر کی شناخت کرنی چاہیے۔ مریم جانتی ہے کہ باب ہمیشہ سچ بولتا ہے۔ اگر مریم ایک بہترین حکمت عملی کا استعمال کرتی ہے، تو وہ بدترین کیس میں کتنے سوالات کے آخر میں جواب کا تعین کرے گی؟"
0,college_computer_science,I اور III,I اور II,صرف II,صرف میں,"صفحات کو استعمال کرنے والے ورچوئل میموری سسٹمز کے بارے میں مندرجہ ذیل میں سے کون سا سچ ہے؟
I. ورچوئل ایڈریس کی جگہ جسمانی میموری کی مقدار سے زیادہ ہوسکتی ہے۔
II پروگراموں کو ان کی مکمل تکمیل کے دوران مین میموری میں رہنا چاہیے۔
III صفحات پروگرام کی معنوی خصوصیات کے مطابق ہیں۔"
1,college_computer_science,کالنگ ایکٹیویشن ریکارڈ کے لیے اسٹیک پوائنٹر,واپسی کا پتہ,ایک ڈھیر کا علاقہ,مقامی متغیرات کی قدریں۔,مندرجہ ذیل میں سے کون سا عام طور پر اسٹیک بیسڈ پروگرامنگ لینگویج کے لیے سب روٹین کے ایکٹیویشن ریکارڈ فریم میں ظاہر نہیں ہوتا؟
2,college_computer_science,یہ کسی مختلف زبان میں نافذ کردہ طریقہ کار کو نہیں کہہ سکتا۔,یہ حوالہ کے ذریعہ پیرامیٹرز کو پاس نہیں کرسکتا ہے۔,یہ کوئی قدر واپس نہیں کر سکتا۔,اس کا استعمال ایسے پتے کے ساتھ طریقہ کار کو کال کرنے کے لیے کیا جاتا ہے جو 2^16 بائٹس سے زیادہ دور ہیں۔,ریموٹ پروسیجر کال کے بارے میں درج ذیل میں سے کون سا بیان درست ہے؟
2,college_computer_science,انتخاب کی ترتیب,ترتیب کو ضم کریں۔,Quicksort,داخل کرنے کی ترتیب,درج ذیل ترتیب دینے والے الگورتھم میں سے، جس کا چلنے کا وقت ہے جو ان پٹ کی ابتدائی ترتیب پر سب سے کم انحصار کرتا ہے؟
3,college_computer_science,70 اور 55 سیکنڈ,50 اور 25 سیکنڈ,30 اور 15 سیکنڈ,20 اور 10 سیکنڈ,"ایک خاص متوازی پروگرام کی گنتی کے لیے 100 سیکنڈز کی ضرورت ہوتی ہے جب ایک ہی پروسیسر پر عمل کیا جاتا ہے۔ اگر اس حساب کا 40 فیصد ""فطری طور پر ترتیب وار"" ہے (یعنی اضافی پروسیسرز سے فائدہ نہیں اٹھائے گا)، تو بالترتیب 2 اور 4 پروسیسرز کے ساتھ چلنے والے اس پروگرام کے لیے نظریاتی طور پر بہترین ممکنہ گزرے ہوئے اوقات ہیں۔"
3,college_computer_science,تینوں نمائندگی,دو کی تکمیل اور ایک کی تکمیل,نشانی اور وسعت اور صرف ایک کی تکمیل,صرف دو کی تکمیل,دو کی تکمیل، ایک کی تکمیل، یا نشان اور وسعت کے ذریعہ چھ بٹ نمبروں کی نمائندگی پر غور کریں۔ عدد 011000 اور 011000 کے اضافے سے کس نمائندگی میں اوور فلو ہے؟
1,college_computer_science,بندرگاہوں کا حوالہ صرف کمپیوٹر کی میموری میپ شدہ ہدایات کے ذریعہ دیا جاتا ہے اور یہ ہارڈ وائرڈ میموری والے مقامات پر واقع ہیں۔,I/O آپریشن کرنے کے لیے، ڈیٹا کو ایڈریس رجسٹر میں رکھنا اور آپریشن کرنے کے لیے چینل کو کال کرنا کافی ہے۔,I/O بندرگاہیں بس کے پتوں پر رکھی جاتی ہیں اور دیگر میموری مقامات کی طرح ان تک رسائی حاصل کی جاتی ہے۔,کمپیوٹر I/O بندرگاہوں کو جوڑنے کے لیے خصوصی ہدایات فراہم کرتا ہے۔,مندرجہ ذیل میں سے، کون سے کمپیوٹرز کی بہترین خصوصیات ہیں جو میموری میپڈ I/O استعمال کرتے ہیں؟
0,college_computer_science,ابتدائی جانچ کمپیوٹیشنل طور پر ناقابل عمل ہے۔,یہاں تک کہ اگر P = NP، انٹیجر فیکٹرائزیشن اب بھی ممکنہ طور پر کثیر الوقت کمپیوٹیبل نہیں ہے,پی = این پی,انٹیجر ضرب ایک ایسا فنکشن ہے جس کا الٹا، فیکٹرائزیشن، ان پٹ کی ایک بڑی کلاس کے لیے مشکل رہتا ہے,بہت سے کرپٹوگرافک پروٹوکول انٹیجر فیکٹرائزیشن کی کمپیوٹیشنل مشکل کے بارے میں مفروضوں پر اپنی حفاظت کی بنیاد رکھتے ہیں۔ انٹیجر فیکٹرائزیشن اس مقصد کو پورا کرتی ہے کیونکہ ہم اس پر یقین رکھتے ہیں۔
3,college_computer_science,صفر سے زیادہ والے تمام بٹ سٹرنگز,صفر کی یکساں تعداد کے ساتھ تمام بٹ سٹرنگز,تمام بٹ سٹرنگز صفر سے شروع ہوتی ہیں اور ایک پر ختم ہوتی ہیں۔,تمام بٹ سٹرنگز جن کے زیرو کی تعداد پانچ کا ضرب ہے۔,بٹ سٹرنگز کے درج ذیل سیٹوں میں سے کون سا ریگولر ایکسپریشن کے ساتھ بیان نہیں کیا جا سکتا؟
0,college_computer_science,I اور III,صرف III,صرف II,صرف میں,"بولین متغیر p_1, p_2, p_3, p_4 اور کنیکٹیو ∧,∨ (بغیر ¬) میں بولین فارمولے کے ذریعے مندرجہ ذیل میں سے کون سی شرائط کا اظہار کیا جا سکتا ہے؟
I. p_1، p_2، p_3، p_4 میں سے کم از کم تین درست ہیں۔
II p_1، p_2، p_3، p_4 میں سے بالکل تین درست ہیں۔
III p_1، p_2، p_3، p_4 کا ایک عدد درست ہے۔"
