answer,subject,choice_3,choice_2,choice_1,choice_0,question
3,college_biology,وہ ایکٹیویشن انرجی کو کم کرتے ہیں، اس طرح ری ایکٹنٹس کی مصنوعات میں تبدیلی کو تیز کرتے ہیں۔,وہ کیمیائی ردعمل (V_max) کی زیادہ سے زیادہ شرح میں اضافہ کرتے ہیں۔,وہ ایک رد عمل (K_eq) کے توازن کو تبدیل کرتے ہیں تاکہ زیادہ ری ایکٹنٹ کو مصنوعات میں تبدیل کیا جاسکے۔,وہ ردعمل کے مرکب کے درجہ حرارت کو بڑھاتے ہیں، اس طرح ری ایکٹنٹس کی مصنوعات میں تبدیلی کو تیز کرتے ہیں۔,مندرجہ ذیل میں سے کون بہتر وضاحت کرتا ہے کہ کیمیائی رد عمل کو آسان بنانے میں خامرے کیوں موثر ہیں؟
2,college_biology,اسیاتی اضافہ,صفر آبادی میں اضافہ,آبادی کا دھماکہ,آبادی کا ایک حادثہ,آبادی کی ترقی میں، وہ نقطہ جس پر پیدائش اور اموات کی شرح ایک دوسرے کے برابر ہو اسے کہا جاتا ہے۔
1,college_biology,شکل اور فنکشن میں مختلف,تحقیقاتی ڈھانچے,یکساں ڈھانچے,ہم جنس ڈھانچے,چمگادڑ کے پر اور تتلی کے پر ہیں۔
0,college_biology,عروقی بنڈل,عروقی کمبیم,sclerenchyma,parenchyma,ڈیکوٹ اسٹیم کے اندر مرکز میں پیتھ ٹشو پر مشتمل سیل کی قسم ہے۔
3,college_biology,ٹرانسپوسن,introns,سیسٹرون,prions,ڈی این اے کے موبائل ریجنز اپنے آپ کو موجودہ جینوم میں داخل کرنے کے قابل ہیں۔
3,college_biology,بنیادی جانشینی۔,ثانوی جانشینی۔,جانشینی کو مستحکم کرنا,موسم,وہ عمل جس میں سرخیل پرجاتی ننگے ذیلی ذخیرے جیسے چٹان، ریت یا برفانی تک کو آباد کرتی ہے
0,college_biology,اس کے بعد کویل کی زیادہ سے زیادہ فٹنس کم ہو جائے گی۔,اوسطاً، ایک نوخیز پرندے کو پالنے میں بہت کم توانائی صرف ہوتی ہے، چاہے وہ آپس میں ہو یا اپنا۔,جب پرندہ کسی دوسری نسل کے ایک دوسرے کو پالتا ہے تو اس کی زیادہ سے زیادہ فٹنس پر سمجھوتہ نہیں کیا جاتا,اوسطاً، میزبان پرندوں کا ردعمل انہیں صرف ان لوگوں کو کھانا کھلا کر اپنے بچوں کی پرورش کرنے کی اجازت دیتا ہے جو یہ بتاتے ہیں کہ وہ بھوکے ہیں۔,بروڈ پرجیویوں جیسے کویل اپنے گھونسلے میں نوخیز پرندوں کے بلند آواز میں بھیک مانگنے کے اشاروں پر میزبان پرندوں کے فطری ردعمل کا فائدہ اٹھا کر پرندوں کی دوسری نسلوں کو کامیابی کے ساتھ اپنے بچوں کو پالنے میں پھنساتے ہیں۔ وہ جین جو میزبان پرندوں کی پرجاتیوں کو کویل کے بچوں کو پالنے میں دھوکہ دینے کی اجازت دیتے ہیں ان کی اپنی اولاد کو نقصان پہنچانے کا امکان زیادہ تر آبادی کے جین پول میں رہتا ہے کیونکہ
2,college_biology,lamellipodia,کلاتھرین,ونکولن,چپکنے والی تختیاں,سیل کی حرکت پذیری، جیسا کہ ایک کلچرڈ فائبروبلاسٹ میں دیکھا گیا ہے، سوائے مندرجہ ذیل سبھی کو شامل کرتا ہے۔
0,college_biology,باہمی تعاون کی شرح,انبریڈنگ گتانک,پرہیزگاری ایلیل کی فریکوئنسی,تعلق کا گتانک,ہیملٹن کے اصول کے مطابق، ایک پرہیزگاری کی خصوصیت اس صورت میں تیار ہو سکتی ہے جب c <br، جہاں c عطیہ دہندہ کے لیے پرہیزگاری کے رویے کی فٹنس لاگت ہے، b وصول کنندہ کے لیے فٹنس فائدہ ہے، اور r ہے
2,college_biology,سطح سے حجم کا بڑا تناسب,پتوں کے بجائے ریڑھ کی ہڈی,پتلی کٹیکلز,متعدد اسٹوماٹا,زیادہ درجہ حرارت والے ماحول میں پانی کے ضیاع کو کم کرنے کے لیے پودوں کی موافقت میں درج ذیل میں سے کون سا شامل ہے؟
0,college_biology,فائبرو بلاسٹس,کولیجن,glycosaminoglycans,تھرومبن,مندرجہ ذیل سبھی کنیکٹیو ٹشوز میں پایا جا سکتا ہے سوائے اس کے
1,college_biology,ایک ڈپلومیڈ نیوکلئس,چوالیس آٹوسومز,ایک غیر فعال X کروموسوم,اصل زائگوٹ کے پاس تمام جینیاتی معلومات,مندرجہ ذیل میں سے کون سا عام طور پر انسانی مرد کے نارمل سومیٹک خلیوں میں نہیں پایا جاتا؟
1,college_biology,نہ ان کا بنیادی مقام اور نہ ہی ان کا حقیقت پسندانہ مقام,صرف ان کا ماحولیاتی مقام,صرف ان کا حقیقت پسندانہ مقام,صرف ان کا بنیادی مقام,چٹان کے کناروں پر زیادہ جارحانہ پرندوں کی انواع کی موجودگی کی وجہ سے پرندوں کی نسل کے ارکان جو درختوں کی چوٹیوں میں یا قریبی چٹانوں کے کناروں پر گھونسلے بنانے کے قابل ہوتے ہیں۔ رہائش کے حوالے سے، درختوں پر گھونسلے بنانے والے پرندے استعمال کر رہے ہیں۔
3,college_biology,اعلی مسابقتی صلاحیت,غیر مستحکم ماحول کا قبضہ,چھوٹے جسم کا سائز,اعلی تولیدی شرح,مندرجہ ذیل تمام خصوصیات r-منتخب شدہ پرجاتیوں کے علاوہ ہیں۔
3,college_biology,5′ CAA TCG 3′,5′ GTT AGC 3′,5′ GCT AAC 3′,5′ GCU AAC 3′,ترتیب 5′ CGA TTG 3′ کے ساتھ ایک DNA اسٹرینڈ اس ترتیب کا تکمیلی ہو گا۔
0,college_biology,gametophyte meiosis کے ذریعے gametes پیدا کرتا ہے,اسپوروفائٹ اور ایک گیموفائٹ کی عمر برابر ہوتی ہے۔,غالب گیموفائٹ ایک منحصر اسپوروفائٹ کے ساتھ متبادل ہوتا ہے۔,غالب اسپوروفائٹ ایک آزاد گیموفائٹ کے ساتھ متبادل ہوتا ہے۔,فرنز نسلوں کی تبدیلی سے گزرتے ہیں جس میں a
1,college_biology,پروٹین ٹراپونن اور ٹروپومیوسین بالترتیب موٹے اور پتلے تنت پر مشتمل ہوتے ہیں۔,ہر مائوسین ہیلیکل ٹیل میں ایک ایکٹین بائنڈنگ سائٹ اور اے ٹی پی ہائیڈرولائزنگ سائٹ ہوتی ہے۔,آرام دہ حالت میں ٹراپومائوسین ایکٹین کی بائنڈنگ سائٹ تک مائیوسین کی رسائی کو روکتا ہے۔,سنکچن کے دوران H زونز لمبے ہو جاتے ہیں۔,دھاری دار عضلہ (جیسے کنکال کے پٹھوں) کے سارکومیر کے متعلق درج ذیل میں سے کون سا بیان درست ہے؟
0,college_biology,پتوں کو کھانا کھلانے والے کیڑوں کو ہٹا دیں اور بعد میں آنے والی چیونٹی کی کثافت کی پیمائش کریں۔,کانٹوں کو ہٹا دیں اور چیونٹیوں کے بعد کی کثافت کی پیمائش کریں۔,تیل سے بھرپور جسموں کو ہٹائیں اور بعد میں چیونٹی کی کثافت کی پیمائش کریں۔,چیونٹیوں کو ہٹا دیں اور پتے کے نقصان کی پیمائش کریں۔,جارحانہ چیونٹیاں ایک چھوٹے اشنکٹبندیی درخت کے پھولے ہوئے کانٹوں میں رہتی ہیں اور تیل سے بھرپور جسموں کو کھاتی ہیں جو درخت اپنے پتوں کے سروں پر پیدا کرتا ہے۔ مندرجہ ذیل میں سے کون سا تجربہ اس مفروضے کی بہترین جانچ کرتا ہے کہ چیونٹیاں پتوں کو پالنے والے کیڑوں کو مار کر یا بھگا کر پودے کا دفاع کرتی ہیں؟
2,college_biology,دوربین آنکھ,مرکب آنکھ,سادہ آنکھ,آنکھوں کی جگہ,کرسٹیشینز اور کیڑوں کے بصارت کے اعضاء میں اومٹیڈیا ہوتا ہے، جو اس کی انفرادی بصری اکائیوں کو بناتا ہے۔
0,college_biology,ایک انسانی جنین اپنی نشوونما کے دوران بالغ مچھلیوں اور پرندوں کی خصوصیات دکھاتا ہے۔,ابتدائی انسانی جنین میں ابتدائی مچھلیوں اور ایویئن ایمبریو کے ساتھ خصوصیات مشترک ہیں۔,ابتدائی جنین اپنی کلاس، ترتیب اور انواع کی ایک جیسی خصوصیات کو ظاہر کرتے ہیں۔,Ontogeny phylogeny کی تکرار کرتا ہے۔,زائگوٹ مرحلے سے جنین تک ایک فقاری جاندار کی نشوونما کا مطالعہ کرنے والا ماہر ایمبریولوجسٹ مندرجہ ذیل میں سے کون سا نتیجہ اخذ کرنے کا جواز پیش کرے گا؟
3,college_biology,پتھ بنیادی زائلم؛ ثانوی xylem؛ عروقی کمبیم؛ ثانوی فلیم؛ بنیادی فلیم؛ پرانتستا,پتھ ثانوی xylem؛ بنیادی زائلم؛ عروقی کمبیم؛ بنیادی فلیم؛ ثانوی فلیم؛ پرانتستا,پتھ ثانوی xylem؛ بنیادی زائلم؛ عروقی کمبیم؛ ثانوی فلیم؛ بنیادی فلیم؛ پرانتستا,پتھ بنیادی زائلم؛ ثانوی xylem؛ عروقی کمبیم؛ بنیادی فلیم؛ ثانوی فلیم؛ پرانتستا,ایک تنے سے بور کرنے والی چقندر نے 5 سال پرانی لکڑی کی ٹہنی کے بیچ میں اپنے انڈے دیے ہیں اور انڈے پختہ ہو کر لاروا بن چکے ہیں۔ مناسب ترتیب میں (اندر سے باہر)، جب لاروا ٹہنی کے باہر کی طرف اپنا راستہ کھاتے ہیں تو وہ کن بافتوں اور بافتوں کے علاقوں کا سامنا کریں گے؟ (سادگی کے لئے، فرض کریں کہ epidermis پہلے ہی مکمل طور پر گر گیا ہے.)
1,college_biology,لائزوسومز اور اینڈوسومس,گولگی اپریٹس اور اینڈوپلاسمک ریٹیکولم,نیوکلی اور خفیہ ویسیکلز,ڈی این اے اور ایم آر این اے,مندرجہ ذیل جوڑے ایک ساتھ حل میں رکھے گئے تھے۔ کم رفتار سینٹرفیوگریشن کر کے کن دو کو الگ کیا جا سکتا ہے؟
2,college_biology,پلمونری کیپلیری کے ذریعے خون کے بہاؤ کی شرح کو کم کرنا,پھیلاؤ کے لیے دستیاب سطح کے کل رقبے کو بڑھانا,پانی میں گیس کی حل پذیری کو کم کرنا,گیس کے جزوی دباؤ کے میلان کو کم کرنا,مندرجہ ذیل میں سے کون اس شرح میں اضافہ کرے گا جس پر پھیپھڑوں کے الیوولی اور پلمونری کیپلیری کے اندر خون کے درمیان گیس پھیلتی ہے؟
0,college_biology,انٹرنوڈس,نوڈس,ٹرمینل کلیوں,lenticels,وہ ڈھانچے جو لکڑی کے تنے میں گیس کے تبادلے کے مقامات کے طور پر کام کرتے ہیں۔
3,college_biology,لیکنگ رویہ,ماسٹنگ (ہم وقت ساز فروٹنگ),کیمیائی دفاع,aposematic رنگ کاری,فطری دشمنوں کو سوائے درج ذیل تمام چیزوں کے لیے ایک مضبوط منتخب قوت کے طور پر ملوث کیا گیا ہے۔
3,college_biology,5' کیپ اور 3' پولی (A) دم حاصل کرنے سے پہلے وہ بنیادی نقل سے نکالے جاتے ہیں۔,وہ ڈی این اے کے ایک ایسے خطے پر ایکسونز کے ساتھ مل کر پائے جاتے ہیں جو پولی پیپٹائڈ چین کے لیے کوڈ کرتا ہے۔,وہ نان کوڈنگ والے علاقوں کی نمائندگی کرتے ہیں۔,وہ صرف یوکرائٹس میں پائے جاتے ہیں۔,مندرجہ ذیل میں سے کون سا انٹرن کی خصوصیت نہیں ہے؟
1,college_biology,کاربن ڈائی آکسائیڈ کے جزوی دباؤ میں اضافہ اور ہائیڈروجن آئنوں کے ارتکاز میں کمی,کاربن ڈائی آکسائیڈ کے جزوی دباؤ میں اضافہ اور ہائیڈروجن آئنوں کے ارتکاز میں اضافہ,کاربن ڈائی آکسائیڈ کے جزوی دباؤ میں کمی اور ہائیڈروجن آئنوں کے ارتکاز میں کمی,کاربن ڈائی آکسائیڈ کے جزوی دباؤ میں کمی اور ہائیڈروجن آئنوں کے ارتکاز میں اضافہ,آرام سے بیٹھا ہوا صحت مند شخص شعوری طور پر بہت تیز سانس لینے لگتا ہے۔ مندرجہ ذیل میں سے کون اس ہائپر وینٹیلیشن کی وجہ سے شخص کے خون میں ہونے والی تبدیلی کو بیان کرتا ہے؟
2,college_biology,انڈاشی، بچہ دانی، اندام نہانی، rete,بیضہ دانی، بیضہ دانی، بچہ دانی، اندام نہانی,Oviduct، epididymis، uterus، اندام نہانی,Oviduct، uterus، rete، اندام نہانی,مندرجہ ذیل میں سے کون سا ممالیہ مادہ تولیدی راستے میں ساخت کی صحیح جسمانی ترتیب ہے؟
1,college_biology,benthyl زون,پیلاجک زون,neritic زون,باتھل زون,ایک سمندری ماحولیاتی نظام کا خطہ ہے جس کی خصوصیت شمسی تابکاری کے دخول اور غذائی اجزاء کی افزائش سے ہوتی ہے۔
0,college_biology,سنگل اسٹرینڈ ڈی این اے ٹوٹ جاتا ہے۔,Depurination,سائٹوسین کا خاتمہ,تھامین ڈائمرز,انسانوں میں، ایک موروثی عارضہ جسے xeroderma pigmentosum (XP) کہا جاتا ہے اس کے نتیجے میں ڈی این اے کو الٹرا وائلٹ نقصان کو ٹھیک کرنے میں ناکامی ہو سکتی ہے۔ XP والے افراد میں مندرجہ ذیل میں سے کون سا سالماتی گھاووں کا سب سے زیادہ امکان ہے؟
0,college_biology,روشنی کی توانائی کو کیمیائی توانائی میں تبدیل کرنا,آکسائڈائزنگ نامیاتی مرکبات,غیر نامیاتی مادوں کو کم کرنا جیسے امونیا، سلفر، یا ہائیڈروجن,غیر نامیاتی مادوں کو آکسائڈائز کرنا جیسے امونیا، سلفر، یا ہائیڈروجن,کیموسینتھیٹک بیکٹیریا فوٹوون جذب کرنے والے روغن کی کمی کے باوجود اپنی خوراک خود تیار کر سکتے ہیں کیونکہ کیموسینتھیٹک بیکٹیریا توانائی حاصل کرتے ہیں۔
2,college_biology,"inositol 1,4,5-triphosphate",acetylcholine,کیمپ,کیلشیم آئنز,مندرجہ ذیل سبھی انٹرا سیلولر میسنجر کے طور پر کام کر سکتے ہیں سوائے
2,college_biology,تینوں پودوں کے ٹشو سسٹم کے پیشرو برانن کے دوران بنتے ہیں۔,شوٹ اپیکل میرسٹیم کی تشکیل بیج کی تشکیل کے بعد ہوتی ہے۔,Cotyledons apical cell سے ماخوذ ہیں۔,سسپینسر بیسل سیل سے ماخوذ ہے۔,پودوں کے جنین کے بارے میں درج ذیل تمام بیانات درست ہیں سوائے:
0,college_biology,مصنوعی موتیوں کو مختلف گلائکوپروٹین، ZP2 کے ساتھ کوٹنگ کرنے سے موتیوں پر سپرم جمع ہونے میں ناکام ہو جاتے ہیں۔,اینٹی باڈیز کے ساتھ انڈوں کو انکیوبیٹ کرنا جو وٹرو فرٹیلائزیشن میں ZP3 بلاکس سے منسلک ہوتا ہے۔,وٹرو فرٹیلائزیشن میں سپرم اور انڈوں کے بلاکس کو ملانے سے پہلے پیوریفائیڈ ZP3 کے ساتھ نطفہ کو انکیوبیٹ کرنا۔,انڈوں کو اینٹی باڈیز کے ساتھ انجیکشن لگانا جو وٹرو فرٹیلائزیشن میں ZP3 بلاکس سے منسلک ہوتے ہیں۔,ماؤس کے نطفہ میں رسیپٹر پروٹین ہوتے ہیں جو ماؤس کے انڈوں کے زونا پیلوسیڈا میں گلائکوپروٹین (ZP3) سے منسلک ہوتے ہیں۔ ZP3 ریسیپٹرز کا ZP3 سے منسلک ہونا سپرم کے اکروسومل رد عمل کا آغاز کرتا ہے۔ مندرجہ ذیل تمام تجرباتی مشاہدات کی توقع کی جائے گی سوائے:
3,college_biology,بے ترتیب ملاپ,Epistasis,ہم آہنگ جین کمپلیکس,غیر جنسی تولید,مندرجہ ذیل عوامل میں سے کون سا تعلق کے عدم توازن کو فروغ نہیں دیتا؟
1,college_biology,سرمئی ہلال کے ساتھ بلاسٹومیئر تقسیم ہونا بند کر دے گا اور دوسری درار سے پہلے مر جائے گا۔,سرمئی ہلال کے بغیر بلاسٹومیئر ایک مکمل، لیکن چھوٹا، جنین بنائے گا۔,سرمئی ہلال کے ساتھ بلاسٹومیئر ایک مکمل، لیکن چھوٹا، جنین بنائے گا۔,سرمئی ہلال کے ساتھ بلاسٹومیئر سرمئی ہلال کے بغیر سائز میں زیادہ تیزی سے بڑھے گا۔,ایک تجربے میں، ایک ایمفیبیئن زائگوٹ کے پہلے کلیویج طیارے کو جوڑ دیا گیا تھا تاکہ سرمئی ہلال ان دو بلاسٹومیرز میں سے صرف ایک میں موجود تھا جو پہلی کلیویج کے نتیجے میں ہوتا ہے۔ اس کے بعد دونوں بلاسٹومرز کو الگ کر دیا گیا۔ بلاسٹومرز کی متوقع قسمت کیا ہے؟
2,college_biology,مائیکرو اسپائک میں مائیکرو فیلامینٹس کو ناقابل واپسی ڈیپولیمرائزیشن سے گزرنا پڑتا ہے۔,مائیکرو اسپائک میں موجود مائیکرو فیلامینٹس کو الٹ جانے والی ڈیپولیمرائزیشن سے گزرنا پڑتا ہے۔,ایکون میں مائکرو ٹیوبولس ناقابل واپسی انحطاط سے گزرتے ہیں۔,ایکون میں مائکروٹوبولس کو الٹ جانے والی انحطاط سے گزرنا پڑتا ہے۔,ایک ترقی پذیر نیوران سے اعصاب کی افزائش ترقی کے شنک سے شروع ہوتی ہے، جو محور کے سرے پر واقع ہے۔ نمو کے شنک کے مائکرو اسپائکس بڑھتے اور پیچھے ہٹتے ہیں تاکہ نمو کو آگے بڑھایا جاسکے۔ نشوونما کے اس مرحلے پر نیوران کا سائٹوکاسلین بی کے سامنے آنا اسباب پیدا کرتا ہے۔
2,college_biology,ایک مونوکلونل اینٹی سیرم میں اینٹی باڈیز ہوتی ہیں جو ایک ہی بی لیمفوسائٹ کی اولاد سے خارج ہوتی ہیں۔ پولی کلونل اینٹی سیرم میں اینٹی باڈیز ہوتی ہیں جو B اور T لیمفوسائٹس دونوں کی اولاد سے چھپتی ہیں۔,ایک مونوکلونل اینٹی سیرم میں اینٹی باڈیز ہوتی ہیں جو ایک ہی بی لیمفوسائٹ کی اولاد سے خارج ہوتی ہیں۔ پولی کلونل اینٹی سیرم میں اینٹی باڈیز ہوتی ہیں جو مختلف بی لیمفوسائٹس کی اولاد سے چھپتی ہیں۔,ایک مونوکلونل اینٹی باڈی ایک ہی اینٹیجن کے متعدد علاقوں کے خلاف رد عمل ظاہر کرتی ہے۔ پولی کلونل اینٹی باڈی متعلقہ اینٹیجنز کے کسی ایک علاقے کے خلاف رد عمل ظاہر کرتی ہے۔,ایک مونوکلونل اینٹی سیرم میں ہر قسم کا اینٹی باڈی ایک ہی اینٹیجن کے ایک خطے کے خلاف رد عمل ظاہر کرتا ہے۔ پولی کلونل اینٹی سیرم میں ہر قسم کا اینٹی باڈی مختلف اینٹیجنز کے متعدد خطوں کے خلاف رد عمل ظاہر کرتا ہے۔,مونوکلونل اینٹیسیرا کو پولی کلونل اینٹیسیرا سے مندرجہ ذیل میں سے کس طریقے سے ممتاز کیا جاتا ہے؟
1,college_biology,trematoda,ستنداریوں,رینگنے والے جانور,amphibians,سپلیمنٹری گیس ایکسچینج اعضاء کے استعمال کے بغیر ان کی سانس کی ضروریات کو پورا کرنے کے لئے مناسب پھیپھڑوں کے ٹشو تیار کرنے والے جانوروں کے پہلے گروہ تھے۔
3,college_biology,لمبی دوری کے پھیلاؤ کی صلاحیت,منتشر کرنے کی محدود صلاحیتیں۔,K-منتخب تولیدی شرح,انتہائی رہائش گاہ کی تخصص,مندرجہ ذیل میں سے کون سا حیاتیاتی وصف ہے جو زیادہ تر ممکنہ طور پر کسی نوع کو تقسیم میں کاسموپولیٹن بننے دیتا ہے؟
1,college_biology,Flagellum,مائٹوکونڈریون,پلازما جھلی,نیوکلئس,ابتدائی خلیوں کی تشکیل میں، مندرجہ ذیل اجزاء میں سے کون سا سب سے پہلے پیدا ہونے کا امکان ہے؟
3,college_biology,پرجاتیوں کے جیواشم کی باقیات موجود ہیں جو معدوم ہو چکی ہیں۔,پروکیریٹس میں دو بڑے ڈومینز شامل ہیں، بیکٹیریا اور آرچیا۔,مینڈیلین اصول بتاتے ہیں کہ کیوں کچھ خصلتیں غالب ہوتی ہیں اور دیگر متروک کیوں ہوتی ہیں۔,ڈی این اے وراثت کی میکرو مالیکولر بنیاد فراہم کرتا ہے۔,مندرجہ ذیل میں سے کون سا حقائق 1859 سے پہلے قائم کیا گیا تھا، جس سال چارلس ڈارون نے پرجاتیوں کی اصل پر شائع کیا تھا؟
0,college_biology,پودوں کی جڑوں کے ساتھ مل کر مائیکورریزی کی تشکیل,داد پیدا کرنے کے لیے انسانوں کے ساتھ وابستگی,شراب پیدا کرنے کے لئے ابال,گلوکوز پیدا کرنے کے لیے فتوسنتھیس,فنگس مندرجہ ذیل میں سے ہر ایک میں حصہ لیتے ہیں سوائے
2,college_biology,چار,تین,دو,ایک,کلوروپلاسٹ میں، ایک خاص پروٹین تھائیلاکائیڈ (تھائلاکائیڈ اسپیس) کے لیمن میں پایا جاتا ہے۔ یہ نیوکلئس میں نقل کیا جاتا ہے اور سائٹوپلاسمک رائبوسوم پر ترکیب کیا جاتا ہے۔ اس پروٹین کو اپنے آخری مقام تک پہنچنے کے لیے کتنے جھلیوں کے بیلیئرز کو عبور کرنا ہوگا؟
3,college_biology,وینس پریشر پر بہت کم اثر اور آرٹیریل پریشر میں بڑا اضافہ,وینس پریشر میں اضافہ اور شریان کے دباؤ میں مساوی لیکن مخالف کمی,وینس کے دباؤ پر کوئی اثر نہیں اور شریان کے دباؤ میں تھوڑا سا اضافہ,کسی بھی کمپارٹمنٹ میں دباؤ میں کوئی تبدیلی نہیں۔,ممالیہ کارڈیک سائیکل کے دوران، وینٹریکولر اسٹروک کے حجم کے برابر خون کا حجم زیادہ کمپلینٹ وینس سائیڈ سے گردش کے کم کمپلینٹ آرٹیریل سائیڈ میں منتقل ہوتا ہے۔ وینس اور آرٹیریل کمپارٹمنٹس کے اندر دباؤ کے لحاظ سے، اس منتقلی کا نتیجہ ہوتا ہے۔
0,college_biology,بعض خفیہ پروٹینوں کا گلائکوسیلیشن پروٹین کے لیمن میں داخل ہونے سے پہلے ہوتا ہے۔,اس کی جامع چپٹی سیسٹرنی ایک دوسرے کے ساتھ مسلسل رہتی ہیں۔,یہ عام طور پر اس کے cis چہرے کے قریب واقع چھوٹے خفیہ vesicles سے منسلک ہوتا ہے۔,یہ سائٹوپلازم پر مبنی ہے تاکہ اس کا cis چہرہ اینڈوپلاسمک ریٹیکولم کے قریب ترین ہو۔,یوکرائیوٹ کے گولگی اپریٹس کے بارے میں درج ذیل میں سے کون سا بیان درست ہے؟
3,college_biology,اینڈوڈرم,پیرسائیکل,کیسپیرین پٹی,جڑ کی ٹوپی,مونوکوٹ پلانٹ کی جڑوں میں پانی کے داخل ہونے کا پہلا نقطہ خلیات کے سائٹوپلازم کے ذریعے ہوتا ہے۔
