answer,subject,choice_3,choice_2,choice_1,choice_0,question
3,college_biology,انزائم مالیکیولز کی تعداد کو الٹا کم کرنا جو سبسٹریٹس کو باندھنے کے لیے دستیاب ہیں۔,ایک ہی انزائم کے لیے سبسٹریٹ مالیکیول کے ساتھ مقابلہ کرنا لیکن سبسٹریٹ بائنڈنگ سائٹ سے مختلف بائنڈنگ سائٹ,کچھ امینو ایسڈ کی باقیات کو ناقابل واپسی طور پر تبدیل کرنا جو انزائم کی فعال سائٹ پر مشتمل ہونے میں مدد کرتے ہیں,انزائم کے ساتھ ناقابل واپسی طور پر ہم آہنگی کے لنکس کی تشکیل، مؤثر طریقے سے اس سے انزائم کی علیحدگی کو روکتا ہے,ایک انزائم کا ایک مسابقتی روکنے والا اپنا اثر بذریعہ استعمال کرتا ہے۔
2,college_biology,Synapses کی تعداد سے تجاوز کر گیا,فی سیکنڈ ایکشن پوٹینشل کی تعداد,حد کی صلاحیت,عمل کی صلاحیت کا طول و عرض,محرک کی شدت میں فرق کا پتہ لگانے کے لیے دماغ کی صلاحیت کی بہترین وضاحت اس حقیقت سے ہوتی ہے کہ مندرجہ ذیل میں سے کون سا محرک کی شدت کے ساتھ مختلف ہوتا ہے؟
2,college_biology,اشنکٹبندیی علاقوں میں زیادہ شکاری ہوتے ہیں جو جڑی بوٹیوں کو کم کرتے ہیں۔,اشنکٹبندیی علاقوں میں پانی اور گرم درجہ حرارت کی دستیابی فتوسنتھیس کو فروغ دیتی ہے۔,اشنکٹبندیی علاقوں میں پودوں کی نشوونما کے لیے میٹابولک اخراجات کم ہوتے ہیں۔,اشنکٹبندیی علاقوں میں اعلیٰ انواع کا تنوع پودوں کی نشوونما کو بڑھاتا ہے۔,مندرجہ ذیل میں سے کون سی بہترین وضاحت ہے کہ زمینی ماحولیاتی نظام میں خالص بنیادی پیداواری صلاحیت اشنکٹبندیی علاقوں کی طرف کیوں بڑھتی ہے؟
0,college_biology,تبدیلی کو شروع کرنے کے لیے ایک عام سیل میں ٹیومر پیدا کرنے والے وائرس کو داخل کرنا,ایک لافانی مختلف سیل کو ثقافت سے الگ کرنا اور اسے سیل لائن بنانے کے لیے استعمال کرنا,ہائبرڈ سیل تیار کرنا,ایک heterokaryon کی پیداوار,پروٹینوں کو پلازما جھلی کے جہاز میں حرکت کرتے ہوئے دکھایا گیا جب ماؤس سیل سرفیس پروٹین اور انسانی سیل سطح کے پروٹین کو ماؤس-ہیومن سیل پلازما جھلی کے ساتھ ضم ہوتے دیکھا گیا۔ ان نتائج کو حاصل کرنے کے لیے مندرجہ ذیل سیل کلچر کی تکنیکوں میں سے کونسی ممکنہ طور پر استعمال کی گئی تھی؟
0,college_biology,میٹا پاپولیشن میں ہارڈی وینبرگ کے توازن میں خلل,قیاس آرائی کا بڑھتا ہوا امکان,میٹا پاپولیشن میں نقصان دہ تغیرات کی شرح میں اضافہ,میٹا پاپولیشن میں جینیاتی یکسانیت میں اضافہ,آبادی کے درمیان جین کے بہاؤ کے نتیجے میں
2,college_biology,solenoid,نیوکلیوزوم,کرومیٹن,ہسٹون,ڈی این اے اور پروٹین کا ایک ذیلی یونٹ جس میں ایک پروٹین آکٹومر کے گرد ڈی این اے کے 134 بیس جوڑے کے لمبے حصے ہوتے ہیں کہلاتے ہیں (a)
1,college_biology,abscisic ایسڈ کی سطح میں اتار چڑھاو,ہوا کا درجہ حرارت تبدیل کرنا,فوٹو پیریڈ,سرکیڈین تال,مندرجہ ذیل میں سے کون سا سب سے زیادہ قابل اعتماد ماحولیاتی سگنل ہو گا جسے معتدل ماحولیاتی نظام میں ایک پودا سال کے صحیح وقت پر پھولوں کی شروعات کے لیے استعمال کر سکتا ہے؟
3,college_biology,یہ انٹرمیمبرن اسپیس سے میٹرکس تک H+ کے پھیلاؤ کو بڑھاتا ہے۔,یہ مائٹوکونڈریا میٹرکس میں تیزاب کی ارتکاز کو بڑھاتا ہے۔,یہ مائٹوکونڈریا میٹرکس میں OH- ارتکاز کو بڑھاتا ہے۔,یہ OH- کی ارتکاز کو بڑھاتا ہے، جس کی وجہ سے مائٹوکونڈریا H+ کو انٹرمیمبرن کی جگہ پر پمپ کرتا ہے۔,مائٹوکونڈریا کو الگ تھلگ کرکے بفرڈ محلول میں کم پی ایچ کے ساتھ رکھ کر اے ٹی پی تیار کرنا شروع کر دیتا ہے۔ کم بیرونی pH کے اثر کے لیے درج ذیل میں سے کون سی بہترین وضاحت ہے؟
0,college_biology,پروٹسٹ,سیانو بیکٹیریم,بارنیکل,وہیل,نیکٹن سے تعلق رکھنے والا جاندار مندرجہ ذیل میں سے کون سا ہے؟
1,college_biology,جانوروں کے ماحول میں متعدد حسی سگنلز سے متحرک ہوتا ہے۔,ایک موٹر ردعمل ہے جو ایک بار جاری ہونے کے بعد بے ساختہ ختم ہو سکتا ہے۔,حسی رائے کی غیر موجودگی میں ہوتا ہے۔,دوسری بار ایسا ہوتا ہے جب کسی جانور کو اپنی زندگی میں مناسب وقت پر صحیح محرک کا سامنا کرنا پڑتا ہے۔,ایک طرز عمل کا ردعمل جسے جانوروں کے ذریعہ دکھایا گیا ایک مقررہ عمل کا نمونہ کہا جاتا ہے۔
2,college_biology,محدود مقدار میں پیدا ہونے والے اعلی چینی کے ارتکاز کے ساتھ امرت,لاکٹ (لٹکا ہوا) سرخ رنگ کے پھول,لینڈنگ کی جگہ فراہم کرنے کے لیے پنکھڑیوں میں ترمیم کی گئی۔,پنکھڑیوں پر بالائے بنفشی رنگ کے نمونے۔,مندرجہ ذیل میں سے کون سی موافقت شہد کی مکھیوں کے ذریعے پولینیشن کو محدود کرے گی اور ہمنگ برڈ پولینیشن کو فروغ دے گی؟
3,college_biology,اینڈوسپرم,جنین,endodermis,megagametophyte,ڈبل فرٹیلائزیشن پھولدار پودوں کی ایک منفرد خصوصیت ہے۔ اس عمل میں، ایک نطفہ انڈے کے ساتھ مل کر زائگوٹ پیدا کرتا ہے۔ دوسرا نطفہ قطبی مرکزے کے ساتھ مل کر اس کی تشکیل شروع کرتا ہے۔
1,college_biology,خیالی ڈسکس میں ٹیومر کی تشکیل,پچھلے-پچھلے محور کے ساتھ ساتھ ہر طبقہ میں قطبیت کے نقائص,ایک طبقہ کی دوسرے میں تبدیلی,متصل طبقات کے گروپ کی عدم موجودگی,ہومیوٹک کلسٹر جینز کی تبدیلی اکثر ڈروسوفلا میں مندرجہ ذیل میں سے کون سی ترقیاتی خرابیوں کا نتیجہ ہوتی ہے؟
2,college_biology,کیشکا کارروائی,osmosis,آسنجن,نقل مکانی,پودے کی جڑوں کے ذریعہ جڑوں کا دباؤ پانی کی جڑوں میں داخل ہونے کا سبب بنتا ہے۔
1,college_biology,رسیپٹر ثالثی اینڈوسیٹوسس,endosome کی تشکیل,چپکنے والی تختیاں,سیل سطح کے رسیپٹرز,کولیسٹرول کا سیلولر اپٹیک کم کثافت لیپوپروٹین کولیسٹرول کمپلیکس کے اندرونی ہونے کے ذریعے ہوتا ہے۔ کولیسٹرول کے بڑھنے میں سوائے درج ذیل سبھی شامل ہیں۔
2,college_biology,برتن عناصر اور ساتھی خلیات,tracheids اور برتن عناصر,چھلنی ٹیوب کے ارکان اور ساتھی خلیات,collenchyma اور sclerenchyma,دو زائلم پلانٹ سیل کی قسمیں جو پانی اور معدنیات کو مدد فراہم کرتی ہیں اور چلتی ہیں۔
3,college_biology,ممالیہ کے گردے میں Juxtamedullary nephrons حیاتیات کو hyperosmotic پیشاب پیدا کرنے کی اجازت دیتے ہیں۔,Malpighian tubules کیڑے مکوڑوں کو exoskeleton کے ذریعے فضلہ خارج کرنے کی اجازت دیتے ہیں۔,صحرائی ستنداریوں کے گردے پیشاب پیدا کرتے ہیں جو میٹھے پانی کی مچھلیوں کے پیشاب کے لیے hypoosmotic ہوتا ہے۔,کھارے پانی کی مچھلیوں کے گردے اپنے ٹشوز میں پیشاب ہائپراسموٹک پیدا کرتے ہیں۔,اخراج کے اعضاء کے بارے میں درج ذیل میں سے کون سا بیان درست ہے؟
2,college_biology,زمین پر گھونسلہ بنانے والا گل چوزہ رنگت کا نمونہ دکھاتا ہے جو اس کے گردونواح سے تقریباً الگ نہیں ہوتا۔,ایک کیڑا ڈنکنے والی شہد کی مکھی کی طرح رنگت دکھاتا ہے۔,ایک کیڑا شکاریوں کو پریشان کرنے کے لیے اپنی دم کے سرے پر جھوٹی آنکھیں دکھاتا ہے۔,ملی پیڈ کی ایک قسم جو میںڑک کے لیے زہریلی ہوتی ہے میںڑک کی جانب سے اسے استعمال کرنے کی ابتدائی کوشش کے بعد اسے مستقل طور پر ٹال دیا جاتا ہے۔,Mimicry ایک حکمت عملی ہے جو قدرتی انتخاب کے ذریعے اپنے ماحول میں حیاتیات کی فٹنس کو بڑھانے کے لیے تیار ہوئی ہے۔ مندرجہ ذیل میں سے کون سی بیٹسین نقل کی ایک شکل کی نمائندگی کرتا ہے؟
3,college_biology,اعلی حریفوں کو کمتر حریفوں کو مقامی معدومیت کی طرف لے جانے سے روک سکتا ہے۔,اپنی برادریوں میں زیادہ تر دیگر پرجاتیوں سے زیادہ پرچر ہیں۔,کھانے کے جالوں کی بنیاد فراہم کریں۔,دیگر پرجاتیوں کے لیے خوراک کے وسائل کو ختم کرکے تنوع کو کم کرنے کا رجحان رکھتے ہیں۔,خیال کیا جاتا ہے کہ کیسٹون پرجاتیوں کے ماحولیاتی کمیونٹیز کی ساخت اور ساخت پر گہرے اثرات مرتب ہوتے ہیں کیونکہ وہ
1,college_biology,تمام مائٹوکونڈریل پروٹینز کو مائٹوکونڈریل جینز کے ذریعے کوڈ کیا جاتا ہے۔,ہائپر ویری ایبل، نان کوڈنگ والے علاقوں میں چند واحد نیوکلیوٹائڈ پولیمورفزم ہیں۔,mtDNA ماں سے بچے کو منتقل ہوتا ہے اور یہ دوبارہ ملاپ سے پاک ہوتا ہے جو کروموسوم کے جوڑوں کے درمیان ہوتا ہے۔,mtDNA جوہری ڈی این اے کے مقابلے میں سست رفتار سے بدلتا ہے۔,مندرجہ ذیل میں سے کون سی وجہ ہے کہ جینیاتی ماہرین جانوروں کی آبادی کے تعلق کا مطالعہ کرنے کے لیے mitochondrial DNA (mtDNA) کا استعمال کرتے ہیں؟
0,college_biology,دیے گئے شکاری جاندار کے آبادی میں اضافے کا امکان کم ہوتا ہے۔,ایک دیا ہوا شکاری جاندار زیادہ متنوع شکاریوں کی طرف سے زیادہ شکار کی شرح سے مشروط ہے۔,ایک نوع کی آبادی کی سطح کو قدرتی ریگولیٹری میکانزم کے ذریعے توازن میں رکھا جاتا ہے۔,پرجاتیوں کی کم تعداد کی بڑی آبادی موجود ہے۔,"قدرتی وسائل کے متن سے ایک اقتباس بیان کرتا ہے: ""جب بھی انسان کے ذریعہ اصل ماحولیاتی نظام کی تشکیل نو ہوتی ہے، تو یہ کثافت پر منحصر ریگولیٹری عوامل کے مستحکم اثرات کے نتیجے میں رکاوٹ کے ساتھ، آسان ہو جاتا ہے۔"" اس کا مطلب یہ ہے کہ ایک پریشان ماحولیاتی نظام میں"
0,college_biology,دخول,ایللیس کی علیحدگی,آزاد درجہ بندی,اوپر سے گزر جانا,ایک مادہ فروٹ فلائی جس میں جڑے ہوئے جین ہوتے ہیں جو فینوٹائپ گرے باڈی اور نارمل پروں کے ساتھی فینوٹائپ بلیک باڈی اور ویسٹیجیئل ونگز کی نر فروٹ فلائی کے ساتھ ملتے ہیں۔ اولاد میں سرمئی جسم والی، پروں والی مکھیوں کی موجودگی کی بہترین وضاحت کی گئی ہے۔
3,college_biology,سمندر,قابل بازیافت جیواشم ایندھن,بارشی جنگل کی نباتات,فضا,کاربن کے درج ذیل میں سے کون سا فعال تالاب زمین پر سب سے بڑا ہے اور کاربن سائیکلنگ میں سب سے زیادہ حصہ ڈالتا ہے؟
0,college_biology,اولاد کی زیادہ پیداوار,محدود وسائل کے لیے مقابلہ,امتیازی بقا اور تولیدی کامیابی,"""فٹ"" اور ""غیر فٹ"" دونوں جینوں کی وراثت",قدرتی انتخاب کے لیے چارلس ڈارون کی تجویز کردہ شرائط میں دی گئی آبادی کے حوالے سے درج ذیل تمام چیزیں شامل ہیں سوائے
0,college_biology,زائلم کے زندہ خلیے پانی کے اوپر چڑھنے کے لیے اہم نالی فراہم کرتے ہیں۔,پانی کے انووں کی ہم آہنگی پانی کے کالم میں ایمبولزم (ہوا کے بلبلوں) کی تشکیل کے لیے ذمہ دار ہے۔,پانی زیادہ ہائیڈرو سٹیٹک پریشر والے منبع والے علاقے سے کم ہائیڈرو سٹیٹک پریشر والے سنک والے علاقے میں منتقل ہوتا ہے۔,پتی کے میسوفیل خلیوں سے پانی کا بخارات پانی کے کالم میں تناؤ پیدا کرتا ہے۔,زائلم میں پانی کے چڑھنے کے لیے ہم آہنگی تناؤ کے نظریہ کے بارے میں درج ذیل میں سے کون سا درست بیان ہے؟
0,college_biology,کولیجن ریشے,لگنن,سلیکا,چٹن,فنگس میں، سیل کی دیواروں کو مندرجہ ذیل میں سے کس سے تقویت ملتی ہے؟
2,college_biology,یہ نشاستے کی نقل کرتا ہے۔,اسے ATP کی ضرورت ہے۔,یہ ڈی این اے پر منحصر ہے۔,یہ غیر فعال ہے۔,پودوں میں، پروٹون پمپ نقل و حمل کے لیے فلوم میں شکر کو لوڈ کرنے کے عمل میں شامل ہوتے ہیں۔ اس عمل کے بارے میں مندرجہ ذیل میں سے کون سا سچ ہے؟
1,college_biology,ہائی ڈیٹریٹل بایوماس,K- منتخب پرجاتیوں کی اعلی تعدد,کھڑے فصلوں کے بایوماس سے بنیادی پیداوار کا اعلی تناسب,شریک ہونے والی پرجاتیوں کے درمیان اعلی مقام کا انحراف,ابتدائی جانشینی پودوں کی کمیونٹی کے لیے درج ذیل میں سے کون سی خصوصیات کی پیش گوئی کی گئی ہے؟
3,college_biology,بنڈل میان، فلویم پیرینچیما، ساتھی سیل، چھلنی ٹیوب,ساتھی خلیات، فلویم پیرینچیما، ریشے، چھلنی ٹیوب,فلویم پیرینچیما، ریشے، بنڈل میان، ٹریچائڈز,ریشے، فلویم پیرینچیما، ساتھی سیل، چھلنی ٹیوب,مندرجہ ذیل میں سے کون سا سمپلاسٹک راستہ ہے جو میسوفیل کے خلیوں میں فوٹو سنتھیسس کے مقام سے فلویم میں سوکروز کی نقل و حرکت کے لیے ہے؟
3,college_chemistry,r = k,r = k [A],r = k [A]^2,r = k ln[A],زیرو آرڈر کیمیائی رد عمل A → B کی شرح، r، کو درج ذیل میں سے کس کے طور پر ظاہر کیا جا سکتا ہے؟
2,college_chemistry,ہر عنصر ایک خصوصیت طول موج پر جذب ہوتا ہے۔,زیادہ تر نامیاتی فنکشنل گروپس IR سپیکٹرم کے مخصوص علاقے میں جذب ہوتے ہیں۔,IR چوٹی کی شدت مالیکیولر ماس سے متعلق ہے۔,تمام مالیکیولر بانڈز IR تابکاری کو جذب کرتے ہیں۔,انفراریڈ (IR) سپیکٹروسکوپی نامیاتی مالیکیولز کی ساخت کے بعض پہلوؤں کا تعین کرنے کے لیے مفید ہے کیونکہ
3,college_chemistry,5,4,3,2,تین اجزاء کے مرکب میں زیادہ سے زیادہ کتنے مراحل ہیں جو ایک دوسرے کے ساتھ توازن میں ہوسکتے ہیں؟
1,college_chemistry,H+ : I− تناسب 2:1 ہے۔,MnO4- : Mn2+ تناسب 3:1 ہے۔,MnO4- : I- تناسب 6:5 ہے۔,I− : IO3− تناسب 3:1 ہے۔,"جب مندرجہ ذیل مساوات متوازن ہو تو درج ذیل میں سے کون سا سچ ہے؟
__ MnO4− + __ I− + __ H+ <-> __ Mn2+ + __ IO3− + __ H2O"
1,college_chemistry,صرف مستقل حجم کے عمل کے لیے,صرف مسلسل درجہ حرارت کے عمل کے لئے,صرف مسلسل دباؤ کے عمل کے لئے,ہمیشہ,مساوات ΔH = ΔU + PΔV لاگو ہے۔
1,college_chemistry,7 لائنیں,5 لائنیں,9 لائنیں,3 لائنیں,نائٹرونیل نائٹرو آکسائیڈز مستحکم ریڈیکلز ہیں جن میں جوڑا نہ ہونے والا الیکٹران دو مساوی نائٹروجن نیوکلیئس سے جوڑا جاتا ہے۔ J << a کے ساتھ ایک سخت نائٹرونیل نائٹرو آکسائیڈ ڈیراڈیکل کے حل کے EPR سپیکٹرم میں کتنی لائنیں ظاہر ہوں گی؟
0,college_chemistry,ایکس رے,بیٹا ذرات,الفا ذرات,نیوٹران,Cobalt-60 کینسر کی تابکاری تھراپی میں استعمال کیا جاتا ہے اور کوبالٹ-59 کی بمباری سے مندرجہ ذیل میں سے کس کے ساتھ تیار کیا جا سکتا ہے؟
3,college_chemistry,غیر جوڑا الیکٹران,دھاتی جسمانی خصوصیات,کم اسپن الیکٹران کی ترتیب,مضبوط آکسائڈائزنگ حالات,پیرا میگنیٹزم اور فیرو میگنیٹزم دونوں کے لیے مندرجہ ذیل میں سے کون سا ضروری ہے؟
2,college_chemistry,2:3,1:6,1:3,1:1,dimethylsulphoxide (DMSO) اور acetonitrile (AN) کے مرکب کا 1H سپیکٹرم بالترتیب α اور 3α کے ساتھ لائنوں پر مشتمل ہے۔ دو ارتکاز کا تناسب کیا ہے، [DMSO]:[AN]؟
3,college_chemistry,T2، T1 کے برعکس، لارمر فریکوئنسی پر سالماتی حرکات کے لیے حساس ہے۔,T1، T2 کے برعکس، لارمر فریکوئنسی پر سالماتی حرکات کے لیے حساس ہے۔,T2، T1 کے برعکس، بہت کم تعدد سالماتی حرکات کے لیے حساس ہے۔,T1، T2 کے برعکس، بہت کم تعدد سالماتی حرکات کے لیے حساس ہے۔,مندرجہ ذیل میں سے کون سا بیان سب سے زیادہ درست طریقے سے وضاحت کرتا ہے کہ نیوکلئس کا T1 بعض اوقات اس کے T2 سے لمبا کیوں ہوتا ہے؟
3,college_chemistry,11.30 پی پی ایم,10.56 پی پی ایم,5.03 پی پی ایم,3.02 پی پی ایم,بینزین کی 1H لارمور فریکوئنسی 400 میگاہرٹز اسپیکٹرومیٹر پر 1.656 kHz کے ٹرائی فلوروسیٹک ایسڈ سے زیادہ ہے۔ بینزین کی 1H کیمیکل شفٹ 7.16 ppm ہے۔ trifluoroacetic ایسڈ کی کیمیائی تبدیلی کیا ہے؟
1,college_chemistry,12.7 سیکنڈ,56.6 سیکنڈ,72.0 سیکنڈ,[پولرائزیشن تیزی سے آرام کرتی ہے: p(t) = [p(0) - peq]exp(-t/T1) + peq۔],فرض کریں کہ 600 میگاہرٹز سپیکٹرومیٹر میں ایک مالیکیول میں 13C مرکزہ 100% پولرائزڈ ہو سکتا ہے (p = 1)۔ اگر T1 = 5.0 s، p کو 298 K پر تھرمل توازن پولرائزیشن کے دو گنا کے برابر قدر تک پہنچنے میں کتنا وقت لگتا ہے؟
0,college_chemistry,3.8 ایم ٹی,5.4 ایم ٹی,27 جی,4.6 ایم ٹی,یہ فرض کرتے ہوئے کہ ریڈیکل فلیٹ ہے اور HCH زاویہ 115° ہے۔
3,college_chemistry,1:8:28:56:70:56:28:8:1,1:9:35:82:120:120:82:35:9:1,1:9:36:84:126:126:84:36:9:1,1:19:36:84:126:126:84:36:19:1,T-Bu ریڈیکل (CH3)3C• کے EPR سپیکٹرم میں لائن کی شدت کا تناسب کیا ہے؟
3,college_chemistry,اسپن ایڈیکٹس کا پتہ لگانے کے لیے ریڈیکل انٹرمیڈیٹس کے براہ راست پتہ لگانے سے کم طاقت کی ضرورت ہوتی ہے۔,آزاد ریڈیکل انٹرمیڈیٹس کی مستحکم ریاستی حراستی EPR کے ذریعے براہ راست پتہ لگانے کے لیے اکثر بہت کم ہوتی ہے۔,اسپن ٹریپنگ فری ریڈیکل انٹرمیڈیٹس کی مقدار درست کرنا آسان بناتی ہے۔,اسپن ٹریپنگ EPR کے ذریعے براہ راست پتہ لگانے سے زیادہ ساختی معلومات فراہم کرتی ہے۔,کون سا ایک جملہ سب سے زیادہ درست طریقے سے وضاحت کرتا ہے کہ اسپن ٹریپنگ کو اکثر فری ریڈیکل انٹرمیڈیٹس کا پتہ لگانے کے لیے کیوں استعمال کیا جاتا ہے؟
2,college_chemistry,1.1445 x 10^-28 J T-1,9.1445 x 10^-27 J T-1,3.1445 x 10^-27 J T-1,6.1445 x 10^-27 J T-1,13C نیوکلئس کے مقناطیسی لمحے (μI) کا حساب لگائیں۔
3,college_chemistry,صرف I اور III,صرف III,صرف II,صرف میں,"کاربن ڈائی آکسائیڈ مالیکیول کے نارمل موڈز جو انفراریڈ ایکٹیو ہوتے ہیں ان میں سے کون سا شامل ہے؟
I. جھکنا
II ہموار کھینچنا
III غیر متناسب کھینچنا"
3,college_chemistry,monodentate ligands کے Octahedral کمپلیکس آپٹیکل isomerism کو صرف اسی صورت میں ظاہر کر سکتے ہیں جب ان میں کم از کم تین مختلف ligands ہوں۔,لکیری کمپلیکس آپٹیکل آئسومیرزم کو ظاہر کر سکتے ہیں جب دونوں لیگنڈز مختلف ہوں۔,ٹیٹراہیڈرل کمپلیکس کبھی بھی آپٹیکل آئیسومیرزم کو ظاہر نہیں کرتے ہیں۔,اسکوائر پلانر کمپلیکس آپٹیکل آئیسومیرزم کو صرف اسی صورت میں ظاہر کر سکتے ہیں جب چاروں لیگنڈ ایک جیسے ہوں۔,مندرجہ ذیل میں سے کون سا ایکیرل لیگنڈس پر مشتمل کمپلیکس کے آپٹیکل آئیسومیرزم کے بارے میں ایک سچا بیان ہے؟
2,college_chemistry,پروٹون اور نیوٹران صرف گھماؤ کونیی رفتار رکھتے ہیں۔,پروٹون اور نیوٹران صرف مداری کونیی رفتار رکھتے ہیں۔,پروٹون میں مداری اور گھماؤ کونیی مومینٹم ہوتا ہے، نیوٹران میں اسپن اینگولر مومینٹم ہوتا ہے۔,پروٹون اور نیوٹران میں مداری اور اسپن کونیی رفتار ہوتی ہے۔,مندرجہ ذیل بیانات میں سے کون سا درست ہے:
1,college_chemistry,13.93 میگاہرٹز,74.34 kHz,42.58 میگاہرٹز,23.56 گیگا ہرٹز,1 T کے مقناطیسی میدان میں پروٹون کے لیے لارمر فریکوئنسی کا حساب لگائیں۔
3,college_chemistry,آرسینک ڈوپڈ سلکان,سلیکن کاربائیڈ,ہیرا,سلکان,مندرجہ ذیل میں سے کون سا این قسم کا سیمی کنڈکٹر ہے؟
3,college_chemistry,35Cl اور 37Cl دونوں میں الیکٹرک کواڈروپول لمحات ہیں۔,مالیکیول سخت نہیں ہے۔,ہائیڈروجن ایٹم تیزی سے بین سالماتی تبادلے سے گزرتا ہے۔,35Cl اور 37Cl دونوں میں I = 0 ہے۔,مندرجہ ذیل میں سے کون سا بیان سب سے زیادہ درست طریقے سے وضاحت کرتا ہے کہ 12CHCl3 کا 1H سپیکٹرم سنگل کیوں ہے؟
3,college_chemistry,4.0 × 10^−9,1.0 × 10^−9,1.0 × 10^−6,1.0 × 10^−3,25°C پر، PbI2 کی زیادہ سے زیادہ مقدار جو 1.00 L خالص پانی میں تحلیل ہو سکتی ہے 1.0 mmol ہے۔ مکمل انحطاط فرض کرتے ہوئے، 25°C پر لیڈ آئوڈائڈ کے لیے حل پذیری کی مصنوعات K_sp ہے
1,college_chemistry,"2,3-dimethylbutane",3-میتھیلپینٹین,2-میتھیلپینٹین,ہیکسین,C6H14 کے کس آئیسومر کے 13C سپیکٹرم میں پانچ مختلف کیمیائی شفٹوں والی لکیریں ہیں؟
