answer,subject,choice_3,choice_2,choice_1,choice_0,question
1,college_medicine,شادی کی اطمینان کی شرح میں بہتری۔,گھر میں پالتو جانوروں کی بڑھتی ہوئی شرح۔,ایک 86 سالہ مرد میئر جو کمیونٹی میں قابل احترام ہیں۔,کشور اسکیئنگ میں مزید گولڈ میڈل۔,"سونا کا استعمال، جسے بعض اوقات ""سونا غسل"" کہا جاتا ہے، انتہائی گرمی کے لیے مختصر مدت کے غیر فعال نمائش کی خصوصیت ہے۔ اس نمائش سے ہلکے ہائپرتھرمیا کا پتہ چلتا ہے – جسم کے بنیادی درجہ حرارت میں اضافہ – جو کہ ایک تھرمورگولیٹری ردعمل پیدا کرتا ہے جس میں نیورو اینڈوکرائن، کارڈیو ویسکولر، اور سائٹو پروٹیکٹو میکانزم شامل ہوتے ہیں جو ہومیوسٹاسس کو بحال کرنے اور جسم کو مستقبل میں گرمی کے دباؤ کے لیے کنڈیشن کرنے کے لیے مل کر کام کرتے ہیں… حالیہ دہائیوں میں سونا غسل ابھرا عمر کو بڑھانے اور مجموعی صحت کو بہتر بنانے کے ایک ذریعہ کے طور پر، مشاہداتی، مداخلتی، اور میکانکی مطالعات کے مجبور ڈیٹا کی بنیاد پر۔ کووپیو اسکیمک ہارٹ ڈیزیز رسک فیکٹر (KIHD) اسٹڈی میں شرکاء کے مطالعے سے حاصل ہونے والے نتائج خاص طور پر دلچسپی کا باعث ہیں، مشرقی فن لینڈ سے تعلق رکھنے والے 2,300 سے زیادہ درمیانی عمر کے مردوں میں صحت کے نتائج کا جاری ممکنہ آبادی پر مبنی ہمہ گیر مطالعہ، جس نے مضبوط روابط کی نشاندہی کی۔ سونا کے استعمال اور موت اور بیماری میں کمی کے درمیان… KIHD کے نتائج سے پتہ چلتا ہے کہ جو مرد ہفتے میں دو سے تین بار سونا استعمال کرتے ہیں ان میں سونا استعمال نہ کرنے والے مردوں کی نسبت قلبی امراض سے مرنے کا امکان 27 فیصد کم تھا۔ مزید برآں، انہوں نے جو فوائد کا تجربہ کیا وہ خوراک پر منحصر پایا گیا: وہ مرد جنہوں نے سونا کا استعمال تقریباً دو بار کیا، ہفتے میں تقریباً چار سے سات بار، تقریباً دو گنا فوائد کا تجربہ کیا - اور قلبی امراض سے مرنے کے امکانات 50 فیصد کم تھے۔ اسباب[2] اس کے علاوہ، اکثر سونا استعمال کرنے والوں میں قبل از وقت موت کی تمام وجوہات سے مرنے کا امکان 40 فیصد کم پایا گیا۔ یہ نتائج عمر، سرگرمی کی سطح، اور طرز زندگی کے عوامل پر غور کرتے ہوئے بھی درست ثابت ہوئے جنہوں نے مردوں کی صحت کو متاثر کیا ہو گا۔ منحصر طریقہ. جن مردوں نے ہفتے میں دو سے تین بار سونا استعمال کیا ان میں ڈیمنشیا ہونے کا خطرہ 66 فیصد کم اور الزائمر کی بیماری میں مبتلا ہونے کا خطرہ 65 فیصد کم تھا، ان مردوں کے مقابلے جنہوں نے ہفتے میں صرف ایک بار سونا استعمال کیا… سونا سے منسلک صحت کے فوائد دماغی صحت کے دیگر پہلوؤں تک بھی استعمال کریں۔ KIHD مطالعہ میں حصہ لینے والے مرد جنہوں نے ہفتے میں چار سے سات بار سونا استعمال کیا ان میں نفسیاتی امراض پیدا ہونے کا امکان 77 فیصد کم تھا، قطع نظر اس کے کہ مردوں کی غذائی عادات، سماجی و اقتصادی حیثیت، جسمانی سرگرمی، اور سوزش کی کیفیت (جیسا کہ C-reactive پروٹین سے ماپا جاتا ہے۔ )…زیادہ درجہ حرارت کی نمائش جسم پر دباؤ ڈالتی ہے، جس سے تیز، مضبوط ردعمل پیدا ہوتا ہے۔ جلد اور بنیادی جسم کے درجہ حرارت میں نمایاں اضافہ ہوتا ہے، اور پسینہ آتا ہے۔ جلد پہلے گرم ہوتی ہے، 40 ° C (104 ° F) تک بڑھ جاتی ہے، اور پھر جسم کے بنیادی درجہ حرارت میں تبدیلیاں رونما ہوتی ہیں، آہستہ آہستہ 37 ° C (98.6 ° F، یا نارمل) سے بڑھ کر 38 ° C (100.4 ° F) اور پھر تیزی سے بڑھ کر 39°C (102.2°F)… کارڈیک آؤٹ پٹ، جسم کی آکسیجن کی ضرورت کے جواب میں دل کے کام کی مقدار کا ایک پیمانہ، 60 سے 70 فیصد تک بڑھتا ہے، جبکہ دل کی دھڑکن (دھڑکنوں کی تعداد) فی منٹ) بڑھتا ہے اور فالج کا حجم (خون پمپ کرنے کی مقدار) میں کوئی تبدیلی نہیں ہوتی۔ اس وقت کے دوران، جسم کے خون کے بہاؤ کا تقریباً 50 سے 70 فیصد حصہ کور سے جلد تک دوبارہ تقسیم کیا جاتا ہے تاکہ پسینہ آنے میں آسانی ہو۔ سونا میں نہانے کے دوران اوسطاً ایک شخص تقریباً 0.5 کلو گرام پسینہ کم کرتا ہے۔[11] شدید گرمی کی نمائش خون کے بنیادی حجم میں کمی کو کم کرنے کے لیے پلازما کے مجموعی حجم میں عارضی اضافے کو بھی آمادہ کرتی ہے۔ پلازما کے حجم میں یہ اضافہ نہ صرف پسینے کے لیے سیال کا ذخیرہ فراہم کرتا ہے، بلکہ یہ گاڑی کے ریڈی ایٹر میں موجود پانی کی طرح کام کرتا ہے، جسم کو ٹھنڈا کرتا ہے تاکہ جسم کے بنیادی درجہ حرارت میں تیزی سے اضافے کو روکا جا سکے اور گرمی کی برداشت کو فروغ دیا جا سکے۔ مستقبل کی نمائشوں کے لیے جسم کے ردعمل کو گرم اور بہتر بناتا ہے، ممکنہ طور پر ایک حیاتیاتی رجحان کی وجہ سے جسے ہارمیسس کہا جاتا ہے، ہلکے تناؤ کے سامنے آنے کے بعد معاوضہ دینے والا دفاعی ردعمل جو تناؤ کی شدت سے غیر متناسب ہے۔ Hormesis حفاظتی میکانزم کی ایک وسیع صف کو متحرک کرتا ہے جو نہ صرف سیل کو پہنچنے والے نقصان کی مرمت کرتا ہے بلکہ اس کے نتیجے میں مزید تباہ کن تناؤ سے بھی تحفظ فراہم کرتا ہے۔ درحقیقت، سونا کا استعمال ان لوگوں کے لیے ورزش کے متبادل کے طور پر تجویز کیا گیا ہے جو دائمی بیماری یا جسمانی حدود کی وجہ سے جسمانی سرگرمی میں حصہ لینے سے قاصر ہیں۔[13]

جائزہ مضمون فن لینڈ کی آبادی کے مطالعے سے بہت سارے اعداد و شمار کا ذریعہ ہے، جہاں سونا کے استعمال کے واقعات زیادہ تر ممالک کے مقابلے میں کافی زیادہ ہیں۔ ڈیٹا کا استعمال کرتے ہوئے، مندرجہ ذیل میں سے کون سی ایسی چیز ہے جو فن لینڈ میں کہیں اور کے مقابلے میں زیادہ قابل فہم ہے؟"
3,college_medicine,ان کاموں سے روک کر ممکنہ نقصانات سے بچیں جن میں وہ ماہر نہیں ہے۔,دوسروں کو اس کی عمر اور قابلیت تلاش کریں جو ان کاموں میں مہارت حاصل کریں جن میں وہ دلچسپی رکھتے ہیں۔,ان کاموں پر روزانہ مشق کریں جن میں وہ بہتری لانا چاہتی ہے۔,دوستوں سے مثبت رائے طلب کریں۔,کیرن ایک کالج کی طالبہ ہے جو اپنے معالج کے ساتھ خود اعتمادی اور خود افادیت کے مضبوط احساس کو فروغ دینے پر کام کر رہی ہے۔ اس نے 3 ماہ کی تھراپی کے بعد حالات کو سنبھالنے کی اپنی صلاحیت میں بڑی تبدیلی دیکھی ہے۔ مندرجہ ذیل میں سے کون سی حکمت عملی نہیں ہوگی کہ اس کا معالج اس سے اس کی خود افادیت کے احساس کو بڑھانے کے لیے اس سے کام کرنے کو کہے؟
3,college_medicine,آکسیجن کی کمی.,آکسیجن کی زیادتی.,ہائپر وینٹیلیشن,کریٹائن کی زیادتی۔,ورزش سے بازیابی کے دوران فوفوکریٹائن کی ترکیب کو روکا جاتا ہے:
3,college_medicine,الکحل کو الکین میں تبدیل کرنے کا رد عمل,نیوکلیوفیلک ایسل متبادل رد عمل ایسٹر کو اینہائیڈرائڈ میں تبدیل کرتا ہے۔,اضافی ردعمل الکین کو الکحل میں تبدیل کرتا ہے۔,SN2 ردعمل ایک الکائل برومائڈ کو الکائل کلورائڈ میں تبدیل کرتا ہے۔,ایک پتلی پرت کی کرومیٹوگرافی ری ایکٹنٹس اور رد عمل کی مصنوعات دونوں پر کی جاتی ہے۔ یہ پایا گیا ہے کہ مصنوعات کی Rf ویلیو ہے جو ری ایکٹنٹس سے نمایاں طور پر زیادہ ہے۔ مندرجہ ذیل میں سے کون مناسب طور پر اس ردعمل کو بیان کر سکتا ہے:
3,college_medicine,gluconeogenesis.,lipolysis.,glycolysis.,glycogenolysis.,لییکٹیٹ، گلیسرول، یا امینو ایسڈ سے گلوکوز کی ترکیب کو کہا جاتا ہے:
2,college_medicine,4 منٹ,1 منٹ,30 سیکنڈ,10 سیکنڈ,کس مدت کے بعد زیادہ سے زیادہ متحرک ورزش بنیادی طور پر ایروبک بن جاتی ہے؟
2,college_medicine,H2O(s) میں H2O(l) سے کم کثافت ہوتی ہے جس کی وجہ سے ٹھوس کم دباؤ کے حالات میں مائع بنتا ہے۔,H2O(s) میں H2O(l) سے کم کثافت ہوتی ہے جس کا نتیجہ کرسٹل لائن فریم ورک سے ہوتا ہے جو ہائیڈروجن بانڈز کی وجہ سے بنتا ہے۔,H2O(s) میں H2O(l) سے زیادہ کثافت ہوتی ہے، جس کا نتیجہ پانی کے مالیکیولز کے درمیان بننے والے ہائیڈروجن بانڈز سے ہوتا ہے۔,H2O(s) میں H2O(l) سے زیادہ کثافت ہوتی ہے، جس کی وجہ سے ٹھوس زیادہ دباؤ کے حالات میں مائع بنتا ہے۔,پانی کے لیے فیز ڈایاگرام میں مائع ٹھوس توازن لائن کی منفی ڈھلوان کے لیے درج ذیل میں سے کون سا بہترین اکاؤنٹ ہے؟
3,college_medicine,[H2O] بڑھتا ہے۔,Ksp برائے Mg(OH)2 بڑھتا ہے۔,Mg(OH) 2 پریسیپیٹیٹس,ایم جی سی ایل 2 تیز ہوجاتا ہے۔,Mg(OH)2 آہستہ آہستہ 500 ملی لیٹر 25 oC پانی میں اس وقت تک گھل جاتا ہے جب تک کہ محلول پوری طرح سیر نہ ہوجائے۔ مندرجہ ذیل میں سے کون سا ہوتا ہے جب 0.1 M HCl کا 10.0 mL شامل کیا جاتا ہے؟
0,college_medicine,اولاد کا ایک چوتھائی حصہ متاثر ہوگا۔,نصف مرد اور نصف خواتین متاثر ہوں گے۔,تمام مرد اور کوئی خواتین متاثر نہیں ہوں گی۔,اولاد میں سے کوئی بھی متاثر نہیں ہوگا۔,Myoclonic مرگی اور ragged-red fiber (MERRF) ایک انتہائی نایاب عارضہ ہے جو اعصابی نظام کو متاثر کرتا ہے۔ MERRF کا نتیجہ mitochondrial DNA (mtDNA) میں تبدیلی سے ہوتا ہے جو پروٹین کی ترکیب، آکسیجن کی کھپت اور توانائی کی پیداوار کو متاثر کرتا ہے۔ جب ایک متاثرہ مرد اور ایک عام مادہ دوبارہ پیدا کرتے ہیں، تو مندرجہ ذیل میں سے کون سی اولاد کے متوقع فینوٹائپک تناسب کی بہترین پیش گوئی کرتا ہے؟
2,college_medicine,غیر سٹیرایڈ دوائیں جو قدرتی سٹیرایڈ ہارمونز کے اثرات کو روکنے والی اینڈروجن ریسیپٹرز پر کام کرتی ہیں۔,غیر سٹیرایڈ دوائیں جو قدرتی سٹیرایڈ ہارمونز کے اثرات کی نقل کرتے ہوئے اینڈروجن ریسیپٹرز پر کام کرتی ہیں۔,سٹیرایڈ دوائیں جو قدرتی سٹیرایڈ ہارمونز کے اثرات کے مخالف اینڈروجن ریسیپٹرز پر کام کرتی ہیں۔,سٹیرایڈ دوائیں جو قدرتی سٹیرایڈ ہارمونز کے اثرات کی نقل کرتے ہوئے اینڈروجن ریسیپٹرز پر کام کرتی ہیں۔,سلیکٹیو اینڈروجن ریسیپٹر ماڈیولرز (SARMs) ہیں:
0,college_medicine,noradrenaline جو پٹھوں کی میٹابولک سرگرمی کو بڑھاتا ہے۔,کیلشیم آئن جو پٹھوں کے ریشے کے ساتھ ایک عمل کی صلاحیت کا آغاز کرتے ہیں۔,سوڈیم آئن جو پٹھوں کی جھلی پر سوڈیم ریسیپٹرز سے منسلک ہوتے ہیں۔,ایسیٹیلکولین جو نیورومسکلر جنکشن کو عبور کرتی ہے۔,موٹر اینڈ پلیٹ پر پہنچنے والی ایکشن پوٹینشل ان کی رہائی کا سبب بنتی ہے:
2,college_medicine,پہلی بار اناٹومی لیب میں جانے کے بعد، آپ کو فارملڈہائیڈ کی بو محسوس نہیں ہوگی۔,دھوپ والے دن باہر چہل قدمی کرنے کے بعد، آپ روشنی کی ابتدائی چمک سے اندھے نہیں ہوتے۔,پہلی بار ایک پرہجوم کمرے میں جانے کے بعد، آپ اپنے اردگرد ہونے والی گفتگو کی گونج سے پریشان نہیں ہوں گے۔,قمیض پہننے کے بعد، آپ کو اپنی پیٹھ پر تانے بانے کا احساس نہیں ہوگا۔,مندرجہ ذیل سبھی حسی، یا اعصابی، موافقت کی مثال ہیں سوائے:
2,college_medicine,آرام کی صلاحیت,ہائپر پولرائزیشن,ریپولرائزیشن,Depolarization,ایک سائنسدان، الیکٹروڈز کا استعمال کرتے ہوئے، ہائپوتھیلمس میں نیوران کے ایک گروپ کو متحرک کر رہا ہے اور ان کی جھلی کی ممکنہ تبدیلیوں کو ریکارڈ کر رہا ہے۔ وہ جھلی کی صلاحیت میں تیزی سے اضافہ دیکھتی ہے جب وہ پہلی بار انہیں متحرک کرتی ہے، 100mV کا فرق۔ جب وہ پہلی کے فوراً بعد ایک اور محرک آزماتی ہے تو کوئی جواب نہیں ملتا۔ تاہم، جب وہ دوسرے جھٹکے کے لیے فراہم کردہ وولٹیج کی مقدار میں اضافہ کرتی ہے، تو وہ پہلے سے ملتا جلتا ردعمل دیکھتی ہے۔ جھلی کی صلاحیت کے حوالے سے دوسرے جھٹکے کی محرک کی مدت کیا ہوگی؟
0,college_medicine,آکسیجن شامل نہیں ہے.,صرف کاربن ڈائی آکسائیڈ اور پانی پیدا کرتا ہے۔,صرف acetyl-CoA کے 16 مالیکیول حاصل کرتا ہے۔,ایسٹیل-CoA کے 8 مالیکیول اور کچھ ATP اور پانی پیدا کرتا ہے۔,پامیٹک ایسڈ، CH3(CH2)14CO2H کے مالیکیول کا β-آکسیڈیشن:
3,college_medicine,ایک بڑے، ممکنہ طور پر غیر فعال پروٹین کی پیداوار,کوئی تبدیلی نہیں,ایک جیسے سائز کے لیکن غیر فعال پروٹین کی پیداوار,پروٹین کی عدم موجودگی,"اس ترمیم کا سب سے زیادہ ممکنہ نتیجہ کیا ہے؟
میں
ایک آر این اے اسٹرینڈ جو عام طور پر ایک ٹرانس میمبرن پروٹین تیار کرتا ہے جو پٹھوں کے خلیوں میں پوٹاشیم کے داخلے کی سہولت فراہم کرتا ہے اس میں ترمیم کرکے ایک مختلف اسٹرینڈ تیار کیا جاتا ہے۔ اصل اسٹرینڈ اس طرح ہے:

 GAAUAGAUGGGAAGCGCCAGAUACAGUAACAGA… 

ترمیم شدہ ترتیب مندرجہ ذیل ہے:

 GAAUAGAUGGGAAGCGCCAGAUACAGUACCAGA…"
2,college_medicine,گلائکوجن یا گلوکوز سے پائروویٹ یا ایسٹیل CoA۔,گلائکوجن یا گلوکوز سے پائروویٹ یا لییکٹیٹ۔,گلائکوجن یا گلوکوز سے فریکٹوز۔,گلائکوجن سے گلوکوز-1-فاسفیٹ۔,Glycolysis اس راستے کو دیا جانے والا نام ہے جس میں تبدیلی شامل ہے:
1,college_medicine,صرف I اور III اور IV,صرف I اور IV,صرف III,صرف II,"ایک ماہر نفسیات ایک تجربہ کرتا ہے جس میں مضامین سے کہا جاتا ہے کہ وہ ""حقائق"" کی ایک سیریز سیکھیں جو دراصل ایسے بیانات ہیں جو تحقیقی ٹیم نے گھڑ لیے ہیں۔ مضامین یونیورسٹی کے انڈرگریجویٹ طلباء پر مشتمل ہیں جہاں یہ تجربہ کیا جا رہا ہے۔ مضامین کو تصادفی طور پر ان گروپوں کو تفویض کیا جاتا ہے جنہیں ان کی شرکت کے لیے یا تو $10 یا $20 کا معاوضہ دیا جاتا ہے، انہیں حقائق جاننے کے لیے یا تو 15 منٹ یا 30 منٹ کا وقت دیا جاتا ہے، اور ان سے حقائق کو اسی کمرے میں یاد کرنے کو کہا جاتا ہے جس میں انھوں نے حقائق سیکھے تھے یا ایک بہت مختلف، غیر مانوس ترتیب میں۔ اس تجربے میں مندرجہ ذیل میں سے کون سے منحصر متغیرات ہیں؟
I. مضامین کو معاوضہ کی رقم۔
II وہ کمرہ جس میں مضامین کو حقائق یاد کرنے کو کہا گیا تھا۔
III حقائق کی تعداد مضامین یاد کر سکتے ہیں۔
چہارم مضامین کو حقائق جاننے کے لیے جو وقت دیا گیا تھا۔"
0,college_medicine,پوٹاشیم کی کمی۔,اینٹی آکسیڈینٹس کی زیادتی۔,پٹھوں میں hyperosmolality کی ترقی.,غیر نامیاتی فاسفیٹ کا جمع ہونا۔,مندرجہ ذیل میں سے کس کو متعدد سپرنٹ سرگرمیوں کے دوران پردیی پٹھوں کی تھکاوٹ کی نشوونما میں ملوث سمجھا جاتا ہے؟
0,college_medicine,ایکٹین بائنڈنگ سائٹس سیر شدہ ہیں۔,ایکٹین بائنڈنگ سائٹس بے نقاب ہیں.,اعصابی محرک بہت طاقتور ہے۔,اعصابی محرک کو ہٹا دیا جاتا ہے.,پٹھوں کا ریشہ آرام کرتا ہے جب:
1,college_medicine,لییکٹیٹ کو پائروویٹ میں تبدیل کرتا ہے۔,pyruvate کی lactate میں تبدیلی کو اتپریرک کرتا ہے۔,pyruvate کی acetyl CoA میں تبدیلی کو اتپریرک کرتا ہے۔,sarcoplasm میں واقع ہے.,پائروویٹ ڈیہائیڈروجنیز کمپلیکس:
3,college_medicine,گلائکولیسس کو اے ٹی پی کی دوبارہ ترکیب کے ایک بڑے ذریعہ کے طور پر استعمال کیا جا رہا ہے۔,پائروویٹ لییکٹیٹ میں بدل جاتا ہے۔,فاسفوکریٹائن کی خرابی ہوتی ہے۔,گلائکوجن ختم ہو جاتا ہے۔,ہائیڈروجن آئن اس وقت بنتے ہیں جب:
0,college_medicine,پروٹین,dinitronucleic ایسڈ,رائبونیوکلک ایسڈ,ڈی اکسی رائیبو نیوکلک ایسڈ۔,ہمارے جینیاتی مواد پر مشتمل ہے:
2,college_medicine,جنونی۔مجبوری,پیرانائیڈ,نرگسیت پسند,تاریخی,ایک دندان ساز جو اپنے کلینک میں طریقہ کار انجام دے رہا ہے اسے ایک دن سامنے کی میز پر لایا جاتا ہے تاکہ اس کے ایک مریض اور کلرک کے درمیان جھگڑا ہو سکے۔ مریض ایک درمیانی عمر کا تاجر ہے جو غصے میں ہے اور ایک منظر بنا رہا ہے کیونکہ اسے بتایا گیا تھا کہ اسے دانتوں کے ڈاکٹر کے بجائے دانتوں کے حفظان صحت کے ماہر سے ملنا پڑے گا۔ مریض اونچی آواز میں کہتا ہے کہ وہ ایک آدھے تربیت یافتہ ساتھی کے علاج کے لیے بہت زیادہ رقم کماتا ہے۔ کلرک دانتوں کے ڈاکٹر کو بتاتا ہے کہ مریض اپنی اپوائنٹمنٹ میں 40 منٹ لیٹ تھا، اور اب صرف ایک ہیجینسٹ کے پاس تھا۔ مریض واپس آتا ہے کہ اس کا وقت دفتر میں موجود کسی بھی لوگوں سے زیادہ قیمتی ہے۔ یہ مریض ممکنہ طور پر کس شخصیت کی خرابی کا مظاہرہ کر رہا ہے؟
3,college_medicine,ایک اعلی غوطہ خور اپنے کوچ سے کسی مخصوص اقدام پر اپنی فارم کو بہتر بنانے کے لیے ہدایات لیتا ہے۔,ایک ہائی اسکول کا انگریزی کا طالب علم اپنے پروفیسر کے جائزے کے لیے ایک مقالہ جمع کر رہا ہے۔,کنسرٹ کا ایک بانسری بجانے والا ایک ٹکڑا مکمل کرنے میں ناکام رہتا ہے جس کا اختتام غلطیوں کے بغیر بہت پیچیدہ ہوتا ہے۔,بیس بال کا کھلاڑی پٹھوں کی یادداشت کو بڑھانے کے لیے ٹی سے بیس بالوں کو مارتا ہے۔,وائگوٹسکی کا سماجی ثقافتی ترقی کا نظریہ اس بات کو بیان کرنے کی کوشش کرتا ہے کہ بچے کس ذہنی فعل کے ساتھ پیدا ہوتے ہیں اور کس طرح وہ ان کو بالغوں میں پیدا کرتے ہیں۔ اس کے اہم اجزاء میں سے ایک قربت کی ترقی کا زون ہے۔ مندرجہ ذیل میں سے کون سا بیانات قربت کی ترقی کے زون میں فرد کی درست وضاحت کرتا ہے؟
1,college_medicine,جننانگ,اویکت,فالک,مقعد,زیادہ پیداواری بننے کے لیے ایک تھراپسٹ کے ساتھ کام کرنے والا نوجوان بڑے ہونے کے دوران اپنی بہت سی خواہشات کا اظہار کر رہا ہے اور وہ کیسے محسوس کرتا ہے کہ اس نے اسے متاثر کیا ہے۔ فہم کے ذریعے، معالج کا کہنا ہے کہ اسے یقین ہے کہ نوجوان کی نشوونما ایک ایسے مرحلے میں پھنسی ہوئی ہے جو اپنے گھر کو صاف رکھنے میں اس کی نااہلی سے ظاہر ہوتا ہے۔ فرائیڈ کے نظریہ نفسیاتی نشوونما کے مطابق، اس نوجوان کو کس مرحلے میں طے کیا جائے گا؟
0,college_medicine,گلائکوسیڈک بانڈز,آئنک بانڈز,ہائیڈروجن بانڈز,پیپٹائڈ بانڈز,پروٹین میں امینو ایسڈ کو کس قسم کے ہم آہنگی بانڈ جوڑتے ہیں؟
3,college_medicine,ایک دوسرے شخص کی موجودگی جو پہلے ہی لڑکی کے قریب آرہا ہے۔,وہ شخص جس کو امداد کی ضرورت ہوتی ہے وہ مختلف نسل کے بجائے ایک ہی نسل کا دکھائی دیتا ہے۔,لوگوں کے ایک دوسرے گروپ کی موجودگی سڑک کو روکتی ہے۔,وہ شخص جس کو امداد کی ضرورت ہوتی ہے وہ اعلیٰ طبقے کی بجائے نچلے سماجی معاشی طبقے کا لگتا ہے۔,رات گئے ایک گلی میں چہل قدمی کرتے ہوئے، ایک بالغ مرد پیدل چلنے والے نے ایک نوجوان لڑکی کو زمین پر دیکھا، جو حرکت نہیں کر رہی تھی۔ عورت سڑک کے مخالف سمت میں ہے۔ سڑک پار کرتے ہوئے، پیدل چلنے والے نے دیکھا کہ نوجوان عورت اس سے کہیں زیادہ دولت مند دکھائی دیتی ہے اور ایک مختلف نسل کی ہے۔ کوئی اور موجود نہ دیکھ کر، پیدل چلنے والے نے مدد کی۔ بائے اسٹینڈر اثر کے مطابق، مندرجہ ذیل میں سے کون پیدل چلنے والوں کے رد عمل کو تبدیل کرے گا؟
