answer,subject,choice_3,choice_2,choice_1,choice_0,question
3,high_school_psychology,ٹیسٹ قابل اعتماد ہو سکتا ہے لیکن درست نہیں۔,درستگی کامیابی کے ٹیسٹوں سے متعلق ایک تصور ہے، اور قابل اعتماد قابلیت ٹیسٹ سے متعلق اسی تصور ہے۔,اگر کوئی ٹیسٹ قابل اعتماد ہے تو وہ درست ہے، لیکن اگر ٹیسٹ قابل اعتماد نہیں ہے تو وہ درست نہیں ہو سکتا۔,وشوسنییتا اور موزونیت ایک دوسرے سے الگ ہیں: ایک ٹیسٹ قابل اعتماد یا درست ہو سکتا ہے، لیکن یہ دونوں نہیں ہو سکتے۔,درج ذیل میں سے کون سا بیان قابل اعتماد اور درستگی کے درمیان تعلق کے بارے میں درست ہے؟
3,high_school_psychology,شنک,کارنیا,بصری اعصاب,سلاخوں,آنکھوں میں مندرجہ ذیل ڈھانچے میں سے کون سا رنگ بصارت کے لیے خاص طور پر ذمہ دار ہے؟
3,high_school_psychology,مائیلین,ہارمونز,ٹرمینل بٹن,Synapse,نیورل ٹرانسمیشن کو اکثر الیکٹرو کیمیکل عمل کے طور پر بیان کیا جاتا ہے۔ مندرجہ ذیل میں سے کون سا براہ راست برقی پہلو میں شامل ہے؟
3,high_school_psychology,جالی دار تشکیل,gonads,پٹیوٹری,ہائپوتھیلمس,مندرجہ ذیل میں سے کون سی سب سے کم جنسی رویے کو متاثر کرتا ہے؟
0,high_school_psychology,محبت,غصہ,نفرت,حیرت,مندرجہ ذیل میں سے کس کو چہرے کے بنیادی تاثرات نہیں سمجھا جاتا ہے؟
3,high_school_psychology,سامعین,حامی,تعاون کرنے والے,شراکت دار,جب کوئی بچہ ایلیمنٹری اسکول میں داخل ہوتا ہے، تو والدین کثرت سے بچے کی تعلیم میں شراکت داروں، تعاون کاروں اور مسئلہ حل کرنے والوں کے طور پر شامل ہوتے ہیں۔ مڈل اور ہائی اسکول کے دوران، والدین کو عام طور پر بیان کیا جاتا ہے۔
3,high_school_psychology,مستند,آمرانہ,اجازت دینے والا,کم سے کم نگرانی,کارلوٹا ایک اچھی طرح سے ایڈجسٹ، سماجی طور پر قابل نوجوان ہے۔ مندرجہ ذیل میں سے کون سا اس کے خاندان کے والدین کے انداز کی سب سے زیادہ نمائندگی کرتا ہے؟
1,high_school_psychology,منفی سزا,پوائنٹ ویلیو سسٹم,ایک ٹوکن معیشت,منفی کمک,میکس جب بھی پری اسکول میں جاتا تھا تو عام طور پر قابو سے باہر ہوتا تھا۔ اساتذہ نے ٹائم آؤٹ اور دیگر سزاؤں کی کوشش کی کوئی فائدہ نہیں ہوا۔ اس کے والدین اور اسکول نے میکس کے ساتھ کام کرنے کا فیصلہ کیا کہ جب بھی وہ پورے گھنٹے تک برتاؤ کرتا ہے تو اسے اسٹیکر دے کر۔ ایک بار جب اس نے دس اسٹیکرز جمع کر لیے تو وہ انہیں اپنے والدین کو پیش کر سکتا تھا جو اسے انعام دیں گے۔ اسکول اور والدین نے ملازمت کے لیے جس طریقہ کا انتخاب کیا اسے کہا جاتا ہے۔
1,high_school_psychology,Hawthorne اثر,ایک اندھا مطالعہ,ڈبل بلائنڈ مطالعہ,مطالبہ کی خصوصیات,کون سی تکنیک تجربہ کار اور موضوع کے تعصب دونوں کے لیے کنٹرول کرتی ہے؟
3,high_school_psychology,سیریبیلم,سینسری موٹر کارٹیکس,تھیلامس,limbic نظام,بہت زیادہ الکحل پینے والے شخص کی حیران کن اور دھندلاپن والی تقریر زیادہ تر ممکنہ طور پر کام میں تبدیلی کا نتیجہ ہے۔
2,high_school_psychology,کراس کلچرل بشریات,فلسفہ,طبیعیات,بائیو کیمسٹری,نفسیات کا شعبہ مندرجہ ذیل میں سے کس سے پیدا ہوا؟
1,high_school_psychology,ایک ماں بلی اپنے بلی کے بچوں کو خود کو صاف کرنے کا طریقہ سکھاتی ہے۔,ایک بچہ جسے اس کے بنیادی نگہداشت کرنے والے اہم مدت کے لیے چھوڑ دیتے ہیں ان کی موجودگی سے لاتعلقی پیدا کرتی ہے۔,"ایک نوزائیدہ گوسلنگ پہلی حرکت پذیر شے سے ""جوڑ دے گا"" جسے وہ دیکھتا ہے، عام طور پر اس کی ماں۔",ایک ماں عقاب اپنے بچوں کے نیچے اڑتی ہے جب وہ اڑنا سیکھ رہے ہوتے ہیں اگر وہ گرنے لگیں۔,مندرجہ ذیل میں سے کون سی نقوش کی مثال ہے؟
3,high_school_psychology,کیزیا رات کا کھانا کھانے کے بعد بہت بھری ہوئی ہے لیکن اس نے بہرحال اسٹرابیری چیزکیک آرڈر کرنے کا فیصلہ کیا۔,ٹِش نے دوپہر کا کھانا چھوڑنے کا فیصلہ کیا کیونکہ وہ ابھی بھی بہت بڑا ناشتہ کھانے سے بھری ہوئی ہے۔,ارنسٹ کلاس میں جاتے ہوئے چند کوکیز کو گوبل کرتا ہے کیونکہ اس کے پاس لنچ کا وقت نہیں تھا۔,اپنی پانچ میل کی دوڑ کے وسط میں، جیروم اپنی پیاس بجھانے کے لیے واٹر اسٹیشن سے پانی پکڑتا ہے۔,مندرجہ ذیل میں سے کس کے لیے ڈرائیو میں کمی کے نظریات معقول وضاحت فراہم نہیں کریں گے؟
0,high_school_psychology,سیریبیلم,میڈولا,تھیلامس,limbic نظام,ڈاکٹر سکارلیٹ نے تجربات کیے جس میں اس نے بلی کے دماغ کے حصوں کو برقی طور پر متحرک کیا۔ ایک بلی جو چوہے کی موجودگی میں خوفزدہ ہو گئی تھی، غالباً اس میں حوصلہ افزائی کی گئی تھی۔
3,high_school_psychology,فرق کی حد,سگنل کا پتہ لگانے کا نظریہ,مطلق حد,شاندار ادراک,مندرجہ ذیل میں سے کون اس بات کی وضاحت کرتا ہے کہ کیوں زیادہ تر لوگ اکثر کوک اور پیپسی کے درمیان فرق کا پتہ لگا سکتے ہیں؟
3,high_school_psychology,نظام کے نقطہ نظر,نفسیاتی نقطہ نظر,طرز عمل کا طریقہ,علمی سماجی نقطہ نظر,ایک طبی ماہر نفسیات جو ایک جارحانہ بچے کے ساتھ کام کر رہا ہے پورے خاندان کی حرکیات کی روشنی میں بچے کے رویے کو سمجھنے کی کوشش کرتا ہے۔ مندرجہ ذیل میں سے کون سا طریقہ ماہر نفسیات کے منتخب کردہ نقطہ نظر کی بہترین نشاندہی کرتا ہے؟
1,high_school_psychology,تجربات زیادہ حقیقت پسندانہ، حقیقی زندگی کی ترتیبات میں ہوتے ہیں۔,تجربات میں عام طور پر دیگر تحقیقی طریقوں سے زیادہ شرکاء شامل ہوتے ہیں۔,تجربات انحصار متغیرات پر آزاد متغیر کے اثرات کو الگ کرتے ہیں۔,تجربات دوسرے تحقیقی طریقوں سے زیادہ درست ہیں۔,جب کوئی دوسرا تحقیقی طریقہ نہیں کر سکتا تو تجربات کیوں سببی تعلقات کا تعین کر سکتے ہیں؟
1,high_school_psychology,نفسیاتی,انسانیت پسند,ارتقائی,علمی,کس قسم کا ماہر نفسیات اس بات پر زور دے گا کہ لوگوں کے لیے ایک اہم محرک ان کے جینیاتی مواد کو پھیلانے کی خواہش ہے؟
2,high_school_psychology,دیکھنے والا اثر,معاشرتی کاہلی,گروپ سوچ,الگ الگ,ٹیم ٹگ آف وار میں، ٹائی نے اتنی مشکل نہیں کھینچی جتنی کہ اگر وہ ایک حریف کے خلاف اکیلے کھینچ رہا ہوتا۔ اس کا طرز عمل اس کی مثال دیتا ہے۔
1,high_school_psychology,کلاسیکی کنڈیشنگ استعمال کرنا زیادہ مشکل ہے لیکن آپریٹ کنڈیشنگ سے زیادہ موثر ہے۔,آپریٹ کنڈیشنگ کا استعمال حیاتیات کو مخصوص اعمال انجام دینے کی تربیت دینے کے لیے کیا جاتا ہے، اور کلاسیکی کنڈیشنگ کا استعمال حیاتیات کو مخصوص اعمال کو انجام دینے سے روکنے کے لیے کیا جاتا ہے۔,کلاسیکی کنڈیشنگ میں محرک کا جوڑا بنانا شامل ہے، اور آپریٹ کنڈیشنگ میں محرک کے ساتھ ردعمل کو جوڑنا شامل ہے۔,آپریٹ کنڈیشنگ کلاسیکی کنڈیشنگ سے پہلے اچھی طرح سے قائم کی گئی تھی۔,کلاسیکی اور آپریٹ کنڈیشنگ کے درمیان بڑا فرق کیا ہے؟
1,high_school_psychology,انووا,ہسٹوگرام,موڈ,اوسط,سامعین کے زیر کفالت ریڈیو سٹیشن اس رقم کا تخمینہ لگانا چاہتا ہے کہ عام سپورٹر فنڈ ڈرائیو کے دوران کتنا حصہ ڈالتا ہے۔ 30 حامیوں کے نمونے میں، یہ پتہ چلا کہ ان میں سے 22 نے 60 ڈالر دیے، ان میں سے چھ نے 1000 ڈالر اور ان میں سے دو نے 10،000 ڈالر دیے۔ اس نمونے کی بنیاد پر، مرکزی رجحان کے درج ذیل اقدامات میں سے کون سا ریڈیو اسٹیشن کو سب سے زیادہ مفید معلومات فراہم کرے گا؟
3,high_school_psychology,شکل کی مستقل مزاجی,خلاصہ,برطرفی,autokinetic اثر,نوجوان ٹینا نے اس وقت تک خلائی شٹل کو کبھی نہیں دیکھا تھا جب تک کہ اس کے والدین نے اس کی لانچ کے لیے تیار تصویر کی نشاندہی نہیں کی۔ جب اس نے اگلی بار اس کی تصویر اڑتی ہوئی دیکھی تو اسے پہچاننے میں مشکل ہوئی۔ کون سا تصور اس مسئلے کی بہترین وضاحت کرتا ہے؟
3,high_school_psychology,خواہ کتنے ہی شرکاء ہوں، مصنف کا بیان جائز نہیں ہے۔,مصنف کے بیان کو درست ثابت کرنے کے لیے کم از کم 100 مریضوں کو دوپہر کے کھانے کے بعد دانت صاف کرنے کی ضرورت تھی۔,اگر کم از کم 500 مریضوں کا مطالعہ کیا جائے تو مصنف کا بیان درست ہے۔,اگر کم از کم 100 مریضوں کا مطالعہ کیا جائے تو مصنف کا بیان درست ہے۔,ڈاکٹر رام چندرن نے پایا کہ ان کے مریض جو دوپہر کے کھانے کے بعد اپنے دانت صاف کرتے ہیں ان کے دانتوں میں گہاوں کی تعداد 1/20 تھی جو نہیں کرتے تھے۔ دانتوں کے ڈاکٹر کے انٹرویو کے بعد، ایک مقامی نیوز رائٹر نے بتایا کہ دوپہر کے کھانے کے بعد دانت صاف کرنے سے گہاوں کو روکتا ہے۔ دندان ساز کی تحقیق کی بنیاد پر، درج ذیل میں سے کون سا بیان درست ہے؟
2,high_school_psychology,کنیستھیزیا,ہومیوسٹاسس,سیٹ پوائنٹ,ادراک استقامت,مندرجہ ذیل میں سے کون سی اصطلاح جسم کی نسبتاً مستقل حالت کو برقرار رکھنے کے رجحان کی طرف اشارہ کرتی ہے جو خلیوں کو زندہ رہنے اور کام کرنے کی اجازت دیتی ہے؟
0,high_school_psychology,somatoform خرابی کی شکایت,پاگل شیزوفرینیا,dissociative شناخت کی خرابی کی شکایت,غیر سماجی شخصیت کی خرابی,جوئی، ایک 25 سالہ مجرم، پرائمری اسکول میں طرز عمل کی خرابی اور جونیئر ہائی میں غنڈہ گردی کی تاریخ رکھتا ہے۔ ہائی اسکول تک، وہ ساتھیوں کو لوٹ رہا تھا اور بوڑھے خریداروں سے جو چاہے لے رہا تھا اس کی پرواہ کیے بغیر کہ اس نے کسی کو تکلیف پہنچائی ہے۔ جوی کو زیادہ تر ممکنہ طور پر تشخیص کیا جائے گا
1,high_school_psychology,جزوی,مسلسل,ثانوی,بنیادی,"""A+"" کورس کا گریڈ کس قسم کا کمک ہے؟"
1,high_school_psychology,"""میں اپنی کار کو کریش نہیں کرنا چاہتا۔""","""میں چاہتا ہوں کہ میرے والدین میری ڈرائیونگ کی منظوری دیں۔""","""یہ قانون ہے۔""","""میں کوئی ٹکٹ نہیں لینا چاہتا۔""",مندرجہ ذیل میں سے کون سی وضاحت اس بات کی ہے کہ ایک 17 سالہ نوجوان اپنی گاڑی کو رفتار کی حد سے زیادہ یا اس سے کم کیوں چلاتا ہے، کوہلبرگ کی اخلاقیات کی روایتی سطح کی بہترین عکاسی کرتا ہے؟
3,high_school_psychology,ایگوروفوبیا,سماجی فوبیا,arachnophobia,کلاسٹروفوبیا,ایسی جگہوں یا حالات میں ہونے کا جنونی خوف جہاں سے فرار مشکل ہو سکتا ہے۔
2,high_school_psychology,کارل راجرز,بی ایف سکنر,ولہیم ونڈٹ,ولیم جیمز,مندرجہ ذیل میں سے کون سا ماہر نفسیات مندرجہ ذیل بیان سے زیادہ تر اتفاق کرے گا: برتاؤ کمک اور سزا دینے والوں کے امتزاج کا نتیجہ ہے؟
0,high_school_psychology,علمی تھراپی,انسانی علاج,رویے کی تھراپی,نفسیاتی تجزیہ,مفت ایسوسی ایشن اور خواب کی تعبیر اکثر مندرجہ ذیل میں سے کس علاج کی خصوصیت کرتی ہے؟
1,high_school_psychology,سیال انٹیلی جنس,تیزی سے استدلال کرنے کی صلاحیت,کرسٹلائزڈ انٹیلی جنس,تیز نگاہی,25 سے 75 سال کی عمر میں ایک عام، صحت مند فرد کی عمر کے طور پر کون سا بڑھنے کا امکان ہے؟
2,high_school_psychology,جنونی مجبوری,علمی اختلاف,متاثر کن دوبارہ تربیت,رد عمل کی تشکیل,سگریٹ پینے والا ڈاکٹر جانتا ہے کہ یہ غیر صحت بخش ہے، لیکن سوچتا ہے کہ وہ تمباکو نوشی جاری رکھ سکتا ہے، کیونکہ وہ صحت بخش کھاتا ہے۔ کون سا تصور اس سوچ کے عمل کی بہترین وضاحت کرتا ہے؟
3,high_school_psychology,انفرادی اختلافات کے مستحکم ذرائع جو فطرت اور پرورش کے تعامل کی بنیاد پر فرد کی خصوصیت رکھتے ہیں۔,سوچ اور ماحول کے درمیان تعامل، جو رویے کو متاثر کرتے ہیں۔,بامقصد کام کرنے اور اپنی تقدیر کو تشکیل دینے کی مخصوص انسانی صلاحیت,نفسیاتی توانائی کے متضاد ذرائع,خاصیت کے نظریہ نگاروں کے مطابق، جیسے ہینس آئسینک، شخصیت کی بنیاد ہے۔
0,high_school_psychology,انٹروورشن,خود معذوری,خود شک,خود افادیت,ٹونی کو اس کالج میں قبول کر لیا گیا جس میں وہ جانا چاہتا ہے، وہ ایک ایسی لڑکی کے ساتھ پروم میں جا رہا ہے جس کی وہ واقعی تعریف کرتا ہے، اور اسے اس سمر جاب کے لیے رکھا گیا جس کی اس نے تلاش کی تھی۔ اس کے پاس اعلیٰ ہے۔
0,high_school_psychology,آزاد متغیر,منحصر متغیر,مسلسل متغیر,واضح متغیر,کھانے کی عادات پر تحقیق کے آغاز میں، ایک محقق شرکاء سے مختلف سوالات پوچھتا ہے، بشمول وہ عام طور پر ناشتہ کرتے ہیں یا نہیں۔ کوئی شخص ناشتہ کرتا ہے یا نہیں؟
3,high_school_psychology,قابلیت ٹیسٹ۔,EQ ٹیسٹ۔,کامیابی کا امتحان,رفتار ٹیسٹ.,سیان نے ایسے لوگوں کی شناخت کے لیے ایک ٹیسٹ لیا ہے جو شہری حقوق کے عظیم وکیل بننے کی صلاحیت رکھتے ہیں۔ اس طرح کے ٹیسٹ کو a(n) کے طور پر درجہ بندی کیا جائے گا۔
1,high_school_psychology,ایک آرم چیئر، ایک چیئر لفٹ، اور ایک وہیل چیئر۔,اسکول سے وابستہ پریشانی کا احساس۔,چار ٹانگیں اور ایک سیٹ۔,ایک میز اور/یا میز۔,ایک امریکی نوجوان کی کرسی کے پروٹو ٹائپ میں شامل ہونے کا زیادہ امکان ہے۔
3,high_school_psychology,بائیں عارضی,دائیں parietal,دائیں وقتی,دائیں فرنٹل,زبان کو سمجھنے کی صلاحیت میں کمی کا نتیجہ مندرجہ ذیل میں سے کس لاب میں ٹشو کے نقصان سے ہوتا ہے؟
1,high_school_psychology,eidetic میموری,طریقہ کار میموری,معنوی میموری,ایپیسوڈک میموری,درختوں کی مختلف اقسام کا علم اور وہ کہاں بڑھتے ہیں اس کی ایک مثال یہ ہے کہ طویل مدتی یادداشت کس قسم کی ہے؟
1,high_school_psychology,یہ صرف پوسٹ سینیپٹک نیوران میں ہوتا ہے۔,جب یہ سوما کے ساتھ سفر کرتا ہے تو اس کی طاقت کم ہوتی جاتی ہے۔,اس میں تمام یا کوئی بھی معیار ہے: یہ یا تو ہوتا ہے، یا ایسا نہیں ہوتا ہے۔,یہ آہستہ آہستہ ہوتا ہے جب نیوران ہائپر پولرائزیشن تک پہنچ جاتا ہے۔,مندرجہ ذیل میں سے کون سب سے زیادہ درست طریقے سے نیوران کی فائرنگ کو بیان کرتا ہے؟
3,high_school_psychology,لائسنس,پھول,کمپیوٹر,گھر,سنگل ٹرائل فری-ریکال ٹاسک میں حصہ لینے والے کو الفاظ کی فہرست، ایک وقت میں ایک، درج ذیل ترتیب میں پیش کی جاتی ہے: گھر، پھول، کتا، میز، لائسنس، پانی، کمپیوٹر، سلاد۔ سیریل پوزیشن وکر کے مطابق، مندرجہ ذیل الفاظ میں سے کون سا حصہ لینے والا سب سے زیادہ بھول سکتا ہے؟
0,high_school_psychology,نیم تجربہ,کنٹرول شدہ تجربہ,سروے,قدرتی مشاہدہ,جیوتی لوگوں کے رویے کو نوٹ کرتی ہے جب وہ راک کنسرٹس کے ٹکٹوں کے لیے قطار میں کھڑے ہوتے ہیں۔ وہ مندرجہ ذیل میں سے کون سا تحقیقی طریقہ استعمال کر رہی ہے؟
1,high_school_psychology,پہلے سال کے ہائی اسکول کے جی پی اے کے ساتھ اسکول کی دلچسپی کے انوینٹری کے اسکورز اور پہلے سال کے ہائی اسکول کے جی پی اے کے ساتھ اہلیت اور کامیابی کے ٹیسٹ کے اسکور کے ارتباط میں فرق,پہلے سال کے ہائی اسکول کے GPA اور اسکول کی دلچسپی کے انوینٹری اسکور کا زیرو آرڈر ارتباط,وہ ڈگری جس میں اسکول کی دلچسپی کے انوینٹری کا اسکور متعدد ارتباط کو بڑھاتا ہے جب اسے پہلے سال کے ہائی اسکول کے GPA کے پیشین گو متغیر کے طور پر شامل کیا جاتا ہے۔,اہلیت اور کامیابی کے ٹیسٹ کے اسکور کا باہمی تعلق,ایک بڑے اسکول ڈسٹرکٹ کا سپرنٹنڈنٹ اسکول کے ماہر نفسیات سے ہائی اسکول کے پہلے سال کے لیے طلباء کے گریڈ پوائنٹ اوسط (GPAs) کی پیشین گوئی کرنے کو کہتا ہے۔ اسکول کے ماہر نفسیات نے رجعت کے تجزیے میں پہلے سال کے ہائی اسکول کے GPA کے لیے پیشین گوئی کے متغیرات کے طور پر کامیابی اور قابلیت کے اسکورز شامل کیے ہیں اور وہ اس بات پر غور کر رہا ہے کہ آیا اسکول کی دلچسپی کی فہرست کا انتظام بھی کیا جائے اور ان اسکورز کو بھی شامل کیا جائے۔ یہ فیصلہ کرتے وقت اسکول کے ماہر نفسیات کی سب سے بڑی تشویش مندرجہ ذیل میں سے کون سی ہونی چاہیے؟
1,high_school_psychology,کیرن ہارنی,بی ایف سکنر,کارل جنگ,سگمنڈ فرائیڈ,اجتماعی لاشعور، آثار قدیمہ، اور انفرادیت شخصیت کے تصورات ہیں جن سے سب سے زیادہ قریب سے وابستہ ہیں۔
3,high_school_psychology,زبان ہمارے سوچنے کا انداز طے کرتی ہے۔,ہم ماڈلز کا مشاہدہ اور نقل کرتے ہیں۔,بندروں کے پاس زبان نہیں ہے کیونکہ وہ مناسب نحو استعمال نہیں کرتے ہیں۔,ہمارے پاس زبان کے حصول کا ایک فطری آلہ ہے۔,وورف کے لسانی رشتہ داری کے مفروضے کے مطابق،
2,high_school_psychology,انگریزی,جاپانی,کینیڈین,ریاست ہائے متحدہ امریکہ,جب ایک 17 سالہ طالب علم اسکول میں فیل ہوتا ہے، تو کون سا معاشرہ زیادہ تر والدین کو جوابدہ ٹھہرائے گا؟
0,high_school_psychology,ریاضیاتی استدلال,تجزیاتی استدلال,منطق,زبان,زیادہ تر لوگوں میں، دماغ کے بائیں نصف کرہ کے لئے غالب ہے
3,high_school_psychology,مجبوری,جنونی,شیزوفرینک,نفسیاتی,جینیٹ نے سامنے کا دروازہ لاک کیا اور پھر دستک گھما کر اسے چیک کیا۔ اس نے دوسری بار اسے چیک کیا۔ سڑک پر آدھے راستے پر چلنے کے بعد، جینیٹ دروازے پر واپس گئی اور اس بات کو یقینی بنانے کے لیے چیک کیا کہ یہ بند ہے۔ اس کا رویہ ایسا لگتا ہے۔
3,high_school_psychology,سیاہ فام نوجوان سفید فام نوجوانوں سے برتر ہیں۔,ہسپانوی نوجوان سیاہ فام نوجوانوں سے برتر ہیں۔,ایشیائی نوجوان سیاہ فام نوجوانوں سے برتر ہیں۔,سفید فام نوجوان سیاہ فام نوجوانوں سے برتر ہیں۔,عائشہ ایک خوبصورت، سیاہ فام نوجوان ہے۔ اگر وہ عام ہے، تو وہ غالباً اس پر یقین رکھتی ہے۔
0,high_school_psychology,خود شناسی کی تعلیم,شعور کے بنیادی عناصر,رویے کی سب سے چھوٹی اکائی کی شناخت,طرز عمل کا مقصد,ولیم جیمز جیسے فنکشنلسٹ بنیادی طور پر دلچسپی رکھتے تھے۔
3,high_school_psychology,منظم غیر حساسیت,بنیادی روک تھام,علامت کا متبادل,کاؤنٹر کنڈیشنگ,کس قسم کی تھراپی میں رویے اور علمی مداخلت دونوں شامل ہیں؟
3,high_school_psychology,داخلی اور خارجی محرک,ہمدرد اور خود مختار حوصلہ افزائی,کنٹرول کا مثبت اور منفی مقام,پرائمری اور سیکنڈری ڈرائیوز,جارجیا مقامی ہسپتال میں کام کرتی ہے کیونکہ وہ دوسروں کی مدد کرنا چاہتی ہے، جب کہ کیتھی پیسے کمانے کے لیے ہسپتال میں سختی سے کام کرتی ہے۔ ان کے انفرادی محرکات کے درمیان فرق کو ظاہر کرتے ہیں۔
0,high_school_psychology,متغیر تناسب,مقررہ وقفہ,مقررہ تناسب,مسلسل,مندرجہ ذیل میں سے کون سے کمک کے نظام الاوقات کے نتیجے میں ایسے رویے کی بحالی ہوتی ہے جو معدومیت کے لیے کم سے کم مزاحم ہے؟
3,high_school_psychology,برقی محرک,درد پر توجہ مرکوز,ذہنی دباؤ,بے چینی,گیٹ کنٹرول تھیوری کے مطابق، کونسی حالت گیٹ کو بند کرنے کا رجحان رکھتی ہے؟
1,high_school_psychology,eidetic میموری,طریقہ کار میموری,معنوی میموری,ایپیسوڈک میموری,درختوں کی مختلف اقسام کا علم اور وہ کہاں بڑھتے ہیں اس کی ایک مثال یہ ہے کہ طویل مدتی یادداشت کس قسم کی ہے؟
