answer,subject,choice_3,choice_2,choice_1,choice_0,question
2,high_school_psychology,سائز کی استحکام,شکل کی مستقل مزاجی,بندش,رنگ کی استحکام,آپ کے سامنے کے دروازے کو ایک مستطیل کے طور پر سمجھنے کی صلاحیت یہاں تک کہ جب یہ کھلا ہو، ایک مختلف ریٹنا تصویر کی نمائش کے طور پر جانا جاتا ہے
0,high_school_psychology,پیرافیلیا,ذہن پر چھا جانے والا۔اضطراری عارضہ۔,پاگل پن,اہم ڈپریشن کی خرابی.,یہ تجویز کیا گیا ہے کہ سیکھی ہوئی بے بسی کا تعلق ہوسکتا ہے۔
2,high_school_psychology,اپنے درجات کو بہتر بنانے کے لیے مطالعہ کریں۔,کھانا کھاؤ,ایک رومانوی دلچسپی کا پیچھا کریں.,خطرناک رویے میں مشغول.,سام کے خون کے دھارے میں گلوکوز کی کم سطح اس کی خواہش پیدا کرنے کا زیادہ امکان ہے۔
0,high_school_psychology,دلکش استدلال,استخراجی استدلال,ٹکڑا,زبان کی نوک کا رجحان,"ٹونیا سڑک پر ایک پرانے اسکول کے ساتھی سے مل جاتی ہے۔ اپنی مختصر گفتگو کے دوران، ٹونیا اپنے ساتھی کا نام یاد کرنے سے قاصر ہے۔ دنوں بعد، اسے نیلے رنگ کا نام یاد آیا۔ ""نیلے سے باہر"" نام کو یاد رکھنا ایک مثال ہے۔"
0,high_school_psychology,یادداشت میں سیربیلم کا کردار۔,جس شرح سے لوگ معلومات کو بھول جاتے ہیں۔,سیریل پوزیشن اثر.,میموری کی تعمیر نو کی نوعیت۔,متعدد تجربات میں، الزبتھ لوفٹس نے یہ ظاہر کیا ہے کہ کسی سوال کے الفاظ شرکاء کے کسی واقعے کی یاد کو متاثر کر سکتے ہیں۔ یہ مطالعہ بہترین وضاحت کرتے ہیں۔
1,high_school_psychology,سائنسی طریقہ کار,ادراک,نفسیات,حیاتیات,ذہنی عمل اور رویے کی سائنسی تحقیقات کہلاتی ہیں۔
3,high_school_psychology,زبان کے حصول کا آلہ,لسانی رشتہ داری کا مفروضہ,مورفیمز,فونیم,نوم چومسکی اور بی ایف سکنر نے اس بات پر اختلاف کیا کہ بچے زبان کیسے حاصل کرتے ہیں۔ مندرجہ ذیل تصورات میں سے کون سا ان کے نظریات کے درمیان فرق سے زیادہ متعلقہ ہے؟
2,high_school_psychology,نصاب پر مبنی,ماحولیاتی,علمی,شخصیت,کس قسم کی تشخیص کسی فرد کے ماحول اور رویے کے پہلوؤں کے درمیان تعلق کی چھان بین کرکے، سب سے زیادہ دباؤ والے طرز عمل کے مسئلے کی نشاندہی کرنے کی کوشش کرتی ہے، اور اس کو کم کرنے کے ممکنہ طریقے؟
3,high_school_psychology,اب مشروط ردعمل کو جنم نہیں دیتا,مشروط ردعمل کو جنم دیتا ہے۔,غیر مشروط محرک کو کامیاب کرتا ہے۔,غیر مشروط محرک سے پہلے,معدومیت اس وقت ہوتی ہے جب مشروط محرک
0,high_school_psychology,رویے کے لیے انعامات اور سزائیں انسانوں میں سیکھنے پر بڑا اثر ڈالتی ہیں۔,انسانوں میں اخلاقی انتخاب کے بارے میں سوچنے کی بڑھتی ہوئی صلاحیتیں پیدا ہوتی ہیں، اور دوسروں کے حقوق کے بارے میں سوچنے کی ہماری صلاحیت وقت کے ساتھ ساتھ ترقی کرتی ہے۔,جیسا کہ ہم نئے سماجی حالات کا سامنا کرتے ہیں، ہم سماجی تقاضوں سے نمٹنے کے لیے یا تو صحت مند یا غیر صحت مند شخصیت کی خصوصیات پیدا کرتے ہیں۔,جب ہم نئی معلومات کو ضم نہیں کر سکتے ہیں، تو ہم رہائش کے ذریعے اپنے سکیموں کو تبدیل کرتے ہیں۔,Piaget اپنے علمی ترقی کے نظریہ سے اصطلاحات کا استعمال کرتے ہوئے کچھ نیا سیکھنے کے عمل کو کیسے بیان کرے گا؟
3,high_school_psychology,اگر کوئی نفسیاتی وصف جینیاتی طور پر متاثر ہوتا ہے، تو برادرانہ جڑواں بچوں اور دیگر بہن بھائیوں کی نسبت ایک جیسے جڑواں بچوں میں اس وصف کو شیئر کرنے کا زیادہ امکان ہوتا ہے۔,MZ جڑواں بچوں میں تعلق کی ڈگری کا تعین متعلقہ DZ جڑواں بچوں کے رویے کی جینیات کے مطالعہ کے ذریعے کیا جا سکتا ہے۔,اگر کوئی نفسیاتی وصف جینیاتی طور پر متاثر ہوتا ہے، تو ایک دوسرے کے ساتھ پالے جانے والے بہن بھائیوں میں ایک جیسے یا برادرانہ جڑواں بچوں کے مقابلے میں اس کا اشتراک کرنے کا زیادہ امکان ہوتا ہے جو الگ پالے جاتے ہیں۔,اگر کوئی نفسیاتی وصف جینیاتی طور پر متاثر ہوتا ہے، تو برادرانہ جڑواں بچے ایک جیسے جڑواں بچوں یا دوسرے بہن بھائیوں کے مقابلے میں اس وصف کو شیئر کرنے کا زیادہ امکان رکھتے ہیں۔,مندرجہ ذیل میں سے کون بہتر بتاتا ہے کہ جڑواں بچوں کا مطالعہ رویے کی جینیات کے شعبے میں کیوں اہم ہے؟
3,high_school_psychology,کس حد تک پیدائشی حیاتیاتی عمل بمقابلہ ماحولیاتی واقعات انسانی رویے کا تعین کرتے ہیں؟,فطرت میں اپنی نوجوان متوازی دوسری نسلوں کی پرورش کرنے کی انسانی صلاحیت کس حد تک ہے؟,کس حد تک بیرونی کنڈیشنگ محرکات انسانی رویے کے حوالے سے انفرادی فوکس کو اوور رائیڈ کرتے ہیں؟,انسانی رویہ کس حد تک آزاد مرضی کے مقابلے میں عزم کا نتیجہ ہے؟,مندرجہ ذیل میں سے کون سا سوال فطرت کی پرورش کے تنازعہ کو بہتر بناتا ہے؟
2,high_school_psychology,صنف کے لحاظ سے مناسب رویوں کی مسلسل تقویت اور صنفی نامناسب رویوں کی سزا,اہم رول ماڈل کا مشاہدہ اور تقلید,Oedipal کمپلیکس کی قرارداد جس کے نتیجے میں ہم جنس والدین کے ساتھ شناخت ہوتی ہے۔,قبل از پیدائش کی نشوونما کے دوران چھپنے والے جنسی کروموسوم اور ہارمونز میں کروموسومل فرق,سماجی سیکھنے کے نظریہ کے مطابق، صنفی شناخت بنیادی طور پر اس سے حاصل ہوتی ہے۔
3,high_school_psychology,مزاج,سیکھنا,ثقافت,ماحول,فطرت بمقابلہ پرورش کی بحث میں، فطرت سب سے زیادہ قریب سے وابستہ ہے۔
1,high_school_psychology,منصفانہ,قابل اعتماد,معیاری,درست,وہ ٹیسٹ جن کی آبادی کے نمونے کے ساتھ پہلے ٹیسٹ کیے گئے ہیں جن کے لیے ٹیسٹ کرنا ہے اور ان میں ہدایات اور انتظامی طریقہ کار کا یکساں سیٹ ہے
2,high_school_psychology,تجویز ہے کہ تشخیص کو منسوخ کر دیا جائے۔,ٹیسٹ کی صرف تازہ ترین شکل کے انتظام پر اصرار کریں۔,پوچھیں کہ نئے فارم کی کم از کم چند کاپیاں موازنہ کے لیے دی جائیں۔,پرانے فارم کا انتظام کریں لیکن نئے اصول استعمال کریں۔,ایک نیا امتحانی فارم خریدنے کے اخراجات کو بچانے کے لیے، ایک چیف اسکول ایڈمنسٹریٹر ایک تصدیق شدہ اسکول کے ماہر نفسیات سے ایک کامیابی کے امتحان کے چھ سال پرانے فارم کا انتظام کرنے کے لیے کہتا ہے جو اس وقت کے اسکول ڈسٹرکٹ کے نصاب سے متفق ہو۔ نیشنل ایسوسی ایشن آف سکول سائیکالوجسٹس (NASP) کی صورت حال اور پیشہ ورانہ اخلاقیات کے اصولوں پر غور کرتے ہوئے سکول کے ماہر نفسیات کو چاہیے
0,high_school_psychology,ڈان، جس میں ہائپوکونڈریاسس کی علامات ہیں۔,کلارا، جو زو فوبیا کی علامات کا شکار ہے۔,بریٹ، جو جنونی مجبوری عارضے میں مبتلا ہے۔,ہارون، جو غیر منظم شیزوفرینیا کی علامات کا شکار ہے۔,اگر کسی جرم کے ارتکاب پر گرفتار کیا جاتا ہے، تو درج ذیل میں سے کس کو قانونی طور پر پاگل قرار دیا جائے گا؟
2,high_school_psychology,غیر مشروط محرک کے ساتھ رویے کا بدلہ دینا، جیسے کھانا,غیر مشروط محرک کو مشروط محرک کے ساتھ جوڑنا,مطلوبہ رویے سے ملتے جلتے رویے کے لیے کسی حیاتیات کو تقویت دینا,کمک یا سزا کے ساتھ جواب کے بعد,کلاسیکی کنڈیشنگ کی کسی بھی مثال میں پہلا قدم کیا ہے؟
3,high_school_psychology,سلاخوں اور شنک؛ دوئبرووی خلیات؛ گینگلیون خلیات؛ بصری اعصاب,سلاخوں اور شنک؛ ریٹنا بصری اعصاب؛ گینگلیون خلیات,دوئبرووی خلیات؛ گینگلیون خلیات؛ fovea بصری اعصاب,بصری اعصاب؛ گینگلیون خلیات؛ دوئبرووی خلیات؛ سلاخوں اور شنک,مندرجہ ذیل میں سے کون بصری معلومات کی ترسیل کے حکم کو درست طریقے سے بیان کرتا ہے؟
3,high_school_psychology,صرف I اور II,صرف III,صرف II,صرف میں,حادثے کے نتیجے میں عبدل کی دائیں آنکھ کی بینائی چلی گئی۔ گاڑی چلاتے وقت گاڑیوں کے فاصلے کا اندازہ لگانے کے لیے، عبدل اشارے پر بھروسہ کرنے کے قابل ہے۔
3,high_school_psychology,خوشی، غم، خوف، غصہ، تعجب، اور نفرت,خوشی، غم، خواہش، پسپائی، خوف، اور حیرت,خوشی، غم، بے حسی، خوف، حیرت، اور ناپسندیدگی,خوشی، غم، غصہ، نفرت، ہوس، اور حیرت,بعض بین الثقافتی مطالعات نے تجویز کیا ہے کہ چہرے کے چھ تاثرات تقریباً ہر ثقافت کے لوگ پہچانتے ہیں۔ مندرجہ ذیل میں سے کون صحیح طریقے سے ان تاثرات کی فہرست دیتا ہے؟
1,high_school_psychology,دائیں اور بائیں نصف کرہ.,سیریبیلم اور سیریبرم۔,پچھلے دماغ اور وسط دماغ.,پیشانی اور RAS.,دماغی نظام پر مشتمل ہے۔
3,high_school_psychology,لکیری نقطہ نظر,بندش,ہم آہنگی,ریٹنا تفاوت,پنسل ڈرائنگ کرنے والا فنکار اپنی یا اپنی ڈرائنگ میں گہرائی بڑھانے کے لیے درج ذیل میں سے کون سی تکنیک استعمال کرسکتا ہے؟
3,high_school_psychology,فرق کی حد,نیچے سے اوپر پروسیسنگ,سگنل کا پتہ لگانے کا نظریہ,مطلق حد,ایک موسیقار کی دو بہت ہی ملتے جلتے پچوں کے درمیان فرق کرنے کی صلاحیت مندرجہ ذیل میں سے کس تصور پر منحصر ہے؟
1,high_school_psychology,ایرکسن بیلنٹ,جیمز لینج,Schachter-گلوکار,کینن بارڈ,جب اینٹونیٹ اپنے اپارٹمنٹ میں گھر آتی ہے تو لوگ اچانک اس کی طرف کود پڑتے ہیں۔ اس کا دل دھڑکنے لگتا ہے اور وہ چیخنے لگتا ہے۔ ایک بار جب وہ پہچان لیتی ہے کہ اس کے دوست ننجا کی بجائے ایک سرپرائز پارٹی دے رہے ہیں، اس کا دل دوڑتا رہتا ہے، لیکن اسے خوشی ہوتی ہے۔ جذبات کا کون سا نظریہ اس حقیقت کی بہترین وضاحت کرتا ہے؟
1,high_school_psychology,ارتباطی تحقیق,قدرتی مشاہدہ,ایک کیس کا مطالعہ,ایک تجربہ,کسی نایاب حالت کی تحقیق کے لیے چند مضامین کا بہت گہرائی سے مطالعہ کرنا کہلاتا ہے۔
1,high_school_psychology,جیمز لینج کا نظریہ,تھیلامک تھیوری,دو عنصر کا نظریہ,سماجی سہولت کا نظریہ,علمی نفسیات کے ماہرین جذبات کے کس نظریے کی حمایت کرتے ہیں؟
0,high_school_psychology,GABA,رطوبتیں,ہارمونز,اینڈورفنز,منشیات کام کرتی ہیں کیونکہ وہ کیمیائی طور پر بہت ملتے جلتے ہیں۔
3,high_school_psychology,دستیابی کا جائزہ,حد سے زیادہ اعتماد,فریمنگ اثر,یقین استقامت,مندرجہ ذیل میں سے کون سا براہ راست لوگوں کے ہوائی سفری آفات، جوہری توانائی کے حادثات، اور دہشت گردی کے تشدد کے امکانات کے مبالغہ آمیز تصورات میں سب سے زیادہ تعاون کرتا ہے؟
3,high_school_psychology,مشروط محرک کے بعد آنے والی چیزوں کی توقع,مشروط محرک اور غیر مشروط ردعمل کے درمیان تعلق,غیر مشروط محرک اور مشروط محرک کے درمیان تعلق,غیر مشروط محرک اور غیر مشروط ردعمل کے درمیان تعلق,علمی ماہرین کا دعویٰ ہے کہ کلاسیکی کنڈیشنگ کا نتیجہ ہے۔
2,high_school_psychology,ایم ایم پی آئی,پی ای ٹی,ایم آر آئی,کیٹ,ایک ڈاکٹر کو شبہ ہے کہ اس کے مریض کا لینگویج پروسیسنگ ایریا دائیں نصف کرہ میں ہے۔ یہ سب سے زیادہ امکان کے استعمال کی طرف سے تصدیق کی جائے گی
2,high_school_psychology,سلاخوں اور شنک,پریشر ریسیپٹرز,پٹھوں کو متاثر کرنے والے,غدود کے اثرات,مکینیکل توانائی کو الیکٹرو کیمیکل توانائی میں منتقل کیا جاتا ہے۔
3,high_school_psychology,اوسط,موڈ,ارتباط گتانک,معیاری انحراف,"ڈیوڈ نے 15 تحقیقی شرکاء کا ڈیٹا اکٹھا کیا۔ ان کے اسکور تھے: 42, 38, 14, 13, 12, 12, 11, 11, 11, 10, 10, 10, 9, 9, 9۔ مندرجہ ذیل میں سے کون سے اعداد و شمار اس ڈیٹا سیٹ کے مرکزی رجحان کی بہترین عکاسی کرتے ہیں؟"
3,high_school_psychology,مورفیمز,سیمنٹکس,فینوٹائپس,فونیم,کسی زبان میں معنی کی سب سے چھوٹی اکائیاں ہیں۔
2,high_school_psychology,ہائپر پولرائزیشن کے نتائج,ایک عمل کی صلاحیت پیدا ہوتی ہے,ایک درجہ بندی کی صلاحیت بنتی ہے۔,ایک آرام دہ ممکنہ واپسی,نیوران کے فائر ہونے کے بعد،
2,high_school_psychology,فونیم,نحو,گرائمر,سیمنٹکس,وہ قواعد جو جملے میں الفاظ اور فقروں کی جگہ کو کنٹرول کرتے ہیں کہلاتے ہیں۔
3,high_school_psychology,مسلسل,متغیر تناسب,مقررہ وقفہ,مقررہ تناسب,سولیڈاد کے ذریعہ تقویت کے کس شیڈول کی پیروی کی جاتی ہے، جو اس کے دوست کے بھیجے گئے ہر ای میل کا جواب دیتا ہے؟
0,high_school_psychology,کلاسیکی کنڈیشنگ,منفی کمک,مثبت طاقت,امید,سیکھی ہوئی بے بسی کی طاقت کی ایک مثال ہے۔
1,high_school_psychology,جبر,معقولیت,سربلندی,نقل مکانی,سوزی کے ڈیلن کے ساتھ پروم میں جانے کا فیصلہ کرنے کے بعد، میکس لاشعوری طور پر غصے میں تھا۔ میکس نے پھر اپنی تمام توانائیاں اپنے فن پارے میں لگا دیں۔ میکس کون سا دفاعی طریقہ کار استعمال کر رہا ہے؟
3,high_school_psychology,کہ سیکھنا بصیرت کے ذریعے ہو سکتا ہے۔,پریمیٹس میں اویکت سیکھنا۔,کہ بندر اپنے قدرتی ماحول سے اشیاء کو بطور اوزار استعمال کرنے کے قابل ہوتے ہیں۔,بندروں کی بات چیت کرنے کی صلاحیت۔,بندروں کے ساتھ کوہلر کے مطالعے کو مظاہرے کے طور پر دیکھا جاتا ہے۔
3,high_school_psychology,لکیری نقطہ نظر,بندش,ہم آہنگی,ریٹنا تفاوت,پنسل ڈرائنگ کرنے والا فنکار اپنی یا اپنی ڈرائنگ میں گہرائی بڑھانے کے لیے درج ذیل میں سے کون سی تکنیک استعمال کرسکتا ہے؟
3,high_school_psychology,ہوا سے آوازیں اکٹھا کریں اور فوکس کریں۔,کان کے پردے کی حفاظت کریں جب کہ یہ آواز کو منتقل کرتا ہے۔,اندرونی کان میں سیلیا کو پرجوش کرکے آواز کو منظم کریں۔,ossicles کو متحرک کرنے کے لیے آواز کی لہروں کو منتقل کریں۔,بیرونی کان کا کردار ہے۔
2,high_school_psychology,مفروضے کا امتحان,تحفظ کے تصورات,منسلکہ,آبجیکٹ کی مستقل مزاجی,Piaget اس بات کا تعین کرنے کے لیے کیا ٹیسٹ کرے گا کہ آیا بچہ علمی نشوونما کے پہلے سے آپریشنل یا ٹھوس آپریشنل مرحلے میں ہے؟
3,high_school_psychology,بحالی کی ریہرسل,چنکنگ,تفصیلی ریہرسل,مشہور یادداشت,اسکول جاتے ہوئے، ایلیس نے ریڈیو پر کنسرٹ کے ٹکٹ دینے کے بارے میں سنا۔ اسے جیتنے کے لیے ساتویں کالر بننا ہے۔ اوپر کھینچتے ہوئے تاکہ وہ کال کر سکے، اس نے کئی بار خود سے نمبر دہرایا۔ ایلیس فون نمبر یاد رکھنے کے لیے درج ذیل میں سے کس کا استعمال کر رہی تھی؟
3,high_school_psychology,ہائپوتھیلمس,amygdala,میڈولا,سیریبیلم,مندرجہ ذیل میں سے کون سا دماغی ڈھانچہ بھوک کی تحریک میں سب سے زیادہ مرکزی طور پر شامل ہے؟
0,high_school_psychology,صرف 3 اور 4 کی فہرست,فہرست 4 صرف,فہرست 3 صرف,فہرست صرف 1,آپ کو سیکھنے کے لیے الفاظ کی چار فہرستیں دی گئی ہیں: 1، 2، 3، اور 4۔ آپ کو فہرست 1، پھر فہرست 2، وغیرہ کو سیکھنا چاہیے۔ کون سی فہرست (زبانیں) فہرست 2 کو یاد رکھنے میں فعال مداخلت کا سبب بنیں گی؟
0,high_school_psychology,ثقافتوں نے مختلف زبانیں تیار کیں۔,فونیمز مورفیمز کے ساتھ تبدیل نہیں ہوتے ہیں۔,والدین بچوں سے بات کرتے وقت اونچی آواز کا استعمال کرتے ہیں۔,Eskimos برف سے متعلق بہت سے الفاظ ہیں,لسانی رشتہ داری کا وہرفین مفروضہ اس کی وضاحت میں مدد کرتا ہے۔
2,high_school_psychology,olfaction,بقیہ,melatonin,ٹون کا معیار,اندرونی کان کی نیم سرکلر نہریں کسی شخص کو برقرار رکھنے میں مدد کرنے کے لیے اہم ہیں۔
0,high_school_psychology,الگ الگ,گروپ پولرائزیشن,ذمہ داری کا پھیلاؤ,اعلی اہداف,شریف کے ڈاکو غار کے مطالعہ نے اشارہ کیا کہ درج ذیل میں سے کون سا اصول گروپوں کے درمیان تناؤ کو کم کرنے میں بہترین مدد کرتا ہے؟
1,high_school_psychology,منفی کمک,تعمیل کی تعلیم,منفی سزا,بچنے والا منسلکہ,بچے کے غلط برتاؤ کے بعد بچے کو دو ہفتوں تک گراؤنڈ کرنا اس کی ایک مثال ہے۔
2,high_school_psychology,انسانی نظریہ,سماجی سیکھنے کا نظریہ,نفسیاتی نظریہ,نفسیاتی نظریہ,کارٹون دیکھنے کے بعد جن میں کردار دوسرے کرداروں کو مارتے، گھونستے اور لات مارتے ہیں، نرسری اسکول کے طلباء بارنی کو دیکھنے کے مقابلے میں زیادہ جارحانہ رویے میں مشغول ہوتے ہیں۔ یہ مشاہدہ بہترین تائید کرتا ہے۔
2,high_school_psychology,گروپ اے کے ارکان اپنی اصل پوزیشن برقرار رکھیں گے، لیکن گروپ بی کے ارکان اپنی پوزیشنوں کو معتدل کریں گے۔,گروپ اے زیادہ مضبوطی سے مضبوط ہو جائے گا، جبکہ گروپ بی کے ممبران اپنی پوزیشن کو معتدل کریں گے۔,گروپ اے کے ارکان اپنی پوزیشنوں کو معتدل کریں گے، لیکن گروپ بی کے ارکان اپنی اصل پوزیشن برقرار رکھیں گے۔,دونوں گروپ اپنی پوزیشن کو معتدل کریں گے۔,کوآپریٹو لرننگ کے دوران، گروپ اے کے ممبران میں سے تمام طلباء ابتدائی طور پر سزائے موت کے مخالف تھے، جب کہ گروپ بی کے اراکین میں سے دو طالب علم سزائے موت کے مخالف تھے اور دو سزائے موت کے حق میں تھے۔ تحقیق کے مطابق، سزائے موت کے بارے میں ہر گروپ کے اندر شدید بحث کے بعد، ہم توقع کریں گے۔
0,high_school_psychology,رول تھیوری,چالو کرنے کی ترکیب,علیحدگی,رواداری,دستبرداری کی علامات سب سے زیادہ براہ راست درج ذیل میں سے کس عمل کی وجہ سے ہوتی ہیں؟
1,high_school_psychology,کینن بارڈ تھیوری,جیمز لینج کا نظریہ,دو عنصر کا نظریہ,موافقت کی سطح کا رجحان,آج سوزن نے اپنی الرجی کے لیے ایک گولی کھائی جس سے اس کا بلڈ پریشر بڑھ گیا، اس کے دل کی دھڑکن تیز ہوئی، اور اس کے جسم کا درجہ حرارت بڑھ گیا۔ اب ٹریفک میں پھنس کر اسے غصہ آتا ہے۔ کل جب اس نے گولی کھائی تو وہ اپنے شوہر کے ساتھ تھی۔ جب اس کا بلڈ پریشر بڑھ گیا، اس کے دل کی رفتار تیز ہو گئی، وہ گرم ہو گئی، اور اس نے دلکش محسوس کیا۔ یہ تفصیل اس کی مثال دیتی ہے۔
1,high_school_psychology,کنکریٹ آپریشنل,علامتی,پری آپریشنل,سینسری موٹر,بچے اندرونی نمائندگی کے نظام کو تیار کرتے ہیں جو انہیں زبانی طور پر لوگوں، واقعات اور احساسات کو بیان کرنے کی اجازت دیتے ہیں جس کے دوران پیگیٹ کے علمی نشوونما کے مراحل میں سے کون سا مرحلہ ہے؟
2,high_school_psychology,نقل مکانی,پروجیکشن,رجعت,جبر,چنٹل کا کہنا ہے کہ اس کی ماں دبنگ اور دبنگ ہے۔ چنٹل کے تمام دوست اس بات پر متفق ہیں کہ وہ وہی ہے جس میں یہ خصوصیات ہیں، اس کی ماں نہیں۔ فرائڈ تجویز کرے گا کہ چنٹل کا طرز عمل مندرجہ ذیل میں سے کس دفاعی طریقہ کار کی مثال دیتا ہے؟
3,high_school_psychology,امتیازی سلوک,کیتھرسس,کنڈیشنگ,تعصب,مندرجہ ذیل میں سے کون سی اصطلاحات مخصوص گروہوں کے لیے منفی رویوں کے رویے کے جزو کو بیان کرتی ہیں؟
0,high_school_psychology,اچانک بحالی,معدومیت کی آزمائشیں,عام کرنا,حصول کے ٹرائلز,ایک غیر جانبدار محرک جو ایک غیر مشروط محرک کا اشارہ دیتا ہے ایک ایسا ردعمل پیدا کرنا شروع کر دیتا ہے جو اس دوران غیر مشروط محرک کی توقع اور تیاری کرتا ہے۔
0,high_school_psychology,ذہنی دباؤ,dissociative خرابی کی شکایت,فکری معذوری۔,شقاق دماغی,مندرجہ ذیل میں سے کون سی اصطلاح متعدد نفسیاتی عوارض کو بیان کرنے کے لیے استعمال کی جاتی ہے جن میں انسانی نفسیات کے تقریباً ہر جہت بشمول سوچ، ادراک، برتاؤ اور بات چیت میں خلل پڑتا ہے؟
